,article_name,article_img,article_base_price,article_SKU,article_big_price,article_big_price_type
177,Nivea Men Craft Stylers Defining Styling Gel 150 ml,https://cdn.carrefour.eu/160_06235261_4005900660312_00.jpeg,"6,19€",Per stuk,"41,27€",/l
178,Schwarzkopf Gliss Kur Supreme Length Anti-Klit Spray 200 ml,https://cdn.carrefour.eu/160_06163439_5410091749019_01.jpeg,"6,75€",Per stuk,"33,75€",/l
179,Rexona Men Roll-On Deodorant Cobalt Dry 50 ml,https://cdn.carrefour.eu/160_05838646_50096954_00.jpeg,"3,65€",Per stuk,"73,00€",/l
180,WILKINSON SWORD Hydro3 Scheermesjes 4 st,https://cdn.carrefour.eu/160_05762318_4027800102006_00.jpeg,"12,49€",Per stuk,"12,49€",/stuk
181,"Braun Series3 3000BT Elektrisch Scheerapparaat, Scheermes Zwart/Grijs",https://cdn.carrefour.eu/160_05837541_4210201151500_00.jpeg,"89,99€",Per stuk,"89,99€",/stuk
182,Nivea Men Sensitive Protect 48h Anti-Transpirant 150 ml,https://cdn.carrefour.eu/160_06010512_4005900457561_00.jpeg,"3,09€",Per stuk,"20,60€",/l
183,Nivea Men Protect & Care 48h Anti-Transpirant 150 ml,https://cdn.carrefour.eu/160_06010515_4005900457707_00.jpeg,"3,95€",Per stuk,"26,33€",/l
184,Nivea Men Black & White Invisible Original 48h Anti-Transpirant 50 ml,https://cdn.carrefour.eu/160_06018317_42345145_00.jpeg,"2,55€",Per stuk,"53,00€",/l
185,"Gillette Sensor3 Comfort Wegwerpmesje Voor Mannen, Verpakking Van 4+2",https://cdn.carrefour.eu/160_06168453_7702018490356_00.jpeg,"9,49€",Per stuk,"9,49€",/stuk
186,"King C. Gillette Balsem Voor Een Zachte Baard Voor Mannen, 100 ml",https://cdn.carrefour.eu/160_06510703_8001841705552_00.jpeg,"10,69€",Per stuk,"106,90€",/l
187,Head & Shoulders Intense Hydration Conditioner 220ml,https://cdn.carrefour.eu/160_06357479_8001841407463_00.jpeg,"5,29€",Per stuk,"24,05€",/l
188,Axe Aftershave Marine 100 ml,https://cdn.carrefour.eu/160_06478646_8710847937071_00.jpeg,"7,49€",Per stuk,"74,90€",/l
189,"Gillette ProShield Navulmesjes Voor Scheersysteem Voor Mannen, 3 Stuks",https://cdn.carrefour.eu/160_06617767_7702018560493_00.jpeg,"20,45€",Per stuk,"6,82€",/stuk
190,Gillette ProGlide Power Scheersysteem voor Mannen - 1 mesje,https://cdn.carrefour.eu/160_06617942_7702018558155_00.jpeg,"20,39€",Per stuk,"20,39€",/stuk
191,Gillette Mach3 Turbo Scheersysteem Voor Mannen - 3 mesjes,https://cdn.carrefour.eu/160_06623970_7702018578634_00.jpeg,"17,35€",Per stuk,"18,05€",/stuk
192,Axe Anti-Transpirant Anti-Transpirant Black 150 ml,https://cdn.carrefour.eu/160_06614762_8720181057960_00.jpeg,"4,85€",Per stuk,"32,33€",/l
193,Axe Bodyspray Deodorant Bodyspray Black 150 ml,https://cdn.carrefour.eu/160_06614703_8720181029233_00.jpeg,"4,35€",Per stuk,"29,27€",/l
194,Axe Bodyspray Deodorant Bodyspray Gold 150 ml,https://cdn.carrefour.eu/160_06614701_8720181030185_00.jpeg,"4,95€",Per stuk,"33,00€",/l
195,Axe Anti-Transpirant Anti-Transpirant Dark Temptation 150 ml,https://cdn.carrefour.eu/160_06614767_8720181058004_00.jpeg,"4,75€",Per stuk,"32,33€",/l
196,Axe Bodyspray Deodorant Bodyspray Fresh Forest & Graffiti 150 ml,https://cdn.carrefour.eu/160_06614817_8720181028823_00.jpeg,"4,65€",Per stuk,"31,00€",/l
197,Axe Bodyspray Deodorant Bodyspray You 150 ml,https://cdn.carrefour.eu/160_06614617_8720181027390_00.jpeg,"4,95€",Per stuk,"33,00€",/l
198,Axe Anti-Transpirant Anti-Transpirant Ice Chill 150 ml,https://cdn.carrefour.eu/160_06614765_8720181058042_00.jpeg,"4,79€",Per stuk,"31,93€",/l
199,Axe Anti-Transpirant Anti-Transpirant Gold 150 ml,https://cdn.carrefour.eu/160_06614809_8720181058028_00.jpeg,"4,85€",Per stuk,"32,33€",/l
200,Axe Bodyspray Deodorant Bodyspray Ice Chill 150 ml,https://cdn.carrefour.eu/160_06614668_8720181027758_00.jpeg,"4,45€",Per stuk,"29,67€",/l
201,Axe Bodyspray Deodorant Bodyspray Green Mojito & Cedarwood 150 ml,https://cdn.carrefour.eu/160_06614707_8720181027680_00.jpeg,"4,59€",Per stuk,"31,27€",/l
202,Axe Bodyspray Deodorant Bodyspray Fresh Bergamot & Pink Pepper 150 ml,https://cdn.carrefour.eu/160_06614825_8720181028809_00.jpeg,"4,55€",Per stuk,"30,33€",/l
203,Borotalco Invisible Deo Roll On 48h 50 ml,https://cdn.carrefour.eu/160_06516370_80844044_00.jpeg,"5,35€",Per stuk,"107,00€",/l
204,Head & Shoulders Intense Hydration Conditioner 220ml,https://cdn.carrefour.eu/160_06357479_8001841407463_00.jpeg,"5,29€",Per stuk,"24,05€",/l
205,Axe Aftershave Marine 100 ml,https://cdn.carrefour.eu/160_06478646_8710847937071_00.jpeg,"7,49€",Per stuk,"74,90€",/l
206,"Gillette ProGlide Navulmesjes Voor Scheersysteem Voor Mannen, 3 Stuks",https://cdn.carrefour.eu/160_06617687_7702018563999_00.jpeg,"18,89€",Per stuk,"6,30€",/stuk
207,Gillette ProGlide Scheersysteem Mannen - 2 mesjes,https://cdn.carrefour.eu/160_06617762_7702018558186_00.jpeg,"18,35€",Per stuk,"19,09€",/stuk
208,Gillette Fusion5 Scheersysteem Voor Mannen - 3 mesjes,https://cdn.carrefour.eu/160_06617763_7702018578658_00.jpeg,"21,95€",Per stuk,"22,85€",/stuk
209,"Gillette Mach3 Turbo Navulmesjes Voor Mannen, 4 stuks",https://cdn.carrefour.eu/160_06617765_7702018565832_00.jpeg,"17,35€",Per stuk,"4,34€",/stuk
210,"Gillette Fusion5 Navulmesjes Voor Mannen, 4 Stuks",https://cdn.carrefour.eu/160_06617766_7702018561575_00.jpeg,"21,95€",Per stuk,"5,49€",/stuk
211,"Gillette ProGlide Power Navulmesjes Voor Scheersysteem , 3 Stuks",https://cdn.carrefour.eu/160_06617808_7702018564200_00.jpeg,"20,45€",Per stuk,"6,82€",/stuk
212,Gillette ProShield scheermesje Voor Mannen- 2 mesjes,https://cdn.carrefour.eu/160_06617809_7702018556588_00.jpeg,"20,39€",Per stuk,"20,39€",/stuk
213,"Gillette Fusion5 Power Navulmesjes Voor Mannen, 4 Stuks",https://cdn.carrefour.eu/160_06617943_7702018562381_00.jpeg,"24,99€",Per stuk,"6,25€",/stuk
214,Gillette Mach3 Scheersysteem Voor Mannen - 3 mesjes,https://cdn.carrefour.eu/160_06623891_7702018578559_00.jpeg,"12,09€",Per stuk,"12,09€",/stuk
215,"Gillette SkinGuard Sensitive Navulscheermesjes Aloë Vera, 4 Stuks",https://cdn.carrefour.eu/160_06623896_7702018554102_00.jpeg,"22,79€",Per stuk,"5,70€",/stuk
216,Axe Anti-Transpirant Anti-Transpirant Ice Chill 150 ml,https://cdn.carrefour.eu/160_06614765_8720181058042_00.jpeg,"4,79€",Per stuk,"31,93€",/l
217,Axe Anti-Transpirant Anti-Transpirant Gold 150 ml,https://cdn.carrefour.eu/160_06614809_8720181058028_00.jpeg,"4,85€",Per stuk,"32,33€",/l
218,Axe Bodyspray Deodorant Bodyspray Ice Chill 150 ml,https://cdn.carrefour.eu/160_06614668_8720181027758_00.jpeg,"4,45€",Per stuk,"29,67€",/l
219,Axe Bodyspray Deodorant Bodyspray Green Mojito & Cedarwood 150 ml,https://cdn.carrefour.eu/160_06614707_8720181027680_00.jpeg,"4,59€",Per stuk,"31,27€",/l
220,Axe Bodyspray Deodorant Bodyspray Fresh Bergamot & Pink Pepper 150 ml,https://cdn.carrefour.eu/160_06614825_8720181028809_00.jpeg,"4,55€",Per stuk,"30,33€",/l
221,Borotalco Invisible Deo Roll On 48h 50 ml,https://cdn.carrefour.eu/160_06516370_80844044_00.jpeg,"5,35€",Per stuk,"107,00€",/l
222,"Gillette ProGlide Navulmesjes Voor Scheersysteem Voor Mannen, 3 Stuks",https://cdn.carrefour.eu/160_06617687_7702018563999_00.jpeg,"18,89€",Per stuk,"6,30€",/stuk
223,Gillette ProGlide Scheersysteem Mannen - 2 mesjes,https://cdn.carrefour.eu/160_06617762_7702018558186_00.jpeg,"18,35€",Per stuk,"19,09€",/stuk
224,Gillette Fusion5 Scheersysteem Voor Mannen - 3 mesjes,https://cdn.carrefour.eu/160_06617763_7702018578658_00.jpeg,"21,95€",Per stuk,"22,85€",/stuk
225,"Gillette Mach3 Turbo Navulmesjes Voor Mannen, 4 stuks",https://cdn.carrefour.eu/160_06617765_7702018565832_00.jpeg,"17,35€",Per stuk,"4,34€",/stuk
226,"Gillette Fusion5 Navulmesjes Voor Mannen, 4 Stuks",https://cdn.carrefour.eu/160_06617766_7702018561575_00.jpeg,"21,95€",Per stuk,"5,49€",/stuk
227,"Gillette ProGlide Power Navulmesjes Voor Scheersysteem , 3 Stuks",https://cdn.carrefour.eu/160_06617808_7702018564200_00.jpeg,"20,45€",Per stuk,"6,82€",/stuk
228,Gillette ProShield scheermesje Voor Mannen- 2 mesjes,https://cdn.carrefour.eu/160_06617809_7702018556588_00.jpeg,"20,39€",Per stuk,"20,39€",/stuk
229,"Gillette Fusion5 Power Navulmesjes Voor Mannen, 4 Stuks",https://cdn.carrefour.eu/160_06617943_7702018562381_00.jpeg,"24,99€",Per stuk,"6,25€",/stuk
230,Gillette Mach3 Scheersysteem Voor Mannen - 3 mesjes,https://cdn.carrefour.eu/160_06623891_7702018578559_00.jpeg,"12,09€",Per stuk,"12,09€",/stuk
231,"Gillette SkinGuard Sensitive Navulscheermesjes Aloë Vera, 4 Stuks",https://cdn.carrefour.eu/160_06623896_7702018554102_00.jpeg,"22,79€",Per stuk,"5,70€",/stuk
232,Gillette SkinGuard Sensitive Scheermes Flex Aloë Vera - 3 mesjes,https://cdn.carrefour.eu/160_06623929_7702018578757_00.jpeg,"16,69€",Per stuk,"16,69€",/stuk
233,"Gillette SkinGuard Sensitive Navulscheermesjes Aloë Vera, 8 Stuks",https://cdn.carrefour.eu/160_06623941_7702018554492_00.jpeg,"42,45€",Per stuk,"5,31€",/stuk
234,"Gillette ProShield Chill Navulmesjes Voor Scheersysteem, 6 Stuks",https://cdn.carrefour.eu/160_06623944_7702018560820_00.jpeg,"44,75€",Per stuk,"5,59€",/stuk
235,"Gillette Mach3 Turbo Navulmesjes Voor Mannen, 8 stuks",https://cdn.carrefour.eu/160_06623946_7702018575688_00.jpeg,"32,15€",Per stuk,"4,02€",/stuk
236,"Gillette Mach3 Navulmesjes Voor Mannen, 12 Stuks",https://cdn.carrefour.eu/160_06623947_7702018575565_00.jpeg,"41,39€",Per stuk,"3,45€",/stuk
237,"Gillette Fusion5 Navulmesjes Voor Mannen, 8 Stuks",https://cdn.carrefour.eu/160_06623972_7702018561698_00.jpeg,"39,05€",Per stuk,"4,88€",/stuk
238,"Gillette 4-in-1 Body- en Baardtrimmer, Scheerapparaat en Contourmes",https://cdn.carrefour.eu/160_06623973_7702018573981_00.jpeg,"27,05€",Per stuk,"28,15€",/stuk
239,Dove Men+ Care Douchegel 3 in 1 Endurance 250 ml,https://cdn.carrefour.eu/160_06624610_8720181049538_00.jpeg,"4,09€",Per stuk,"16,36€",/l
240,Axe Bodyspray Deodorant Bodyspray Gold 150 ml,https://cdn.carrefour.eu/160_06614701_8720181030185_00.jpeg,"4,95€",Per stuk,"33,00€",/l
241,Axe Anti-Transpirant Anti-Transpirant Dark Temptation 150 ml,https://cdn.carrefour.eu/160_06614767_8720181058004_00.jpeg,"4,75€",Per stuk,"32,33€",/l
242,Axe Bodyspray Deodorant Bodyspray Fresh Forest & Graffiti 150 ml,https://cdn.carrefour.eu/160_06614817_8720181028823_00.jpeg,"4,65€",Per stuk,"31,00€",/l
243,Axe Bodyspray Deodorant Bodyspray You 150 ml,https://cdn.carrefour.eu/160_06614617_8720181027390_00.jpeg,"4,95€",Per stuk,"33,00€",/l
244,Axe Anti-Transpirant Anti-Transpirant Ice Chill 150 ml,https://cdn.carrefour.eu/160_06614765_8720181058042_00.jpeg,"4,79€",Per stuk,"31,93€",/l
245,Axe Anti-Transpirant Anti-Transpirant Gold 150 ml,https://cdn.carrefour.eu/160_06614809_8720181058028_00.jpeg,"4,85€",Per stuk,"32,33€",/l
246,Axe Bodyspray Deodorant Bodyspray Ice Chill 150 ml,https://cdn.carrefour.eu/160_06614668_8720181027758_00.jpeg,"4,45€",Per stuk,"29,67€",/l
247,Axe Bodyspray Deodorant Bodyspray Green Mojito & Cedarwood 150 ml,https://cdn.carrefour.eu/160_06614707_8720181027680_00.jpeg,"4,59€",Per stuk,"31,27€",/l
248,Axe Bodyspray Deodorant Bodyspray Fresh Bergamot & Pink Pepper 150 ml,https://cdn.carrefour.eu/160_06614825_8720181028809_00.jpeg,"4,55€",Per stuk,"30,33€",/l
249,Borotalco Invisible Deo Roll On 48h 50 ml,https://cdn.carrefour.eu/160_06516370_80844044_00.jpeg,"5,35€",Per stuk,"107,00€",/l
250,Head & Shoulders Intense Hydration Conditioner 220ml,https://cdn.carrefour.eu/160_06357479_8001841407463_00.jpeg,"5,29€",Per stuk,"24,05€",/l
251,Axe Aftershave Marine 100 ml,https://cdn.carrefour.eu/160_06478646_8710847937071_00.jpeg,"7,49€",Per stuk,"74,90€",/l
252,Nivea Men Fresh Aquatic 48h Anti-Transpirant 150 ml,https://cdn.carrefour.eu/160_06512591_4005900777065_00.jpeg,"3,89€",Per stuk,"25,93€",/l
253,Axe Bodyspray Sport Fresh Recharge 150 ml,https://cdn.carrefour.eu/160_06619472_8720181131905_00.jpeg,"4,59€",Per stuk,"31,27€",/l
254,Axe   Shower Gel Sport Fresh Recharge  400 ml,https://cdn.carrefour.eu/160_06623505_8720181123955_00.jpeg,"5,85€",Per stuk,"14,63€",/l
255,Axe Shower Gel Sport Fresh Recharge 250 ml,https://cdn.carrefour.eu/160_06623728_8720181123948_00.jpeg,"3,99€",Per stuk,"15,96€",/l
256,Nivea Men Fresh Kick After Shave Lotion 100 ml,https://cdn.carrefour.eu/160_06636994_9005800343143_00.jpeg,"8,55€",Per stuk,"8,55€",/stuk
257,Palmolive Memories of Nature Sunset Relax douchegel met lavendel 250ml,https://cdn.carrefour.eu/160_06685263_8718951266193_00.jpeg,"3,25€",Per stuk,"13,00€",/l
258,Sanex Biomeprotect Micellar Vitality 400ml,https://cdn.carrefour.eu/160_06689700_8718951417045_00.jpeg,"5,25€",Per stuk,"13,13€",/l
259,Sanex Biomeprotect Micellar No Soap 400ml,https://cdn.carrefour.eu/160_06689754_8718951422322_00.jpeg,"5,25€",Per stuk,"13,13€",/l
260,Axe   Stick Black 50 ml,https://cdn.carrefour.eu/160_06693013_59086789_00.jpeg,"4,75€",Per stuk,"95,00€",/l
261,Wilkinson Sword Hydro 5 Skin Protection Advanced Menthol 4 Stuks,https://cdn.carrefour.eu/160_06655735_4027800404100_00.jpeg,"19,69€",Per stuk,"4,92€",/stuk
262,Axe Douchegel Mojito & Cedarwood 400 ml,https://cdn.carrefour.eu/160_06623731_8717163947739_00.jpeg,"6,85€",Per stuk,"17,13€",/l
263,Fa Choose your Mood Get Spiritual Douchegel 250ml,https://cdn.carrefour.eu/160_06629650_5410091760274_00.jpeg,"3,25€",Per stuk,"13,00€",/l
264,Scheermesjes Wegwerpbaar 2 Mesjes 10 Stuks,https://cdn.carrefour.eu/160_06658253_3560071234713_00.jpeg,"1,45€",Per stuk,"1,45€",/stuk
265,Fa Men Pure Guarana Deospray 150ml,https://cdn.carrefour.eu/160_06594197_5410091761233_00.jpeg,"3,65€",Per stuk,"14,60€",/l
266,Fa Men Pure Guarana Shower Gel 250ml,https://cdn.carrefour.eu/160_06613469_3178041351492_00.jpeg,"2,54€",Per stuk,"10,16€",/l
267,Fa Men Pure Hemp Deospray 150ml,https://cdn.carrefour.eu/160_06594196_5410091761219_00.jpeg,"3,65€",Per stuk,"14,60€",/l
268,Fa Men Pure Hemp Shower Gel 250ml,https://cdn.carrefour.eu/160_06629655_3178041351478_00.jpeg,"2,54€",Per stuk,"10,16€",/l
269,Fa Men Perfect Wave Douchegel & Shampoo 250ml,https://cdn.carrefour.eu/160_06629654_3178040650282_00.jpeg,"2,54€",Per stuk,"10,16€",/l
270,Tahiti Douchegel Vanille 300 ml,https://cdn.carrefour.eu/160_06681942_8718951395879_00.jpeg,"1,90€",Per stuk,"6,33€",/l
271,Douchegel Tahiti Orchidee - 300ml,https://cdn.carrefour.eu/160_06681944_8718951395992_00.jpeg,"1,90€",Per stuk,"6,33€",/l
272,Douchegel Tahiti Tropenhout - 300ml,https://cdn.carrefour.eu/160_06681941_8718951395909_00.jpeg,"1,90€",Per stuk,"6,33€",/l
273,Douchegel Tahiti Kokos - 300ml,https://cdn.carrefour.eu/160_06671709_8718951396142_00.jpeg,"1,90€",Per stuk,"6,33€",/l
274,"Gillette Sensor3 Comfort Wegwerpmesje Voor Mannen, Verpakking Van 4+2",https://cdn.carrefour.eu/160_06168453_7702018490356_00.jpeg,"9,49€",Per stuk,"9,49€",/stuk
275,"King C. Gillette Balsem Voor Een Zachte Baard Voor Mannen, 100 ml",https://cdn.carrefour.eu/160_06510703_8001841705552_00.jpeg,"10,69€",Per stuk,"106,90€",/l
276,Dove Men+Care Anti-Transpirant Spray Sport Active+Fresh 150 ml,https://cdn.carrefour.eu/160_06677034_8710447491645_00.jpeg,"5,05€",Per stuk,"33,67€",/l
277,Axe   Stick Ice Chill 50 ml,https://cdn.carrefour.eu/160_06693012_59086802_00.jpeg,"4,59€",Per stuk,"95,00€",/l
278,Borotalco Intensive 48h Spray Deodorant 150 ml,https://cdn.carrefour.eu/160_06713565_8002410043006_00.jpeg,"5,25€",Per stuk,"35,00€",/l
279,"Braun Series 7 70-S1000s Elektrisch Scheerapparaat, Zilver",https://cdn.carrefour.eu/160_06768563_4210201242345_00.jpeg,"169,00€",Per stuk,"169,00€",/stuk
280,L'Oréal Paris Men Expert Barber Club long Bear & Skin Oil,https://cdn.carrefour.eu/160_06189489_3600523526123_00.jpeg,"16,49€",Per stuk,"16,49€",/stuk
281,Fa Men Extreme Cool Douchegel & Shampoo 250ml,https://cdn.carrefour.eu/160_06629652_3178040675278_00.jpeg,"2,43€",Per stuk,"9,72€",/l
282,Wilkinson Sword Hydro 5 Skin Protection Regular,https://cdn.carrefour.eu/160_06683879_4027800402205_00.jpeg,"18,95€",Per stuk,"4,74€",/stuk
283,Schwarzkopf for men 3 in 1 Sea Minerals 400ml,https://cdn.carrefour.eu/160_06514317_5410091755997_00.jpg,"4,09€",Per stuk,"10,23€",/l
284,Gillette Pro Scheergel Verkoelt De Huid 200ml,https://cdn.carrefour.eu/160_06794091_7702018603961_00.jpeg,"4,99€",Per stuk,"24,95€",/l
285,Male Shave Prep,https://cdn.carrefour.eu/160_06793888_7702018604241_00.jpeg,"4,75€",Per stuk,"19,79€",/l
286,Gillette Pro Scheerschuim 240ml,https://cdn.carrefour.eu/160_06794090_7702018604166_00.jpeg,"5,29€",Per stuk,"22,04€",/l
287,Gillette SKIN Scheercrème Ultra Gevoelige Huid 175 ml,https://cdn.carrefour.eu/160_06850947_7702018607204_00.jpeg,"5,29€",Per stuk,"30,23€",/l
288,Gillette Sensor3 Recycled Wegwerpmesje Met 3 Mesjes x3,https://cdn.carrefour.eu/160_06850943_8001090286987_00.jpeg,"7,39€",Per stuk,"7,39€",/stuk
289,"Gillette Mach3 Navulmesjes Voor Mannen, 5 Stuks",https://cdn.carrefour.eu/160_06769395_7702018575626_00.jpeg,"19,35€",Per stuk,"3,87€",/stuk
290,"Gillette Series Revitaliserende Scheerschuim Met Groene Thee, 250ml",https://cdn.carrefour.eu/160_06794075_7702018619818_00.jpeg,"4,19€",Per stuk,"16,76€",/l
291,Gillette Series Revitaliserende Scheergel Met Groene Thee 200ml,https://cdn.carrefour.eu/160_06794077_7702018619559_00.jpeg,"4,65€",Per stuk,"23,25€",/l
292,"Gillette Series Reinigende Scheergel Met Houtskool, 200ml",https://cdn.carrefour.eu/160_06794089_7702018619573_00.jpeg,"3,59€",Per stuk,"17,95€",/l
293,Braun Series 5 50-W1200s Elektrisch Scheerapparaat Met Precisietrimmer,https://cdn.carrefour.eu/160_06548237_4210201275862_00.jpeg,"99,99€",Per stuk,"99,99€",/stuk
294,Braun Series 6 60-N1000s Elektrisch Scheerapparaat - Grijs,https://cdn.carrefour.eu/160_06510941_4210201241119_00.jpeg,"189,99€",Per stuk,"189,99€",/stuk
295,"Pantene Pro-V Classic Clean Shampoo Voor Normaal Tot Vet Haar, 360ML",https://cdn.carrefour.eu/160_06791929_8006540475829_00.jpeg,"5,79€",Per stuk,"16,08€",/l
296,"Gillette ProGlide Navulmesjes Voor Scheersysteem Voor Mannen, 4 Stuks",https://cdn.carrefour.eu/160_06793868_7702018564026_00.jpeg,"25,49€",Per stuk,"6,37€",/stuk
297,Gillette SKIN Scheergel Ultra Gevoelige Huid 200 ml,https://cdn.carrefour.eu/160_06793969_7702018604067_00.jpeg,"4,99€",Per stuk,"24,95€",/l
298,Nivea Man Sensitive Pro Ultra Verzachtend After Shave Balsem 150 ml,https://cdn.carrefour.eu/160_06728714_4005900890900_00.jpeg,"10,79€",Per stuk,"71,93€",/l
299,"Gillette Mach3 Turbo Navulmesjes Voor Mannen, 5 stuks",https://cdn.carrefour.eu/160_06793846_7702018575718_00.jpeg,"21,89€",Per stuk,"4,38€",/stuk
300,Nalk&Rey Lames de remplacement pour Rasoir électrique - NRMS90-18,https://cdn.carrefour.eu/160_06524856_3615008741557_00.jpeg,"6,99€",Per stuk,"6,99€",/stuk
301,BaByliss Multi Trimmer - E830TE,https://cdn.carrefour.eu/160_06737051_3030050173703_00.jpeg,"49,99€",Per stuk,"49,99€",/stuk
302,BaByliss Tondeuse - Zwart - E973TE,https://cdn.carrefour.eu/160_06741172_3030050173697_00.jpeg,"42,99€",Per stuk,"42,99€",/stuk
303,Nivea Men Sensitive Pro Ultra Verzachtend Hydraterende Crème 75 ml,https://cdn.carrefour.eu/160_06731251_4005900898944_00.jpeg,"13,19€",Per stuk,"175,87€",/l
304,Nivea Men Sensitive Pro Ultra Verzachtend Scheercrème 200 ml,https://cdn.carrefour.eu/160_06732095_4005900898760_00.jpeg,"6,45€",Per stuk,"32,25€",/l
305,"Gillette Fusion5 Navulmesjes Voor Mannen, 5 Stuks",https://cdn.carrefour.eu/160_06793724_7702018561605_00.jpeg,"25,55€",Per stuk,"5,11€",/stuk
306,"Gillette Fusion5 Power Navulmesjes Voor Mannen, 5 Stuks",https://cdn.carrefour.eu/160_06793799_7702018562411_00.jpeg,"30,59€",Per stuk,"6,12€",/stuk
307,"Schwarzkopf Diep Reinigend CHARCOAL & CLAY HAIR, BODY & FACE 400 ml",https://cdn.carrefour.eu/160_06788481_5410091763718_00.jpeg,"4,19€",Per stuk,"10,48€",/l
308,Head & Shoulders Jeukende Hoofdhuid 2-in-1 Anti-roos Shampoo 270 ml,https://cdn.carrefour.eu/160_06782402_8006540126400_00.jpeg,"5,29€",Per stuk,"19,59€",/l
309,Deodorant stick Sanex Zero% Respect en Control {56g},https://cdn.carrefour.eu/160_06808102_7509546669601_00.jpeg,"8,45€",Per stuk,"150,89€",/kg
310,"Gillette Fusion Scheergel Met Amandelolie, Voor Gevoelige Huid, 200ml",https://cdn.carrefour.eu/160_06793992_7702018617050_00.jpeg,"5,59€",Per stuk,"28,95€",/l
311,Rexona Men spray Deodorant 72h nonstop Spray Marine Fresh 150 ml,https://cdn.carrefour.eu/160_06818218_8720181183829_00.jpeg,"4,55€",Per stuk,"30,33€",/l
312,Gillette Series Verzorgend Scheerschuim Voor Mannen 250 ml,https://cdn.carrefour.eu/160_06808046_7702018404452_00.jpeg,"4,19€",Per stuk,"16,76€",/l
313,"Gillette Fusion Scheerschuim Met Amandelolie, Gevoelige Huid, 250ml",https://cdn.carrefour.eu/160_06794074_7702018617111_00.jpeg,"5,65€",Per stuk,"22,60€",/l
314,Gillette Hydraterende Gezicht en Stoppelbaard Crème 100ml,https://cdn.carrefour.eu/160_06817924_8006540299326_00.jpeg,"9,95€",Per stuk,"99,50€",/l
315,Gillette Baardverdikkingsserum Met Vitamine B-Complex 50ml,https://cdn.carrefour.eu/160_06794088_8006540470411_00.jpeg,"10,55€",Per stuk,"211,00€",/l
316,Veet Man Ontharing Kit voor Kwetsbare Gebieden,https://cdn.carrefour.eu/160_06847159_3059948006183_00.jpeg,"13,65€",Per stuk,"13,65€",/stuk
317,Sanex Zero% Respect & Control Deodorant Roll 50 ml,https://cdn.carrefour.eu/160_06843424_8718951268425_00.jpeg,"3,69€",Per stuk,"73,80€",/l
