,article_name,article_img,article_base_price,article_SKU,article_big_price,article_big_price_type
0,Carrefour Oxy Soft Ontvlekker zonder Javel 22 Wasbeurten 2 L,https://cdn.carrefour.eu/160_05970801_3560071081096_00.jpeg,"3,25€",Per stuk,"1,63€",/l
1,Carrefour Anti Verkleuring 24 Doekjes,https://cdn.carrefour.eu/160_06002179_3560071163662_00.jpeg,"2,99€",Per stuk,"2,99€",/stuk
2,Carrefour Oxy Power Voorwasontvlekker 500 ml,https://cdn.carrefour.eu/160_06003670_3560071081072_00.jpeg,"2,99€",Per stuk,"5,98€",/l
3,Carrefour Oxy Power Ontvlekker 29 Wasbeurten 1 kg,https://cdn.carrefour.eu/160_05378346_3560071081034_00.jpeg,"3,49€",Per stuk,"3,49€",/kg
4,Carrefour Red Wasverzachter 44 Wasbeurten 1.188 L,https://cdn.carrefour.eu/160_06153010_3560071193287_00.jpeg,"1,99€",Per stuk,"0,05€",/dosis
5,Carrefour Frisheid Wasverzachter 27 Wasbeurten 2 L,https://cdn.carrefour.eu/160_06192945_3560071194932_00.jpeg,"2,15€",Per stuk,"0,08€",/dosis
6,Carrefour 2in1 Antiverkleuring en Ontvlekker 12 x 30 g,https://cdn.carrefour.eu/160_06008880_3560071081331_00.jpeg,"3,25€",Per stuk,"3,25€",/stuk
7,Carrefour Patchoeli & Mandarijn Wasverzachter 44 Wasbeurten 1.188 L,https://cdn.carrefour.eu/160_06154555_3560071193379_00.jpeg,"1,99€",Per stuk,"0,05€",/dosis
8,Carrefour Essential Sodakristallen 500 g,https://cdn.carrefour.eu/160_06719475_3560071271619_00.jpeg,"1,59€",Per stuk,"3,18€",/kg
9,Carrefour Horizon Jasmijn & Kumquat Wasverzachter 55 Wasbeurten 1.5 L,https://cdn.carrefour.eu/160_06191719_3560071195328_00.jpeg,"1,89€",Per stuk,"0,04€",/dosis
10,Carrefour Papaja & Tiarebloemen Wasverzachter 55 Wasbeurten 1.5 L,https://cdn.carrefour.eu/160_06191724_3560071195380_00.jpeg,"1,89€",Per stuk,"0,04€",/dosis
11,Carrefour Horizon Kersenbloesems Wasverzachter 55 Wasbeurten 1.5 L,https://cdn.carrefour.eu/160_06191727_3560071195359_00.jpeg,"1,89€",Per stuk,"0,04€",/dosis
12,Calgon Power Gel 3in1 45 Wasbeurten 2.25 L,https://cdn.carrefour.eu/160_05108210_8410104753221_00.jpeg,"15,05€",Per stuk,"6,69€",/l
13,Calgon Hygiëne+ Gel Wasmachine Reiniger Anti kalk 15 Wasbeurten 750 ml,https://cdn.carrefour.eu/160_05820094_5410036104507_00.jpeg,"8,25€",Per stuk,"11,00€",/l
14,Calgon Powerball Tabs Wasmachine & Reiniger Anti kalk 55 Tabletten,https://cdn.carrefour.eu/160_05996935_8710552284798_00.jpeg,"18,75€",Per stuk,"0,34€",/dosis
15,HG Apparaten Onderhoudsmonteur voor Was- en Vaatwasmachines 2 x 100 g,https://cdn.carrefour.eu/160_04952338_8711577190125_00.jpeg,"10,19€",Per stuk,"50,95€",/l
16,Robijn Wasverzachter Puur & Zacht Hypoallergeen  60 wasbeurten,https://cdn.carrefour.eu/160_04683808_8717644414859_00.jpeg,"5,75€",Per stuk,"0,11€",/dosis
17,Loda Soda Kristallen 2 kg,https://cdn.carrefour.eu/160_00171717_5412008010038_00.jpeg,"3,35€",Per stuk,"1,68€",/kg
18,Vanish Ontvlekker Voorwas 300 ml,https://cdn.carrefour.eu/160_05040893_3059942031198_00.jpeg,"5,55€",Per stuk,"18,50€",/l
19,Soupline Hemels Fris Droogtrommel Wasverzachterdoekjes 20 stuks,https://cdn.carrefour.eu/160_00847825_8718951024229_00.jpeg,"3,49€",Per stuk,"3,49€",/stuk
20,Calgon 3 in 1 Power Gel Reiniger en Anti kalk 15 Wasbeurten 750 ml,https://cdn.carrefour.eu/160_01651061_8710552272962_00.jpeg,"9,45€",Per stuk,"12,60€",/l
21,Dylon Intense Black All-in-1 Textielverf 350 g,https://cdn.carrefour.eu/160_05964618_3178041326575_00.jpeg,"11,09€",Per stuk,"31,69€",/kg
22,Riem Pre Wash Ontvlekker Spray vóór het Wassen 300 ml,https://cdn.carrefour.eu/160_01344522_5411323170007_00.jpeg,"5,19€",Per stuk,"17,30€",/l
23,Vanish Oxi Action Gold Powergel Vlekverwijderaar 200 mL,https://cdn.carrefour.eu/160_05663382_8710552576374_00.jpeg,"4,59€",Per stuk,"22,95€",/l
24,Riem Pre Wash Ontvlekker Spray vóór het Wassen 300 ml,https://cdn.carrefour.eu/160_01344522_5411323170007_00.jpeg,"5,19€",Per stuk,"17,30€",/l
25,Robijn Fris & Zacht Vloeibare Wasverzachter Lavendel 60 Wasbeurten,https://cdn.carrefour.eu/160_05227953_8711700692465_00.jpeg,"5,65€",Per stuk,"0,10€",/dosis
26,Eres Blanc Nuclear White Activator 15 Wasbeurten 300 g,https://cdn.carrefour.eu/160_05348248_5410458252152_00.jpeg,"5,59€",Per stuk,"18,63€",/kg
27,Solvay BicarNet 100 % Natriumbicarbonaat 500 g,https://cdn.carrefour.eu/160_05438129_8026048000019_00.jpeg,"2,24€",Per stuk,"4,48€",/kg
28,Vanish Oxi 2 in 1 Kleurbeschermer & Vlekverwijderaar 12 Zakjes,https://cdn.carrefour.eu/160_05312107_3059942029546_00.jpeg,"6,59€",Per stuk,"0,55€",/dosis
29,Shout® Vlekkenoplosser- voor- Wasgoed -500 ml,https://cdn.carrefour.eu/160_06003917_5000204003598_00.jpeg,"3,35€",Per stuk,"6,78€",/l
30,Carrefour Discount Set van 10 metalen kleerhangers,https://cdn.carrefour.eu/160_05695206_3614610014141_00.jpeg,"2,50€",Per stuk,"2,50€",/stuk
31,Carrefour Home Set van 3 houten kleerhangers,https://cdn.carrefour.eu/160_05704363_3614610048771_00.jpeg,"2,49€",Per stuk,"2,49€",/stuk
32,HG Woonkamer Alle Nare Geurtjes Weg 500 ml,https://cdn.carrefour.eu/160_04964565_8711577190736_00.jpeg,"6,95€",Per stuk,"13,90€",/l
33,Robijn Intense Wasverzachter Forever Gold 58 Wasbeurten 870 ml,https://cdn.carrefour.eu/160_05911740_8710447210628_00.jpeg,"6,09€",Per stuk,"7,00€",/l
34,Robijn Intense Vloeibare Wasverzachter Fuchsia Passion 58 Wasbeurten,https://cdn.carrefour.eu/160_05911840_8710447210635_00.jpeg,"6,05€",Per stuk,"6,95€",/l
35,Robijn Intense Vloeibare Wasverzachter Fresh Sky 58 Wasbeurten,https://cdn.carrefour.eu/160_05911871_8710447210611_00.jpeg,"6,05€",Per stuk,"6,95€",/l
36,Eau Ecarlate Revive Colors 20 doekjes,https://cdn.carrefour.eu/160_05937441_3152210008714_00.jpeg,"5,65€",Per stuk,"0,28€",/dosis
37,Riem Waterdichtmaker Universeel Beschermingsspray 400 ml,https://cdn.carrefour.eu/160_01379938_5411323100004_00.jpeg,"6,95€",Per stuk,"17,38€",/l
38,Merito Strijkt Gemakkelijk 500 ml,https://cdn.carrefour.eu/160_01170858_5410513777507_00.jpeg,"3,45€",Per stuk,"6,90€",/l
39,Remy Style Natuurlijk Stijfsel 400 ml,https://cdn.carrefour.eu/160_00171267_5415040100033_00.jpeg,"3,35€",Per stuk,"8,38€",/l
40,Remy Easy 400 ml,https://cdn.carrefour.eu/160_00171274_5415040100040_00.jpeg,"3,35€",Per stuk,"8,38€",/l
41,Blan Future White 3 in 1 10 Wasbeurten 330 g,https://cdn.carrefour.eu/160_05941253_5415040300129_00.jpeg,"4,65€",Per stuk,"13,29€",/kg
42,Forever Gedemineraliseerd water Pro 5L,https://cdn.carrefour.eu/160_01122649_5400101524552_00.jpeg,"1,99€",Per stuk,"1,99€",/stuk
43,Forever Gedemineraliseerd water 1L,https://cdn.carrefour.eu/160_00965595_5400191600457_00.jpeg,"0,99€",Per stuk,"0,99€",/stuk
44,Remy Stijfsel Textiel- en Huidverzorging 350 g,https://cdn.carrefour.eu/160_06165737_5410018806504_00.jpeg,"4,15€",Per stuk,"11,86€",/kg
45,Gedemineraliseerd water 5L,https://cdn.carrefour.eu/160_05490007_5400191807863_00.jpeg,"0,99€",Per stuk,"0,99€",/stuk
46,Soupline Hemels Fris Wasverzachter 1.9 L,https://cdn.carrefour.eu/160_06017126_8718951192478_00.jpeg,"4,55€",Per stuk,"2,39€",/l
47,Destop Wasmachinereiniger Integrale Behandeling 2x 250 ml,https://cdn.carrefour.eu/160_05768114_3059940006761_00.jpeg,"7,49€",Per stuk,"14,98€",/l
48,Febreze Ochtend Dauw Textielverfrisser Spray 500ml,https://cdn.carrefour.eu/160_06318677_8001841549989_00.jpeg,"4,35€",Per stuk,"8,70€",/l
49,HG Wasruimte Tegen Stinkende Wasmachines 550 g,https://cdn.carrefour.eu/160_05877512_8711577230081_00.jpeg,"7,75€",Per stuk,"14,09€",/kg
50,Dr. Beckmann Anti-Kleurdoorloop 24 Doekjes,https://cdn.carrefour.eu/160_06263156_4008455522319_00.jpeg,"5,29€",Per stuk,"5,29€",/stuk
51,Dr. Beckmann Roll-On Vlekkenroller 75 ml,https://cdn.carrefour.eu/160_06268525_4008455008042_00.jpeg,"3,45€",Per stuk,"3,45€",/stuk
52,Calgon 3 in 1 Power Poeder Wasmachine Reiniger Anti kalk 60 Doseringen,https://cdn.carrefour.eu/160_05748400_3059940049348_00.jpeg,"17,25€",Per stuk,"0,29€",/dosis
53,Destop Wasmachinereiniger Integrale Behandeling 2x 250 ml,https://cdn.carrefour.eu/160_05768114_3059940006761_00.jpeg,"7,49€",Per stuk,"14,98€",/l
54,Silan Suprême Romance Wasverzachter 44 Wasbeurten 1100 ml,https://cdn.carrefour.eu/160_05801357_5410091734589_00.jpeg,"5,49€",Per stuk,"0,12€",/dosis
55,Vanish Oxi Action Gold Powergel Vlekverwijderaar 200 mL,https://cdn.carrefour.eu/160_05663382_8710552576374_00.jpeg,"4,59€",Per stuk,"22,95€",/l
56,Eau Ecarlate Blanc Intense Poeder 500 g,https://cdn.carrefour.eu/160_05458912_5420067100775_00.jpeg,"4,05€",Per stuk,"8,10€",/kg
57,Calgon 3 in 1  Tabs Wasmachine Reiniger en Anti kalk 17 Tabletten,https://cdn.carrefour.eu/160_05447418_3059940049225_00.jpeg,"8,05€",Per stuk,"0,47€",/dosis
58,Eres Ossengal Zeep 500 ml,https://cdn.carrefour.eu/160_05487024_5410458253159_00.jpeg,"5,85€",Per stuk,"11,70€",/l
59,Silan Passie voor Rozen Wasverzachter 54 Wasbeurten 1.35 L,https://cdn.carrefour.eu/160_06393474_5410091754341_00.jpeg,"4,99€",Per stuk,"0,09€",/dosis
60,Silan  Geconcentreerde Wasverzachter 54 Wasbeurten 1.35 L,https://cdn.carrefour.eu/160_06393475_5410091754334_00.jpeg,"4,99€",Per stuk,"0,09€",/dosis
61,Dettol Hygiënische Wasmachine Reiniger 250 ml,https://cdn.carrefour.eu/160_06348746_8710552278131_00.jpeg,"3,99€",Per stuk,"16,60€",/l
62,Dr. Beckmann Vlekkenduivel Fruit & Dranken 50 g,https://cdn.carrefour.eu/160_06263202_4008455521213_00.jpeg,"3,49€",Per stuk,"69,80€",/l
63,Ecover Sensitive Wasverzachter Gardenia & Vanille 33 Wasbeurten 1 L,https://cdn.carrefour.eu/160_06319256_5412533419962_00.jpeg,"4,25€",Per stuk,"4,25€",/l
64,Ecover Sensitive Wasverzachter Appelbloesem Amandel 33 Wasbeurten 1 L,https://cdn.carrefour.eu/160_06319279_5412533419948_00.jpeg,"4,25€",Per stuk,"4,25€",/l
65,Eau Ecarlate Décolor Stop 24 Doekjes,https://cdn.carrefour.eu/160_05327155_8710322220483_00.jpeg,"3,95€",Per stuk,"3,95€",/stuk
66,Remy Stijfsel Textiel- en Huidverzorging 350 g,https://cdn.carrefour.eu/160_06165737_5410018806504_00.jpeg,"4,15€",Per stuk,"11,86€",/kg
67,Dreft Wasverzachter Ultimate Care Blue Dream 40 Wasbeurten 1 L,https://cdn.carrefour.eu/160_06195002_8719558802036_00.jpeg,"5,39€",Per stuk,"0,13€",/dosis
68,Dreft Wasverzachter Ultimate Care Pink Bloom 40 Wasbeurten 1 L,https://cdn.carrefour.eu/160_06195023_8719558802005_00.jpeg,"5,39€",Per stuk,"0,13€",/dosis
69,Dreft Wasverzachter Ultimate Care White Blossoms 40 Wasbeurten 1 L,https://cdn.carrefour.eu/160_06195024_8719558802067_00.jpeg,"5,39€",Per stuk,"0,13€",/dosis
70,Klindo Reisstrijkijzer KTI801-17,https://cdn.carrefour.eu/160_05830892_3614612687923_00.jpeg,"16,99€",Per stuk,"16,99€",/stuk
71,Robijn Fris & Zacht Vloeibare Wasverzachter Morgenfris 60 Wasbeurten,https://cdn.carrefour.eu/160_06189672_8710847874550_00.jpeg,"6,05€",Per stuk,"4,03€",/l
72,Soupline Peer Vanille en Kokoswater 800 ml,https://cdn.carrefour.eu/160_06365889_8718951304680_00.jpeg,"5,69€",Per stuk,"7,24€",/l
73,Febreze Classic Textielverfrisser Spray 500 ml,https://cdn.carrefour.eu/160_06318676_8001841549958_00.jpeg,"4,35€",Per stuk,"8,70€",/l
74,La Chat Dermo Comfort Wasverzachter 36 Wasbeurten 900 ml,https://cdn.carrefour.eu/160_06396700_5410091756000_00.jpeg,"4,19€",Per stuk,"4,66€",/l
75,Le Chat Fresh and Care Adoucissant 900 ml,https://cdn.carrefour.eu/160_06397877_5410091755942_00.jpeg,"4,19€",Per stuk,"0,12€",/l
76,Eau Ecarlate Revive Black 20 doekjes,https://cdn.carrefour.eu/160_06143980_3178041338196_00.jpeg,"5,65€",Per stuk,"5,65€",/stuk
77,Febreze Vleugje Bloesem Textielverfrisser Spray 500ml,https://cdn.carrefour.eu/160_06318675_8001841550015_00.jpeg,"4,35€",Per stuk,"8,70€",/l
78,Febreze Ochtend Dauw Textielverfrisser Spray 500ml,https://cdn.carrefour.eu/160_06318677_8001841549989_00.jpeg,"4,35€",Per stuk,"8,70€",/l
79,HG Wasruimte Tegen Stinkende Wasmachines 550 g,https://cdn.carrefour.eu/160_05877512_8711577230081_00.jpeg,"7,75€",Per stuk,"14,09€",/kg
80,Dr. Beckmann Anti-Kleurdoorloop 24 Doekjes,https://cdn.carrefour.eu/160_06263156_4008455522319_00.jpeg,"5,29€",Per stuk,"5,29€",/stuk
81,Vanish Oxi Action Vlekverwijderaar voor Vlekken 500 ml,https://cdn.carrefour.eu/160_06387695_3059942032751_00.jpeg,"6,45€",Per stuk,"12,90€",/l
82,Silan Sensitive Geconcentreerde Wasverzachter 54 Wasbeurten 1.35 L,https://cdn.carrefour.eu/160_06393550_5410091755706_00.jpeg,"5,15€",Per stuk,"0,10€",/dosis
83,Silan Lavendelgeluk Geconcentreerde Wasverzachter 54 Wasbeurten 1.35 L,https://cdn.carrefour.eu/160_06393494_5410091754358_00.jpeg,"5,15€",Per stuk,"0,10€",/dosis
84,Calgon Ecologische+ Gel Reiniger en Anti kalk 15 Wasbeurten 750 ml,https://cdn.carrefour.eu/160_06414990_5410036307038_00.jpeg,"11,29€",Per stuk,"15,05€",/l
85,Lenor gouden orchidee In-Wash Geurbooster 224g,https://cdn.carrefour.eu/160_06612847_8006540090176_00.jpeg,"8,25€",Per stuk,"0,52€",/dosis
86,Lenor Unstoppables Actief In-Wash Geurbooster 224g,https://cdn.carrefour.eu/160_06612855_8006540090206_00.jpeg,"8,25€",Per stuk,"0,52€",/dosis
87,Lenor Amethist en bloemen In-Wash Geurbooster 224g,https://cdn.carrefour.eu/160_06612846_8006540090060_00.jpeg,"8,25€",Per stuk,"0,52€",/dosis
88,Soupline Plantaardige Zachtheid Linnen bloem noten 1.3L,https://cdn.carrefour.eu/160_06427393_8718951342170_00.jpeg,"5,79€",Per stuk,"4,45€",/l
89,Soupline Plantaardige Zachtheid Witte Bloemen noten 1.3L,https://cdn.carrefour.eu/160_06427410_8718951342118_00.jpeg,"5,79€",Per stuk,"4,45€",/l
90,Lenor Robijn Jasmijn In-Wash Geurbooster 224g,https://cdn.carrefour.eu/160_06612854_8006540090008_00.jpeg,"8,25€",Per stuk,"0,52€",/dosis
91,Lenor Unstoppables Fris In-Wash Geurbooster 224g,https://cdn.carrefour.eu/160_06613819_8006540090329_00.jpeg,"8,25€",Per stuk,"0,52€",/dosis
92,Riem Oxy Wash Vlekverwijderaar Poeder met Actieve Zuurstof 500 g,https://cdn.carrefour.eu/160_06636468_5411323700006_00.jpeg,"7,45€",Per stuk,"14,90€",/kg
93,Dreft Ultimate Care Intense Dark Wasverzachter 1 L 40 Wasbeurten,https://cdn.carrefour.eu/160_06655160_8719558803712_00.jpeg,"5,39€",Per stuk,"0,13€",/dosis
94,Dreft Eco Wasverzachter Ultimate Care White Flower 38 Wasbeurten 950ml,https://cdn.carrefour.eu/160_06655162_8719558803743_00.jpeg,"5,65€",Per stuk,"0,15€",/dosis
95,Eau Ecarlate Décolor Stop + Ontvlekker 2in1 10 zakjes,https://cdn.carrefour.eu/160_06691520_5410091734077_00.jpeg,"4,99€",Per stuk,"4,99€",/stuk
96,Vanish Oxi Action Extra Hygiene Vlekverwijderaar zonder Bleek 470 g,https://cdn.carrefour.eu/160_06711549_8720065000976_00.jpeg,"8,65€",Per stuk,"18,40€",/kg
97,Eau Ecarlate Décolor Stop + Whitening Power + Ontvlekker 10 Zakjes,https://cdn.carrefour.eu/160_06691521_5410091733513_00.jpeg,"4,95€",Per stuk,"4,95€",/stuk
98,Blan Pure White Gel Witmaker 1 L,https://cdn.carrefour.eu/160_06700170_5415040323388_00.jpeg,"5,79€",Per stuk,"5,79€",/l
99,"HG Textiel Vlekweg 2 Viltstift, Vet, Olie, Schoensmeer 50 ml",https://cdn.carrefour.eu/160_06746476_87300543_00.jpeg,"3,95€",Per stuk,"79,00€",/l
100,HG Textiel Vlekweg 3 50 ml,https://cdn.carrefour.eu/160_06746477_87300550_00.jpeg,"3,95€",Per stuk,"79,00€",/l
101,HG Textiel Vlekweg 1 34 g,https://cdn.carrefour.eu/160_06746490_87300536_00.jpeg,"3,95€",Per stuk,"79,00€",/l
102,HG Textiel Vlekweg 7 Roest 50 ml,https://cdn.carrefour.eu/160_06746492_87304541_00.jpeg,"3,95€",Per stuk,"79,00€",/l
103,HG Textiel Vlekken en Plekken Voorbehandeling Extra Sterk 500 ml,https://cdn.carrefour.eu/160_06746494_8711577216580_00.jpeg,"6,95€",Per stuk,"13,90€",/l
104,"HG Textiel Vlekweg 4 Saus & Jus, Kruiden, Bloed, Melk, Eiwit 35 g",https://cdn.carrefour.eu/160_06746498_87300567_00.jpeg,"3,95€",Per stuk,"79,00€",/l
105,HG Textiel Vlekweg 6 Ballpoint en Hardnekkige Kleurstoffen 50 ml,https://cdn.carrefour.eu/160_06746500_87304534_00.jpeg,"3,95€",Per stuk,"79,00€",/l
106,HG Wasruimte Zweetvlekken Verwijderaar 250 ml,https://cdn.carrefour.eu/160_06746501_8711577202309_00.jpeg,"5,85€",Per stuk,"23,40€",/l
107,HG Textiel Oxi Vlekken Wonder 500 g,https://cdn.carrefour.eu/160_06746474_8711577021245_00.jpeg,"5,69€",Per stuk,"11,38€",/kg
108,HG Textiel Vlekken en Plekken Voorbehandeling Extra Sterk 500 ml,https://cdn.carrefour.eu/160_06746475_8711577050078_00.jpeg,"6,59€",Per stuk,"13,18€",/l
109,HG Textiel Vlekweg 5 50 ml,https://cdn.carrefour.eu/160_06746499_87300574_00.jpeg,"3,95€",Per stuk,"79,00€",/l
110,Lenor Unstoppables Geur Van Ariel In-Wash Geurbooster 210g,https://cdn.carrefour.eu/160_06749325_8006540091999_00.jpeg,"8,09€",Per stuk,"38,52€",/kg
111,Lenor In-Wash Geurbooster Pioenroos en hibiscus Parels 210G,https://cdn.carrefour.eu/160_06789164_8006540604250_00.jpeg,"7,95€",Per stuk,"0,53€",/dosis
112,LEIFHEIT Droogrek Classic 180 solid,https://cdn.carrefour.eu/160_06807960_4006501816214_00.jpeg,"37,99€",Per stuk,"37,99€",/stuk
113,Vanish Oxi Action Multi Power 750 ml,https://cdn.carrefour.eu/160_06711483_8720065000914_00.jpeg,"8,49€",Per stuk,"11,32€",/l
114,Febreze Zeebries Textielverfrisser Spray 500ml,https://cdn.carrefour.eu/160_06787331_8001090201331_00.jpeg,"5,19€",Per stuk,"10,38€",/l
115,"Lenor Caresse Sensitive Wasverzachter 45 Wasbeurten, 1.035L",https://cdn.carrefour.eu/160_06788831_8006540524381_00.jpeg,"4,45€",Per stuk,"0,10€",/dosis
116,"Lenor Gouden Orchidee Wasverzachter 45 Wasbeurten, 1.035L",https://cdn.carrefour.eu/160_06788848_8006540524299_00.jpeg,"5,69€",Per stuk,"0,13€",/dosis
117,"Lenor Zeebries Wasverzachter 45 Wasbeurten, 1.035L",https://cdn.carrefour.eu/160_06788840_8006540524206_00.jpeg,"5,69€",Per stuk,"0,13€",/dosis
118,"Lenor Wilde Bloeiende Bloem Wasverzachter 45 Wasbeurten, 1.035L",https://cdn.carrefour.eu/160_06788849_8006540524329_00.jpeg,"6,09€",Per stuk,"0,14€",/dosis
119,"Lenor Amethist & Bloemen Boeket Wasverzachter 45 Wasbeurten, 1.035L",https://cdn.carrefour.eu/160_06788837_8006540524268_00.jpeg,"6,09€",Per stuk,"0,14€",/dosis
120,"Lenor Caresse Aerienne Wasverzachter 45 Wasbeurten, 1.035L",https://cdn.carrefour.eu/160_06788805_8006540524350_00.jpeg,"4,45€",Per stuk,"0,10€",/dosis
