,article_name,article_img,article_base_price,article_SKU,article_big_price,article_big_price_type
0,Carrefour Styling Gel Wetlook 150 ml,https://cdn.carrefour.eu/160_05605468_3560070885435_00.jpeg,"1,85€",Per stuk,"12,33€",/l
1,Carrefour Soft Anti Roos Zeer Milde Shampoo 500 ml,https://cdn.carrefour.eu/160_05984395_3560071086169_00.jpeg,"1,29€",Per stuk,"2,58€",/l
2,Carrefour Stylingschuim Extra Volume 200 ml,https://cdn.carrefour.eu/160_05512899_3560071277895_00.jpeg,"2,49€",Per stuk,"12,45€",/l
3,Carrefour Soft Haarlak Sterke Fixatie 300 ml,https://cdn.carrefour.eu/160_05515355_3560070885190_00.jpeg,"1,29€",Per stuk,"4,30€",/l
4,Carrefour Soft Haarlak Normale Fixatie 300 ml,https://cdn.carrefour.eu/160_05515356_3560070885251_00.jpeg,"1,29€",Per stuk,"4,30€",/l
5,Carrefour Soft Blond Kamille & Tarwekiemen Verhelderende Shampoo 250ml,https://cdn.carrefour.eu/160_05621275_3560070968923_00.jpeg,"1,35€",Per stuk,"5,40€",/l
6,Nectar of Beauty Conditioner die de Kleur Verlevendigt 200 ml,https://cdn.carrefour.eu/160_05621289_3560070969166_00.jpeg,"1,49€",Per stuk,"7,45€",/l
7,Carrefour Soft Purify Zuiverende Ontwarrende Spray 200 ml,https://cdn.carrefour.eu/160_05526954_3560070928132_00.jpeg,"2,99€",Per stuk,"14,95€",/l
8,Carrefour Styling Spray Sterke Fixatie 250 ml,https://cdn.carrefour.eu/160_05528359_3560070887859_00.jpeg,"2,69€",Per stuk,"10,76€",/l
9,Carrefour Kids Shampooz 2 in 1 Shampoo Aardbeienparfum 300 ml,https://cdn.carrefour.eu/160_05456912_3560070815418_00.jpeg,"2,09€",Per stuk,"6,97€",/l
10,Carrefour Styling Gel Invisible 6 250 ml,https://cdn.carrefour.eu/160_05406860_3560070860395_00.jpeg,"2,55€",Per stuk,"10,20€",/l
11,Carrefour Styling Gel béton 250 ml,https://cdn.carrefour.eu/160_05406888_3560070860364_00.jpeg,"2,55€",Per stuk,"10,20€",/l
12,Carrefour Styling Gel Fixatie Extreme 8 250 ml,https://cdn.carrefour.eu/160_05406896_3560070860333_00.jpeg,"2,55€",Per stuk,"10,20€",/l
13,Carrefour Soft Green Solid Shampoo Greasy Hair 75 g,https://cdn.carrefour.eu/160_06751669_3560071423018_00.jpeg,"2,90€",Per stuk,"38,67€",/kg
14,Carrefour Soft Green Solid Shampoo Dry Hair 75 g,https://cdn.carrefour.eu/160_06751673_3560071423001_00.jpeg,"2,90€",Per stuk,"38,67€",/kg
15,Carrefour Soft met Karité Galam Shampoo 2 in 1 500 ml,https://cdn.carrefour.eu/160_05580557_3560070947515_00.jpeg,"1,29€",Per stuk,"2,58€",/l
16,Carrefour Soft Green Solid Shampoo Normal Hair 75 g,https://cdn.carrefour.eu/160_06560607_3560071423025_00.jpeg,"2,90€",Per stuk,"38,67€",/kg
17,L'Oréal Paris Excellence Creme 4 - Middenbruin - Permanente Kleuring,https://cdn.carrefour.eu/160_01384436_5410103002149_00.jpeg,"11,69€",Per stuk,"11,69€",/stuk
18,Nivea Diamond Gloss Conditioner Diamantdeeltjes 200 ml,https://cdn.carrefour.eu/160_05608455_4005900190475_00.jpeg,"3,59€",Per stuk,"17,95€",/l
19,L'Oréal Paris Excellence Creme 9.3 - Zeer Licht Goudblond - Perm.,https://cdn.carrefour.eu/160_01383972_5410103002040_00.jpeg,"11,69€",Per stuk,"11,69€",/stuk
20,Batiste Instant Hair Refresh Dry Shampoo Dark Hair 200 ml,https://cdn.carrefour.eu/160_05551822_5010724527443_00.jpeg,"6,69€",Per stuk,"6,69€",/l
21,Batiste Droogshampoo Cherry 200 ml,https://cdn.carrefour.eu/160_05551823_5010724526798_00.jpeg,"5,69€",Per stuk,"28,45€",/l
22,Syoss Invisible Hold Haarspray 400 ml,https://cdn.carrefour.eu/160_05838608_5410091733117_00.jpeg,"5,65€",Per stuk,"14,13€",/l
23,Syoss Keratin Haarspray 400 ml,https://cdn.carrefour.eu/160_05838611_5410091732905_00.jpeg,"5,65€",Per stuk,"14,13€",/l
24,Syoss Volume Lift Haarspray 400 ml,https://cdn.carrefour.eu/160_05838621_5410091733049_00.jpeg,"5,65€",Per stuk,"14,13€",/kg
25,Syoss Curl Control Mousse 250 ml,https://cdn.carrefour.eu/160_05838814_5410091732936_00.jpeg,"5,75€",Per stuk,"23,00€",/l
26,Syoss Uitgroeispray Middenbruin 120 ml,https://cdn.carrefour.eu/160_05844670_5410091734435_00.jpeg,"7,79€",Per stuk,"7,79€",/stuk
27,Elseve Multi-vitamines 2 in 1 Verzorgende Shampo Normaal Haar 250 ml,https://cdn.carrefour.eu/160_00239697_3054080004028_00.jpeg,"3,79€",Per stuk,"15,16€",/l
28,L'Oréal Paris Excellence Creme 9 - Zeer Licht Blond - Perm.,https://cdn.carrefour.eu/160_01248922_5410103002026_00.jpeg,"11,69€",Per stuk,"11,69€",/stuk
29,Poly Palette 678 Robijnrood Permanente Haarverf,https://cdn.carrefour.eu/160_05547691_5410091719968_00.jpeg,"7,45€",Per stuk,"7,45€",/stuk
30,L'Oréal Paris Studio Line Go create 6 precise gel spray 150 ml,https://cdn.carrefour.eu/160_00718971_5410103710013_00.jpeg,"4,45€",Per stuk,"29,67€",/l
31,Schwarzkopf got2b Glued Extreme Freeze Haarspray 300 ml,https://cdn.carrefour.eu/160_04317867_5410091642075_00.jpeg,"8,49€",Per stuk,"28,30€",/l
32,Schwarzkopf Gliss Kur Total Repair Direct Repair Crème 150 ml,https://cdn.carrefour.eu/160_04018099_5410091648893_00.jpeg,"5,99€",Per stuk,"39,93€",/l
33,Elseve Multi-Vitamines Shampoo normaal haar 250 ml,https://cdn.carrefour.eu/160_05172638_3600522100843_00.jpeg,"4,49€",Per stuk,"17,96€",/l
34,Syoss Oleo Intense 2-10 Bruinzwart Permanente Haarverf,https://cdn.carrefour.eu/160_05306392_5410091702656_00.jpeg,"11,69€",Per stuk,"11,69€",/stuk
35,Syoss Oleo Intense 4-18 Mokkabruin Permanente Haarverf,https://cdn.carrefour.eu/160_05306394_5410091702717_00.jpeg,"11,69€",Per stuk,"11,69€",/stuk
36,Schwarzkopf Gliss Kur 6 Miracles Oil Elixir 75 ml,https://cdn.carrefour.eu/160_05391198_5410091707866_00.jpeg,"9,19€",Per stuk,"122,53€",/l
37,Poly Palette 700 Truffelbruin Permanente Haarverf,https://cdn.carrefour.eu/160_05707494_5410091728397_00.jpeg,"7,45€",Per stuk,"7,45€",/stuk
38,Syoss Oleo Intense 3-10 Intens Bruin Permanente Haarverf,https://cdn.carrefour.eu/160_05864929_5410091734084_00.jpeg,"11,69€",Per stuk,"11,69€",/stuk
39,Syoss 4-8 Chocoladebruin Permanente Haarverf,https://cdn.carrefour.eu/160_05865401_5410091735500_00.jpeg,"7,39€",Per stuk,"7,39€",/stuk
40,Syoss Oleo Intense 6-76 Warm Koperblond Permanente Haarverf,https://cdn.carrefour.eu/160_05542122_5410091719173_00.jpeg,"11,69€",Per stuk,"11,69€",/stuk
41,Schwarzkopf R2 Goudbruin Uitgroeiset,https://cdn.carrefour.eu/160_05546256_5410091721992_00.jpeg,"8,09€",Per stuk,"8,09€",/stuk
42,Batiste Droogshampoo Original 200 ml,https://cdn.carrefour.eu/160_05551819_3331300062656_00.jpeg,"5,69€",Per stuk,"28,45€",/l
43,Taft Ultra wax 75 ml,https://cdn.carrefour.eu/160_05718581_5410091742263_00.jpeg,"4,75€",Per stuk,"63,33€",/l
44,Schwarzkopf Blonde M1 Coup de Soleil Super Haarverf,https://cdn.carrefour.eu/160_01551522_4015000247245_00.jpeg,"10,59€",Per stuk,"10,59€",/stuk
45,L'Oréal Paris Studio Line Indestructible 9 Extreme Hold 150 ml,https://cdn.carrefour.eu/160_04474808_3600520921211_00.jpeg,"4,35€",Per stuk,"29,00€",/l
46,Schwarzkopf Gliss Kur Oil Nutritive Anti-Klit Spray 200 ml,https://cdn.carrefour.eu/160_04515718_5410091656768_00.jpeg,"4,75€",Per stuk,"23,75€",/l
47,Pétrole Hahn Shampoo Kracht Vitaliteit Normaal Haar 250 ml,https://cdn.carrefour.eu/160_04025802_3140100143065_00.jpeg,"4,85€",Per stuk,"19,40€",/l
48,Schwarzkopf Gliss Kur Oil Nutritive Anti-Klit Spray 200 ml,https://cdn.carrefour.eu/160_04515718_5410091656768_00.jpeg,"4,75€",Per stuk,"23,75€",/l
49,Pétrole Hahn Shampoo Kracht Vitaliteit Normaal Haar 250 ml,https://cdn.carrefour.eu/160_04025802_3140100143065_00.jpeg,"4,85€",Per stuk,"19,40€",/l
50,Pétrole Hahn Shampoo Anti-Haaruitval Kracht 250 ml,https://cdn.carrefour.eu/160_04025823_3140100143119_00.jpeg,"4,85€",Per stuk,"19,40€",/l
51,Syoss 1-1 Zwart Permanente Haarverf,https://cdn.carrefour.eu/160_05864935_5410091735487_00.jpeg,"7,39€",Per stuk,"7,39€",/stuk
52,Syoss 3-1 Donkerbruin Permanente Haarverf,https://cdn.carrefour.eu/160_05864990_5410091735463_00.jpeg,"7,39€",Per stuk,"7,39€",/stuk
53,Nivea Styling Spray Ultra Strong 250 ml,https://cdn.carrefour.eu/160_05608810_4005900173812_00.jpeg,"2,54€",Per stuk,"10,16€",/l
54,Nivea Styling Spray Volume Care Extra Strong 250 ml,https://cdn.carrefour.eu/160_05608812_4005900173843_00.jpeg,"4,95€",Per stuk,"19,80€",/l
55,Nivea Styling Spray Diamond Gloss Care Extra Strong 250 ml,https://cdn.carrefour.eu/160_05608910_4005900173904_00.jpeg,"4,95€",Per stuk,"19,80€",/l
56,Nivea 2in1 Express Shampoo & Conditioner 250 ml,https://cdn.carrefour.eu/160_05608362_4005900175908_00.jpeg,"3,75€",Per stuk,"15,40€",/l
57,Nivea Volume Care Verzorgende Shampoo 250 ml,https://cdn.carrefour.eu/160_05608365_4005900175816_00.jpeg,"3,85€",Per stuk,"15,96€",/l
58,Shampoo Vet Haar 500 ml,https://cdn.carrefour.eu/160_05503508_3560070911349_00.jpeg,"0,75€",Per stuk,"1,50€",/l
59,Nivea Styling Spray Strong Hold 250 ml,https://cdn.carrefour.eu/160_05608796_4005900173997_00.jpeg,"2,54€",Per stuk,"10,16€",/l
60,Nivea Styling Spray Extra Strong 250 ml,https://cdn.carrefour.eu/160_05608809_4005900174260_00.jpeg,"2,54€",Per stuk,"10,16€",/l
61,Axe Pot Wax Urban 130 ml,https://cdn.carrefour.eu/160_05662767_96082508_00.jpeg,"6,35€",Per stuk,"48,85€",/l
62,Schwarzkopf R5 Zwart Uitgroeiset,https://cdn.carrefour.eu/160_05546234_5410091721763_00.jpeg,"8,09€",Per stuk,"8,09€",/stuk
63,Urtekram Conditioner Repairing Nordic Berries 180 ml,https://cdn.carrefour.eu/160_05972447_5765228836491_00.jpeg,"6,25€",Per stuk,"34,72€",/l
64,Schwarzkopf got2b Dry Shampoo Extra Volume 200 ml,https://cdn.carrefour.eu/160_05833486_3178041321303_00.jpeg,"6,29€",Per stuk,"31,45€",/l
65,Nectar of Beauty Droogshampoo Volume met Bamboe-Extract 150 ml,https://cdn.carrefour.eu/160_05829371_3560071014780_00.jpeg,"2,95€",Per stuk,"19,67€",/l
66,Nivea Styling Mousse Extra Strong 150 ml,https://cdn.carrefour.eu/160_05608792_4005900174116_00.jpeg,"3,95€",Per stuk,"26,33€",/l
67,Syoss SalonPlex Hairspray 48 h Extra Strong Hold 400 ml,https://cdn.carrefour.eu/160_05990561_5410091742188_00.jpeg,"6,15€",Per stuk,"15,38€",/l
68,Taft Sculpting paste jar 75 ml,https://cdn.carrefour.eu/160_05992356_5410091742232_00.jpeg,"4,75€",Per stuk,"63,33€",/l
69,Schwarzkopf Gliss Kur Oil Nutritive Dream Hair Spray 150 ml,https://cdn.carrefour.eu/160_05544917_5410091720537_00.jpeg,"10,35€",Per stuk,"69,00€",/l
70,Schwarzkopf Taft Titane Level 6 Power Gel Tottle 300 ml,https://cdn.carrefour.eu/160_05567208_5410091718503_00.jpeg,"3,99€",Per stuk,"13,30€",/l
71,Garnier Ultra Doux zuiverende droogshampoo met citrusextract,https://cdn.carrefour.eu/160_05270481_3600541156203_00.jpeg,"6,55€",Per stuk,"43,67€",/l
72,Junior Hairspray 3 in 1 Lift-Up Volume Haarspray 300 ml,https://cdn.carrefour.eu/160_06144731_5410091748081_00.jpeg,"4,55€",Per stuk,"15,17€",/l
73,Head & Shoulders  Anti-roos Conditioner Argan- & Kokosolie 220 ml,https://cdn.carrefour.eu/160_06030543_8001090677860_00.jpeg,"5,95€",Per stuk,"27,05€",/l
74,Taft Volume Powder 10 g,https://cdn.carrefour.eu/160_06070745_5410091687588_00.jpeg,"7,25€",Per stuk,"725,00€",/kg
75,Syoss Pure Fresh Droogshampoo 200 ml,https://cdn.carrefour.eu/160_06141734_5410091747442_00.jpeg,"5,49€",Per stuk,"27,45€",/l
76,Nivea Styling Mousse Extra Strong 150 ml,https://cdn.carrefour.eu/160_05608792_4005900174116_00.jpeg,"3,95€",Per stuk,"26,33€",/l
77,Syoss SalonPlex Hairspray 48 h Extra Strong Hold 400 ml,https://cdn.carrefour.eu/160_05990561_5410091742188_00.jpeg,"6,15€",Per stuk,"15,38€",/l
78,Taft Sculpting paste jar 75 ml,https://cdn.carrefour.eu/160_05992356_5410091742232_00.jpeg,"4,75€",Per stuk,"63,33€",/l
79,Schwarzkopf R5 Zwart Uitgroeiset,https://cdn.carrefour.eu/160_05546234_5410091721763_00.jpeg,"8,09€",Per stuk,"8,09€",/stuk
80,Urtekram Conditioner Repairing Nordic Berries 180 ml,https://cdn.carrefour.eu/160_05972447_5765228836491_00.jpeg,"6,25€",Per stuk,"34,72€",/l
81,Schwarzkopf got2b Dry Shampoo Extra Volume 200 ml,https://cdn.carrefour.eu/160_05833486_3178041321303_00.jpeg,"6,29€",Per stuk,"31,45€",/l
82,Nectar of Beauty Droogshampoo Volume met Bamboe-Extract 150 ml,https://cdn.carrefour.eu/160_05829371_3560071014780_00.jpeg,"2,95€",Per stuk,"19,67€",/l
83,Schwarzkopf Gliss Kur Oil Nutritive Dream Hair Spray 150 ml,https://cdn.carrefour.eu/160_05544917_5410091720537_00.jpeg,"10,35€",Per stuk,"69,00€",/l
84,Schwarzkopf Taft Titane Level 6 Power Gel Tottle 300 ml,https://cdn.carrefour.eu/160_05567208_5410091718503_00.jpeg,"3,99€",Per stuk,"13,30€",/l
85,Garnier Ultra Doux zuiverende droogshampoo met citrusextract,https://cdn.carrefour.eu/160_05270481_3600541156203_00.jpeg,"6,55€",Per stuk,"43,67€",/l
86,Schwarzkopf Gliss Kur Every Day Oil Elixir 75 ml,https://cdn.carrefour.eu/160_05155106_5410091690687_00.jpeg,"7,89€",Per stuk,"105,20€",/l
87,Syoss Oleo Intense 1-10 Intens Zwart Permanente Haarverf,https://cdn.carrefour.eu/160_05306325_5410091702649_00.jpeg,"11,69€",Per stuk,"11,69€",/stuk
88,Syoss Oleo Intense 4-60 Goudbruin Permanente Haarverf,https://cdn.carrefour.eu/160_05306327_5410091702724_00.jpeg,"11,69€",Per stuk,"11,69€",/stuk
89,Syoss Oleo Intense 5-86 Lichtbruin Permanente Haarverf,https://cdn.carrefour.eu/160_05306388_5410091702748_00.jpeg,"11,69€",Per stuk,"11,69€",/stuk
90,Garnier Ultra Doux Shampoo met Lindebloesem Extract 250 ml,https://cdn.carrefour.eu/160_05339379_5410103492315_00.jpeg,"3,09€",Per stuk,"12,36€",/l
91,L'Oréal Studio Line Invisi Fix 6 24H clear & clean gel 150 ml,https://cdn.carrefour.eu/160_05391171_3600522471127_00.jpeg,"4,45€",Per stuk,"29,67€",/l
92,L'Oréal Studio Line Fix & Shine 8 24H fixing spray 250 ml,https://cdn.carrefour.eu/160_05391754_3600522470915_00.jpeg,"5,69€",Per stuk,"22,76€",/l
93,L'Oréal Studio Line Invisi Fix 8 24H micro-diffusion spray 250 ml,https://cdn.carrefour.eu/160_05391772_3600522470908_00.jpeg,"5,69€",Per stuk,"22,76€",/l
94,Elseve Huile Extraordinary Oil Démêlant Nutrition 200 ml,https://cdn.carrefour.eu/160_05416698_3600522450788_00.jpeg,"4,49€",Per stuk,"22,45€",/l
95,Pétrole Hahn Lotion Tonic Kracht 5 Bescherming 300 ml,https://cdn.carrefour.eu/160_05476759_3140100323061_00.jpeg,"6,39€",Per stuk,"21,30€",/l
96,Pétrole Hahn Lotion Tonic Kracht 5 Vitaliteit Normaal Haar 300 ml,https://cdn.carrefour.eu/160_05476760_3140100323054_00.jpeg,"6,39€",Per stuk,"21,30€",/l
97,Syoss Oleo Intense 5-92 Stralend Rood Permanente Haarverf,https://cdn.carrefour.eu/160_05306411_5410091702786_00.jpeg,"11,69€",Per stuk,"11,69€",/stuk
98,Garnier Ultra Doux Shampoo Pompelmoes en Groene Thee 250 ml,https://cdn.carrefour.eu/160_05339380_5410103000817_00.jpeg,"2,75€",Per stuk,"11,00€",/l
99,Elsève - Color-Vive - Masker - Gekleurd Haar - 300ml,https://cdn.carrefour.eu/160_05994953_3600523605859_00.jpeg,"6,89€",Per stuk,"22,97€",/l
100,"Elsève - Dream long - Shampoo - Lang, Beschadigd Haar - 250ml",https://cdn.carrefour.eu/160_05998466_3600523583294_00.jpeg,"4,49€",Per stuk,"17,96€",/l
101,Head & Shoulders Classic Conditioner Voor Haar En Hoofdhuid 220ml,https://cdn.carrefour.eu/160_06227643_8001841136929_00.jpeg,"5,29€",Per stuk,"24,05€",/l
102,Elsève - Argile Extraordinaire - Shampoo - Normaal Haar - 250ml,https://cdn.carrefour.eu/160_05668971_3600523214587_00.jpeg,"4,49€",Per stuk,"17,96€",/l
103,N.A.E. Riparazione Shampoo Bar 85 g,https://cdn.carrefour.eu/160_06333477_90443381_00.jpeg,"6,85€",Per stuk,"80,59€",/kg
104,Head & Shoulders Men Ultra Male Care Anti-roos Shampoo 250ml,https://cdn.carrefour.eu/160_06379277_8001841444130_00.jpeg,"5,49€",Per stuk,"21,96€",/l
105,Head & Shoulders Men Ultra Anti-haaruitval Anti-roos Shampoo 250ml,https://cdn.carrefour.eu/160_06380151_8001841444161_00.jpeg,"5,85€",Per stuk,"23,40€",/l
106,Head & Shoulders Repair Anti-roos Shampoo Argan & Avocado-olie 250 ml,https://cdn.carrefour.eu/160_06380154_8001841444376_00.jpeg,"5,79€",Per stuk,"23,16€",/l
107,Syoss Max Hold Haarspray 400 ml,https://cdn.carrefour.eu/160_05838614_5410091733025_00.jpeg,"5,65€",Per stuk,"14,13€",/l
108,Fructis - Anti-roos - Shampoo - Normale Haar - 250ml,https://cdn.carrefour.eu/160_05826392_3600541980594_00.jpeg,"4,09€",Per stuk,"16,36€",/l
109,Fructis - Strength & Shine 2en1 - Shampoo - Normaal Haar- 250ml,https://cdn.carrefour.eu/160_05849287_3600541978072_00.jpeg,"4,09€",Per stuk,"16,36€",/l
110,Fructis - Strength & Shine - Shampoo - Normaal Haar - 250ml,https://cdn.carrefour.eu/160_05826496_3600541978034_00.jpeg,"4,09€",Per stuk,"16,36€",/l
111,Syoss 1-1 Zwart Permanente Haarverf,https://cdn.carrefour.eu/160_05864935_5410091735487_00.jpeg,"7,39€",Per stuk,"7,39€",/stuk
112,Syoss 3-1 Donkerbruin Permanente Haarverf,https://cdn.carrefour.eu/160_05864990_5410091735463_00.jpeg,"7,39€",Per stuk,"7,39€",/stuk
113,Urtekram Shampoo Rasul Volume 250 ml,https://cdn.carrefour.eu/160_05800055_5765228837160_00.jpeg,"7,95€",Per stuk,"31,80€",/l
114,Urtekram Shampoo Rosemary Fine Hair 250 ml,https://cdn.carrefour.eu/160_05800095_5765228837153_00.jpeg,"7,95€",Per stuk,"31,80€",/l
115,Syoss 4-2 Mahonie Permanente Haarverf,https://cdn.carrefour.eu/160_05865376_5410091735517_00.jpeg,"7,39€",Per stuk,"7,39€",/stuk
116,Urtekram Shampoo Tea Tree Irritated Scalp 250 ml,https://cdn.carrefour.eu/160_05800196_5765228837146_00.jpeg,"7,95€",Per stuk,"31,80€",/l
117,Syoss 4-1 Middenbruin Permanente Haarverf,https://cdn.carrefour.eu/160_05865402_5410091735470_00.jpeg,"7,39€",Per stuk,"7,39€",/stuk
118,Syoss 6-8 Donkerblond Permanente Haarverf,https://cdn.carrefour.eu/160_05865403_5410091735579_00.jpeg,"7,39€",Per stuk,"7,39€",/stuk
119,Syoss Blond 13-0 Ultra Plus Lightener Haarverf,https://cdn.carrefour.eu/160_05865450_5410091735005_00.jpeg,"7,39€",Per stuk,"7,39€",/stuk
120,Nivea Color Protect pH-Optimal Shampoo Shine Serum 250 ml,https://cdn.carrefour.eu/160_05608451_4005900179722_00.jpeg,"3,99€",Per stuk,"15,96€",/l
121,Nivea Styling Gel Extra Strong 150 ml,https://cdn.carrefour.eu/160_05608655_4005900173935_00.jpeg,"4,45€",Per stuk,"29,67€",/l
122,Les Cosmétiques Design Paris Science Shampoo Stralende Kleur 300 ml,https://cdn.carrefour.eu/160_05229847_3560070627684_00.jpeg,"1,99€",Per stuk,"6,63€",/l
123,Garnier Ultra Doux sublieme olie,https://cdn.carrefour.eu/160_05306716_3600541315273_00.jpeg,"13,49€",Per stuk,"89,93€",/l
124,L'Oréal Paris Studio Line Out of Bed Fibre-Cream 150 ml,https://cdn.carrefour.eu/160_05391139_3600522471158_00.jpeg,"5,15€",Per stuk,"34,33€",/l
125,Nalk&Rey Stijltang Protect Liss NRHS715-17,https://cdn.carrefour.eu/160_05920985_3614612524624_00.jpeg,"7,99€",Per stuk,"7,99€",/stuk
126,Nalk&Rey 3 in 1 Stijltang NRHMS99-19,https://cdn.carrefour.eu/160_06223226_3615008796915_00.jpeg,"29,99€",Per stuk,"29,99€",/stuk
127,Schwarzkopf Gliss Kur Liquid Silk Anti-Klit Spray 200 ml,https://cdn.carrefour.eu/160_06085941_5410091659639_00.jpeg,"7,99€",Per stuk,"39,95€",/l
128,Nivea Styling Mousse Extra Strong 150 ml,https://cdn.carrefour.eu/160_05608792_4005900174116_00.jpeg,"3,95€",Per stuk,"26,33€",/l
129,Syoss SalonPlex Hairspray 48 h Extra Strong Hold 400 ml,https://cdn.carrefour.eu/160_05990561_5410091742188_00.jpeg,"6,15€",Per stuk,"15,38€",/l
130,Taft Sculpting paste jar 75 ml,https://cdn.carrefour.eu/160_05992356_5410091742232_00.jpeg,"4,75€",Per stuk,"63,33€",/l
131,Timotei Shampoo Brun Intense 300 ml,https://cdn.carrefour.eu/160_06508103_8710522643990_00.jpeg,"3,59€",Per stuk,"11,97€",/l
132,Head & Shoulders Intense Hydration Conditioner 220ml,https://cdn.carrefour.eu/160_06357479_8001841407463_00.jpeg,"5,29€",Per stuk,"24,05€",/l
133,"Garnier Ultra Doux Shampoo 5 Planten Normaal, Verzwakt Haar 250 ml",https://cdn.carrefour.eu/160_06331575_3600541187900_00.jpeg,"3,15€",Per stuk,"12,60€",/l
134,Pantene Pro-V Glad & Zijdezacht Haarmasker Pluizig En Dof Haar 300 ml,https://cdn.carrefour.eu/160_06423893_8001841622279_00.jpeg,"7,65€",Per stuk,"25,50€",/l
135,Pantene Pro-V Repair & Protect Keratine Haarmasker 300 ml,https://cdn.carrefour.eu/160_06423894_8001841622231_00.jpeg,"7,65€",Per stuk,"25,50€",/l
136,Taft Unlimited Hold Level 7 Power Gel Tottle 300 ml,https://cdn.carrefour.eu/160_05567209_5410091741976_00.jpeg,"3,99€",Per stuk,"13,30€",/l
137,Urtekram Conditioner Aloe Vera 180 ml,https://cdn.carrefour.eu/160_05996001_5765228839294_00.jpeg,"6,25€",Per stuk,"34,72€",/l
138,Nivea Droogshampoo Donker Haar 3 in 1 200 ml,https://cdn.carrefour.eu/160_06031241_4005900538352_00.jpeg,"5,89€",Per stuk,"29,45€",/l
139,Nivea Droogshampoo Licht Haar 3 in 1 200 ml,https://cdn.carrefour.eu/160_06031256_4005900755971_00.jpeg,"5,89€",Per stuk,"29,45€",/l
140,Simpl Choice Shampoo met Eieren 750 ml,https://cdn.carrefour.eu/160_06034134_3560071164867_00.jpeg,"0,59€",Per stuk,"0,79€",/l
141,Elsève - Argile Extraordinaire - Shampoo - Normaal Haar - 250ml,https://cdn.carrefour.eu/160_05668971_3600523214587_00.jpeg,"4,49€",Per stuk,"17,96€",/l
142,N.A.E. Riparazione Shampoo Bar 85 g,https://cdn.carrefour.eu/160_06333477_90443381_00.jpeg,"6,85€",Per stuk,"80,59€",/kg
143,Head & Shoulders Men Ultra Male Care Anti-roos Shampoo 250ml,https://cdn.carrefour.eu/160_06379277_8001841444130_00.jpeg,"5,49€",Per stuk,"21,96€",/l
144,Nature Box Shampoo Bar Avocado 85gr,https://cdn.carrefour.eu/160_06251471_90443046_00.jpeg,"7,25€",Per stuk,"85,29€",/kg
145,Nature Box Almond Shampoo Bar 85 g,https://cdn.carrefour.eu/160_06251473_90443039_00.jpeg,"7,25€",Per stuk,"85,29€",/kg
146,Nivea Classic Mild Care Verzorgende Shampoo 250 ml,https://cdn.carrefour.eu/160_05608449_4005900175939_00.jpeg,"3,15€",Per stuk,"12,60€",/l
147,Nivea Color Protect pH-Optimal Shampoo Shine Serum 250 ml,https://cdn.carrefour.eu/160_05608451_4005900179722_00.jpeg,"3,99€",Per stuk,"15,96€",/l
148,Nivea Styling Gel Extra Strong 150 ml,https://cdn.carrefour.eu/160_05608655_4005900173935_00.jpeg,"4,45€",Per stuk,"29,67€",/l
149,Les Cosmétiques Design Paris Science Shampoo Stralende Kleur 300 ml,https://cdn.carrefour.eu/160_05229847_3560070627684_00.jpeg,"1,99€",Per stuk,"6,63€",/l
150,Garnier Ultra Doux sublieme olie,https://cdn.carrefour.eu/160_05306716_3600541315273_00.jpeg,"13,49€",Per stuk,"89,93€",/l
151,L'Oréal Paris Studio Line Out of Bed Fibre-Cream 150 ml,https://cdn.carrefour.eu/160_05391139_3600522471158_00.jpeg,"5,15€",Per stuk,"34,33€",/l
152,Nalk&Rey 3 in 1 Stijltang NRHMS99-19,https://cdn.carrefour.eu/160_06223226_3615008796915_00.jpeg,"29,99€",Per stuk,"29,99€",/stuk
153,Schwarzkopf Gliss Kur Liquid Silk Anti-Klit Spray 200 ml,https://cdn.carrefour.eu/160_06085941_5410091659639_00.jpeg,"7,99€",Per stuk,"39,95€",/l
154,Nivea Care & Hold Styling Spray 250 ml,https://cdn.carrefour.eu/160_05833253_4005900394132_00.jpeg,"4,95€",Per stuk,"19,80€",/l
155,Taft Remoldable cream paste jar 150 ml,https://cdn.carrefour.eu/160_05755845_5410091730529_00.jpeg,"5,29€",Per stuk,"35,27€",/l
156,Nectar of Beauty Omhullend Masker met Avocado en Galam 300 ml,https://cdn.carrefour.eu/160_05781120_3560070969319_00.jpeg,"3,39€",Per stuk,"11,30€",/l
157,Fructis - Hairfood Banana - Masker - 390ml,https://cdn.carrefour.eu/160_06007390_3600542129275_00.jpeg,"6,35€",Per stuk,"16,28€",/l
158,Schwarzkopf Gliss Kur Supreme Length Anti-Klit Spray 200 ml,https://cdn.carrefour.eu/160_06163439_5410091749019_01.jpeg,"6,75€",Per stuk,"33,75€",/l
159,Nivea Styling Spray Strong Hold 250 ml,https://cdn.carrefour.eu/160_05608796_4005900173997_00.jpeg,"2,54€",Per stuk,"10,16€",/l
160,Nivea Styling Spray Extra Strong 250 ml,https://cdn.carrefour.eu/160_05608809_4005900174260_00.jpeg,"2,54€",Per stuk,"10,16€",/l
161,Syoss Ceramide Complex Haarspray 400 ml,https://cdn.carrefour.eu/160_05838561_5410091733032_00.jpeg,"5,65€",Per stuk,"14,13€",/l
162,Syoss Shine & Hold Haarspray 400 ml,https://cdn.carrefour.eu/160_05838562_5410091733094_00.jpeg,"5,65€",Per stuk,"14,13€",/l
163,Timotei Conditioner Pure Coconut 300 ml,https://cdn.carrefour.eu/160_06508106_8710522643891_00.jpeg,"3,95€",Per stuk,"13,17€",/l
164,Timotei Shampoo Pure Coconut 300 ml,https://cdn.carrefour.eu/160_06508101_8710522644034_00.jpeg,"3,59€",Per stuk,"11,97€",/l
165,Timotei Shampoo Golden Highlight 300 ml,https://cdn.carrefour.eu/160_06508102_8710522644010_00.jpeg,"3,59€",Per stuk,"11,97€",/l
166,Timotei Shampoo Detox Refresh 300 ml,https://cdn.carrefour.eu/160_06507806_8710522644003_00.jpeg,"3,25€",Per stuk,"10,83€",/l
167,Schwarzkopf Gliss Kur Total Repair Shampoo 250 ml,https://cdn.carrefour.eu/160_06506855_5410091752149_00.jpeg,"2,54€",Per stuk,"10,16€",/l
168,Syoss Ceramide Complex Haarspray 400 ml,https://cdn.carrefour.eu/160_05838561_5410091733032_00.jpeg,"5,65€",Per stuk,"14,13€",/l
169,Syoss Shine & Hold Haarspray 400 ml,https://cdn.carrefour.eu/160_05838562_5410091733094_00.jpeg,"5,65€",Per stuk,"14,13€",/l
170,Timotei Conditioner Pure Coconut 300 ml,https://cdn.carrefour.eu/160_06508106_8710522643891_00.jpeg,"3,95€",Per stuk,"13,17€",/l
171,Timotei Shampoo Pure Coconut 300 ml,https://cdn.carrefour.eu/160_06508101_8710522644034_00.jpeg,"3,59€",Per stuk,"11,97€",/l
172,Timotei Shampoo Golden Highlight 300 ml,https://cdn.carrefour.eu/160_06508102_8710522644010_00.jpeg,"3,59€",Per stuk,"11,97€",/l
173,Timotei Shampoo Detox Refresh 300 ml,https://cdn.carrefour.eu/160_06507806_8710522644003_00.jpeg,"3,25€",Per stuk,"10,83€",/l
174,Schwarzkopf Gliss Kur Total Repair Shampoo 250 ml,https://cdn.carrefour.eu/160_06506855_5410091752149_00.jpeg,"2,54€",Per stuk,"10,16€",/l
175,Schwarzkopf Gliss Kur Color Protect and Shine Shampoo 250 ml,https://cdn.carrefour.eu/160_06506853_5410091752200_00.jpeg,"2,54€",Per stuk,"10,16€",/l
176,SYOSS Shine Shampoo 440ml,https://cdn.carrefour.eu/160_06508580_5410091755256_00.jpeg,"4,59€",Per stuk,"10,43€",/l
