,article_name,article_img,article_base_price,article_SKU,article_big_price,article_big_price_type
0,Carrefour Apero Time Hummus Natuur 200 g,https://cdn.carrefour.eu/160_05713286_5400101047785_00.jpeg,"2,00€",Per stuk,"10,00€",/kg
1,Carrefour Sensation Apero Time Gouda & Cheddar 140 g,https://cdn.carrefour.eu/160_04529609_5400101247031_00.jpeg,"2,50€",Per stuk,"17,86€",/kg
2,Carrefour Bord 3 Smaken 360 g,https://cdn.carrefour.eu/160_05290068_3560070707874_00.jpeg,"3,59€",Per stuk,"11,97€",/kg
3,Carrefour 8 Mini Nems Varken 260 g,https://cdn.carrefour.eu/160_05309924_3560070681198_00.jpeg,"2,69€",Per stuk,"10,35€",/kg
4,Carrefour Sensation Mini Loempia met Kip Zoetzure Saus 12 Stuks 340 g,https://cdn.carrefour.eu/160_04449708_5400101241640_00.jpeg,"4,75€",Per stuk,"13,97€",/kg
5,Carrefour Classic' Gran Antipasto Fijne Sneden 150 g,https://cdn.carrefour.eu/160_01797083_5400101209176_00.jpeg,"4,65€",Per stuk,"31,00€",/kg
6,Carrefour Mini Salami Gerookt met Beukenhout 150 g,https://cdn.carrefour.eu/160_01637792_5400101162396_00.jpeg,"2,49€",Per stuk,"16,60€",/kg
7,Carrefour Sensation Kippenhapjes Gemarineerd & Gebakken 500 g,https://cdn.carrefour.eu/160_04506852_5400101245723_00.jpeg,"4,00€",Per stuk,"8,00€",/kg
8,Carrefour Crispy Bacon 80 g,https://cdn.carrefour.eu/160_04558873_5400101249875_00.jpeg,"2,65€",Per stuk,"33,13€",/kg
9,Carrefour Droge Miniworstjes Maxi Format 200 g,https://cdn.carrefour.eu/160_05095310_3245413444790_00.jpeg,"2,99€",Per stuk,"14,95€",/kg
10,Carrefour Sensation Apero Time Salami 150 g,https://cdn.carrefour.eu/160_05121013_5400101021242_00.jpeg,"2,00€",Per stuk,"13,33€",/kg
11,Carrefour Sensation Apero Time Mini Balletjes 150 g,https://cdn.carrefour.eu/160_05121015_5400101021259_00.jpeg,"2,50€",Per stuk,"16,67€",/kg
12,Carrefour Sensation Apero Time Fuet Spaanse Specialiteit 125 g,https://cdn.carrefour.eu/160_05121016_5400101021266_00.jpeg,"3,00€",Per stuk,"24,00€",/kg
13,Carrefour Salami zonder Look 200 g,https://cdn.carrefour.eu/160_01637940_5400101162365_00.jpeg,"2,75€",Per stuk,"13,75€",/kg
14,Carrefour Salami met Look 200 g,https://cdn.carrefour.eu/160_01637941_5400101162341_00.jpeg,"2,75€",Per stuk,"13,75€",/kg
15,Carrefour Sensation Apero Time Gouda Belegen 140 g,https://cdn.carrefour.eu/160_04543538_5400101248502_00.jpeg,"2,50€",Per stuk,"17,86€",/kg
16,Carrefour Mini Salami met Look 150 g,https://cdn.carrefour.eu/160_04691036_5400101258372_00.jpeg,"2,49€",Per stuk,"16,60€",/kg
17,Carrefour Sensation Apero Time Gouda met Mosterdsaus Selderijzout 425g,https://cdn.carrefour.eu/160_05741113_5400101048942_00.jpeg,"5,00€",Per stuk,"11,76€",/kg
18,"Carrefour Sensation Bruschetta Capra Geitenkaas, Spek, Honing 185 g",https://cdn.carrefour.eu/160_05724209_5400101048485_00.jpeg,"6,00€",Per stuk,"32,43€",/kg
19,Carrefour Sensation Apero Time Kippenspiesjes 100 g,https://cdn.carrefour.eu/160_05604431_5400101048690_00.jpeg,"2,50€",Per stuk,"25,00€",/kg
20,Carrefour Droge Miniworstjes 75 g,https://cdn.carrefour.eu/160_05217209_3560070692842_00.jpeg,"1,19€",Per stuk,"15,87€",/kg
21,Carrefour 8 Mini Nems Garnaal 260 g,https://cdn.carrefour.eu/160_05409994_3560070681259_00.jpeg,"2,75€",Per stuk,"10,58€",/kg
22,"Carrefour Sensation Apero Time Gouda Salami Mosterd, Selderijzout 325g",https://cdn.carrefour.eu/160_05750934_5400101254688_00.jpeg,"5,00€",Per stuk,"15,38€",/kg
23,Carrefour Sensation Apero Time Abdijkaas 150 g,https://cdn.carrefour.eu/160_05731645_5400101048812_00.jpeg,"3,50€",Per stuk,"23,33€",/kg
24,Carrefour Droge Worst Puur Varkensvlees 250 g,https://cdn.carrefour.eu/160_05438218_5400101034600_00.jpeg,"2,09€",Per stuk,"8,36€",/kg
25,Carrefour Sensation Apero Time Droge Worst Natuur 125 g,https://cdn.carrefour.eu/160_05493177_5400101048867_00.jpeg,"3,00€",Per stuk,"24,00€",/kg
26,Carrefour Groene Olijven Ontpit 335 g,https://cdn.carrefour.eu/160_01739201_3560071159443_00.jpeg,"0,85€",Per stuk,"5,31€",/kg
27,Carrefour Sensation Apero Time Guacamole 200 g,https://cdn.carrefour.eu/160_05713281_5400101047761_00.jpeg,"3,00€",Per stuk,"15,00€",/kg
28,Carrefour Apero Time Halfgedroogde Tomaten 150 g,https://cdn.carrefour.eu/160_05713300_5400101047792_00.jpeg,"2,50€",Per stuk,"16,67€",/kg
29,Carrefour Sensation Apero Time Tzatziki 175 g,https://cdn.carrefour.eu/160_05713302_5400101047808_00.jpeg,"2,00€",Per stuk,"12,50€",/kg
30,Carrefour Apero Time Mini Rode Paprika's met Ricotta 150 g,https://cdn.carrefour.eu/160_05713331_5400101047822_00.jpeg,"3,00€",Per stuk,"20,00€",/kg
31,Carrefour Sensation Apero Time Gouda & Cheddar 140 g,https://cdn.carrefour.eu/160_04529609_5400101247031_00.jpeg,"2,50€",Per stuk,"17,86€",/kg
32,"Carrefour Dip Tomatentapenade, Hummus, Guacamole en Tzatziki 350 g",https://cdn.carrefour.eu/160_06003034_5400101064256_00.jpeg,"4,00€",Per stuk,"11,43€",/kg
33,Carrefour Snack Paprika's 150 g,https://cdn.carrefour.eu/160_06062451_5400101067103_00.jpeg,"2,00€",Per stuk,"13,33€",/kg
34,Carrefour Snack Radijzen 200 g,https://cdn.carrefour.eu/160_06062453_5400101067127_00.jpeg,"1,49€",Per stuk,"7,45€",/kg
35,Carrefour Snack Komkommers 200 g,https://cdn.carrefour.eu/160_06062455_5400101067141_00.jpeg,"2,89€",Per stuk,"14,45€",/kg
36,"Carrefour Sensation Bruschetta Capra Geitenkaas, Spek, Honing 185 g",https://cdn.carrefour.eu/160_05724209_5400101048485_00.jpeg,"6,00€",Per stuk,"32,43€",/kg
37,Carrefour Sensation Apero Time Kippenspiesjes 100 g,https://cdn.carrefour.eu/160_05604431_5400101048690_00.jpeg,"2,50€",Per stuk,"25,00€",/kg
38,Carrefour Droge Miniworstjes 75 g,https://cdn.carrefour.eu/160_05217209_3560070692842_00.jpeg,"1,19€",Per stuk,"15,87€",/kg
39,Carrefour Sensation Apero Time Gouda met Mosterdsaus Selderijzout 425g,https://cdn.carrefour.eu/160_05741113_5400101048942_00.jpeg,"5,00€",Per stuk,"11,76€",/kg
40,Carrefour Sensation Apero Time Tarama 200 g,https://cdn.carrefour.eu/160_05484085_5400101217188_00.jpeg,"2,00€",Per stuk,"10,00€",/kg
41,"Carrefour Sensation Apero Time Gouda Salami Mosterd, Selderijzout 325g",https://cdn.carrefour.eu/160_05750934_5400101254688_00.jpeg,"5,00€",Per stuk,"15,38€",/kg
42,Carrefour Bladerdeeg met Geitenkaas met Honing 2 x 50 g,https://cdn.carrefour.eu/160_04857814_5400101006171_00.jpeg,"2,59€",Per stuk,"25,90€",/kg
43,Carrefour Sensation Apero Time Mini Pizzas Bolognese 128 g,https://cdn.carrefour.eu/160_04859599_5400101006683_00.jpeg,"4,00€",Per stuk,"31,25€",/kg
44,Carrefour Chorizo Pikant 225 g,https://cdn.carrefour.eu/160_05862338_3560071252052_00.jpeg,"2,25€",Per stuk,"10,00€",/kg
45,Carrefour Chorizo Mild 225 g,https://cdn.carrefour.eu/160_05862307_3560071252038_00.jpeg,"2,25€",Per stuk,"10,00€",/kg
46,Carrefour Apero Time Tarama Premium met Gerookte Kabeljauweieren 180 g,https://cdn.carrefour.eu/160_05931442_5400101059184_00.jpeg,"2,50€",Per stuk,"13,89€",/kg
47,Carrefour 8 Mini Nems Garnaal 260 g,https://cdn.carrefour.eu/160_05409994_3560070681259_00.jpeg,"2,75€",Per stuk,"10,58€",/kg
48,Carrefour Sensation Apero Time Olijven met Knoflook 150 g,https://cdn.carrefour.eu/160_06490058_5400101079748_00.jpeg,"2,50€",Per stuk,"16,67€",/kg
49,Carrefour Apero Time Pikante Olijven 150 g,https://cdn.carrefour.eu/160_06490059_5400101079755_00.jpeg,"2,50€",Per stuk,"16,67€",/kg
50,Carrefour Sensation Apero Time Olijven met Knoflook 400 g,https://cdn.carrefour.eu/160_06490061_5400101079762_00.jpeg,"4,50€",Per stuk,"11,25€",/kg
51,Carrefour Sensation Apero Time Groene Olijven Ontpitte 150 g,https://cdn.carrefour.eu/160_06490062_5400101079779_00.jpeg,"2,50€",Per stuk,"16,67€",/kg
52,Carrefour Apero Time Olijven met Kaas 400 g,https://cdn.carrefour.eu/160_06490063_5400101079786_00.jpeg,"4,50€",Per stuk,"11,25€",/kg
53,Carrefour Apero Time Focaccine 110 g,https://cdn.carrefour.eu/160_06365947_5400101077294_00.jpeg,"2,00€",Per stuk,"18,18€",/kg
54,Carrefour Apero Time Piquillo Paprika Dip 175 g,https://cdn.carrefour.eu/160_06192365_5400101072442_00.jpeg,"2,50€",Per stuk,"14,29€",/kg
55,Carrefour The Market Gedroogde Worsten 300 g,https://cdn.carrefour.eu/160_06635037_5400101084391_00.jpeg,"6,00€",Per stuk,"20,00€",/kg
56,Carrefour The Market Salami met Parmezaan 130 g,https://cdn.carrefour.eu/160_06635061_5400101084438_00.jpeg,"3,40€",Per stuk,"26,15€",/kg
57,Carrefour Kroepoek met Garnalen 70 g,https://cdn.carrefour.eu/160_04888804_5400101242906_00.jpeg,"1,29€",Per stuk,"18,43€",/kg
58,Carrefour Sensation Apero Time Mezze 400 g,https://cdn.carrefour.eu/160_04449914_5400101241695_00.jpeg,"4,50€",Per stuk,"11,25€",/kg
59,Carrefour Bladerdeeg met Geitenkaas Natuur 2 x 50 g,https://cdn.carrefour.eu/160_06012335_5400101064515_00.jpeg,"2,59€",Per stuk,"25,90€",/kg
60,Carrefour Extra Geitenkaas met Spek 2 x 65 g,https://cdn.carrefour.eu/160_04978006_5400101016514_00.jpeg,"2,49€",Per stuk,"19,15€",/kg
61,Carrefour Apero Time Hummus Pikant 200 g,https://cdn.carrefour.eu/160_05713284_5400101047778_00.jpeg,"2,00€",Per stuk,"10,00€",/kg
62,Carrefour Garnaalbeignets 8 Stuks 140 g,https://cdn.carrefour.eu/160_05409976_3245412763540_00.jpeg,"2,85€",Per stuk,"20,36€",/kg
63,"Carrefour Sensation Bruschetta Rauwe Ham, Pesto, Mozzarella 185 g",https://cdn.carrefour.eu/160_05724211_5400101048492_00.jpeg,"6,00€",Per stuk,"32,43€",/kg
64,Carrefour Extra Geitenkaas met Spek 6 x 25 g,https://cdn.carrefour.eu/160_04978048_5400101014992_00.jpeg,"3,35€",Per stuk,"22,33€",/kg
65,Carrefour Apero Time Olijven met Kaas 150 g,https://cdn.carrefour.eu/160_06490037_5400101079731_00.jpeg,"2,50€",Per stuk,"16,67€",/kg
66,Zwan  Worst  TV natuur  Aperitiefhapjes 230 g,https://cdn.carrefour.eu/160_06261658_8710604742825_00.jpeg,"1,69€",Per stuk,"7,35€",/kg
67,Aoste Bistro Patron 230 g,https://cdn.carrefour.eu/160_01095612_5411363101641_00.jpeg,"4,35€",Per stuk,"18,91€",/kg
68,St Môret Apérifrais Provençale 100 g,https://cdn.carrefour.eu/160_00807780_3480347120802_00.jpeg,"3,39€",Per stuk,"33,90€",/kg
69,Marcassou Marcachouffe zonder Look 8 Stuks 200 g,https://cdn.carrefour.eu/160_01198615_5410916075774_00.jpeg,"3,49€",Per stuk,"17,45€",/kg
70,Justin Bridou Le Bâton de Berger Noisette 250 g,https://cdn.carrefour.eu/160_01095176_3449851140553_00.jpeg,"8,25€",Per stuk,"33,00€",/kg
71,Meggle Klassik Baguette Kruidenboter 160 g,https://cdn.carrefour.eu/160_04642863_4034900032409_00.jpeg,"2,36€",Per stuk,"14,75€",/kg
72,Marcassou Marcachouffe zonder Look 8 Stuks 200 g,https://cdn.carrefour.eu/160_01198615_5410916075774_00.jpeg,"3,49€",Per stuk,"17,45€",/kg
73,Justin Bridou Le Bâton de Berger Noisette 250 g,https://cdn.carrefour.eu/160_01095176_3449851140553_00.jpeg,"8,25€",Per stuk,"33,00€",/kg
74,Meggle Klassik Baguette Kruidenboter 160 g,https://cdn.carrefour.eu/160_04642863_4034900032409_00.jpeg,"2,36€",Per stuk,"14,75€",/kg
75,BiFi Bierworst 30 g,https://cdn.carrefour.eu/160_04723788_4251097400136_00.jpeg,"1,20€",Per stuk,"40,00€",/kg
76,BiFi The Original Carazza XXL 75 g,https://cdn.carrefour.eu/160_05882027_4251097400341_00.jpeg,"2,86€",Per stuk,"38,13€",/kg
77,Aubel Boerenworstjes 300 g,https://cdn.carrefour.eu/160_05609591_5410459000240_00.jpeg,"5,45€",Per stuk,"18,17€",/kg
78,Aoste XLarge Snacks Puur Varken 200 g,https://cdn.carrefour.eu/160_04611558_5411328024282_00.jpeg,"7,35€",Per stuk,"36,75€",/kg
79,Saint Agaûne au Comté 120 g,https://cdn.carrefour.eu/160_05877878_3450160007970_00.jpeg,"4,55€",Per stuk,"37,92€",/kg
80,Aoste Snacks Puur Varken 80 g,https://cdn.carrefour.eu/160_04345609_5411328017956_00.jpeg,"3,55€",Per stuk,"44,38€",/kg
81,Aoste Snacks Puur Kip 80 g,https://cdn.carrefour.eu/160_05204651_5411328042125_00.jpeg,"3,85€",Per stuk,"48,13€",/kg
82,Chimay Kubus met Trappistenbier à la Chimay Rouge 150 g,https://cdn.carrefour.eu/160_05285196_5412929000231_00.jpeg,"3,99€",Per stuk,"26,60€",/kg
83,Apéricube Nature 48 Blokjes 250 g,https://cdn.carrefour.eu/160_01753922_3073780857406_00.jpeg,"5,85€",Per stuk,"23,40€",/kg
84,Montorsi Premium Antipasto Italiano 130 g,https://cdn.carrefour.eu/160_05424942_8005153007304_00.jpeg,"6,29€",Per stuk,"48,38€",/kg
85,Noel Fuet Catalan 170 g,https://cdn.carrefour.eu/160_05467537_8410783013210_00.jpeg,"3,55€",Per stuk,"20,88€",/kg
86,Montorsi Cacciatore Salamini Italiani alla Cacciatora 140 g,https://cdn.carrefour.eu/160_04995156_8005153000442_00.jpeg,"2,90€",Per stuk,"20,71€",/kg
87,Marcassou Aperitivo's Licht Gerookt Family Pack 250 g,https://cdn.carrefour.eu/160_04940607_5411328120762_00.jpeg,"4,89€",Per stuk,"19,56€",/kg
88,Leerdammer Mini-Kaasschnitzels Natuur 4 x 40 g,https://cdn.carrefour.eu/160_06538161_3073781138597_00.jpeg,"4,25€",Per stuk,"26,56€",/kg
89,Zwan Worst TV Natuur 3-Pack 3 x 230 g,https://cdn.carrefour.eu/160_06261662_8710604742849_00.jpeg,"5,03€",Per stuk,"21,87€",/kg
90,BiFi The Original Roll 3 x 45 g,https://cdn.carrefour.eu/160_06167427_4251097409818_00.jpeg,"3,29€",Per stuk,"24,37€",/kg
91,Apéricube Nature 24 Blokjes 125 g,https://cdn.carrefour.eu/160_00199308_3073780561679_00.jpeg,"3,09€",Per stuk,"24,72€",/kg
92,Apéricube Original 24 Blokjes 125 g,https://cdn.carrefour.eu/160_00199346_3073780522397_00.jpeg,"3,59€",Per stuk,"28,72€",/kg
93,Carrefour Bio Groene Olijven Ontpit 230 g,https://cdn.carrefour.eu/160_06466467_5400101079151_00.jpeg,"1,59€",Per stuk,"12,23€",/kg
94,Old Amsterdam Voorgesneden Borrelblokjes 170 g,https://cdn.carrefour.eu/160_06347393_52000000245_00.jpeg,"4,55€",Per stuk,"26,76€",/kg
95,Reflets de France Rosette de Lyon 400 g,https://cdn.carrefour.eu/160_01738870_3245390028884_00.jpeg,"6,19€",Per stuk,"15,48€",/kg
96,Aoste Stickado Classique Salami-Sticks 70 g,https://cdn.carrefour.eu/160_05446574_3449851328005_00.jpeg,"3,19€",Per stuk,"45,57€",/kg
97,Aoste Stickado Pikanto Salami - Sticks Paprika 70 g,https://cdn.carrefour.eu/160_05446575_3449851353007_00.jpeg,"3,19€",Per stuk,"45,57€",/kg
98,Simpl Mini Droge Worstjes 120 g,https://cdn.carrefour.eu/160_05519196_5400101039742_00.jpeg,"1,59€",Per stuk,"13,25€",/kg
99,Campofrio Tapas Chorizo Picante 225 g,https://cdn.carrefour.eu/160_05019013_8410320006316_00.jpeg,"4,99€",Per stuk,"22,18€",/kg
100,Campofrio Tapas Chorizo Dulce 225 g,https://cdn.carrefour.eu/160_05019014_8410320006323_00.jpeg,"4,99€",Per stuk,"22,18€",/kg
101,Brugge Belegen Kubus 150 g,https://cdn.carrefour.eu/160_05332639_5413721113068_00.jpeg,"5,15€",Per stuk,"34,33€",/kg
102,BiFi The Orginal XL Snack Pack 80 g,https://cdn.carrefour.eu/160_05636265_4251097402307_00.jpeg,"5,05€",Per stuk,"63,13€",/kg
103,Boursin Aperitief kaas Smoked Ham Sjalot & Bieslook Rolls 100 g,https://cdn.carrefour.eu/160_05718640_3073781057027_00.jpeg,"5,69€",Per stuk,"56,90€",/kg
104,Le Petit Galopin Geitenkaas met Spek 150 g,https://cdn.carrefour.eu/160_05220171_5413518222270_00.jpeg,"4,00€",Per stuk,"26,67€",/kg
105,Simpl Mini Salami Sticks 100 g,https://cdn.carrefour.eu/160_05869770_5400101056343_00.jpeg,"1,85€",Per stuk,"18,50€",/kg
106,Negroni Coppa Tradizionale 50 g,https://cdn.carrefour.eu/160_05955633_8028257000880_00.jpeg,"3,49€",Per stuk,"69,80€",/kg
107,Negroni Prosciutto Crudo di Collina 50 g,https://cdn.carrefour.eu/160_05955779_8028257000842_00.jpeg,"3,49€",Per stuk,"69,80€",/kg
108,Marcassou Aperitivo's Licht Gerookt Family Pack 250 g,https://cdn.carrefour.eu/160_04940607_5411328120762_00.jpeg,"4,89€",Per stuk,"19,56€",/kg
109,Reflets de France Rosette de Lyon 400 g,https://cdn.carrefour.eu/160_01738870_3245390028884_00.jpeg,"6,19€",Per stuk,"15,48€",/kg
110,Caprice des Dieux 300 g,https://cdn.carrefour.eu/160_05169140_3161712963223_00.jpeg,"4,65€",Per stuk,"15,50€",/kg
111,Père Olive Pecorino & Gedroogde Tomaten 150 g,https://cdn.carrefour.eu/160_06647058_5413588622840_00.jpeg,"3,19€",Per stuk,"21,27€",/kg
112,Père Olive Gedroogde Tomaten met Basilicum 90 g,https://cdn.carrefour.eu/160_06647059_5413588601197_00.jpeg,"2,49€",Per stuk,"2,77€",/kg
113,Père Olive Griekse Olijven Knoflook & Kruiden 150 g,https://cdn.carrefour.eu/160_06647060_5413588600930_00.jpeg,"3,19€",Per stuk,"21,27€",/kg
114,Père Olive Griekse Olijven met Provençaalse-Kruiden 150 g,https://cdn.carrefour.eu/160_06647061_5413588600978_00.jpeg,"3,19€",Per stuk,"21,27€",/kg
115,Père Olive Griekse Olijven Uien & Kruiden 150 g,https://cdn.carrefour.eu/160_06647065_5413588603061_00.jpeg,"3,19€",Per stuk,"21,27€",/kg
116,Père Olive Kaas & Basilicum 150 g,https://cdn.carrefour.eu/160_06647068_5413588600954_00.jpeg,"3,19€",Per stuk,"21,27€",/kg
117,Père Olive Citroen & Oregano 150 g,https://cdn.carrefour.eu/160_06647070_5413588601012_00.jpeg,"3,19€",Per stuk,"21,27€",/kg
118,Père Olive Halkidiki Extra Griekse Olijven 150 g,https://cdn.carrefour.eu/160_06647071_5413588601111_00.jpeg,"3,19€",Per stuk,"21,27€",/kg
119,Père Olive Nocellara met Vier Pepers 140 g,https://cdn.carrefour.eu/160_06647080_5413588623557_00.jpeg,"3,19€",Per stuk,"22,79€",/kg
120,Père Olive Caviar de Tomates 100 g,https://cdn.carrefour.eu/160_06647084_5413588603160_00.jpeg,"1,99€",Per stuk,"19,90€",/kg
121,Père Olive Caviar d'Aubergine Gegrilde Aubergine & Knoflook 175 g,https://cdn.carrefour.eu/160_06647108_5413588623366_00.jpeg,"2,60€",Per stuk,"14,86€",/kg
122,Pére Olive Hummus Gedroogde Tomaten 175 g,https://cdn.carrefour.eu/160_06647111_5413588622963_00.jpeg,"2,29€",Per stuk,"13,09€",/kg
123,Père Olive Grissini Italiens met Olijfolie 70 g,https://cdn.carrefour.eu/160_06647115_5413588623205_00.jpeg,"1,69€",Per stuk,"24,14€",/kg
124,Père Olive Bio Knoflook & Oregano 150 g,https://cdn.carrefour.eu/160_06647121_5413588617150_00.jpeg,"3,19€",Per stuk,"21,27€",/kg
125,Père Olive Ricotta Crémeuse Rode Paprika's & Basilicum 140 g,https://cdn.carrefour.eu/160_06637807_5413588624912_00.jpeg,"3,19€",Per stuk,"22,79€",/kg
126,Père Olive Feta Battue Rode & Gele Paprika's 140 g,https://cdn.carrefour.eu/160_06637988_5413588624936_00.jpeg,"3,19€",Per stuk,"22,79€",/kg
127,Leerdammer Mini-Kaasschnitzels Natuur 4 x 40 g,https://cdn.carrefour.eu/160_06538161_3073781138597_00.jpeg,"4,25€",Per stuk,"26,56€",/kg
128,BiFi The Original Roll 3 x 45 g,https://cdn.carrefour.eu/160_06167427_4251097409818_00.jpeg,"3,29€",Per stuk,"24,37€",/kg
129,Carrefour Bio Groene Olijven Ontpit 230 g,https://cdn.carrefour.eu/160_06466467_5400101079151_00.jpeg,"1,59€",Per stuk,"12,23€",/kg
130,Aoste Plus Bistro Time 120 g,https://cdn.carrefour.eu/160_06649859_5411761345418_00.jpeg,"3,55€",Per stuk,"29,58€",/kg
131,Aoste Plus Bistro Patron 150 g,https://cdn.carrefour.eu/160_06649865_5411761345401_00.jpeg,"3,65€",Per stuk,"25,27€",/kg
132,Père Olive Limited Edition Tzatziki met Griekse Yoghurt 175 g,https://cdn.carrefour.eu/160_06656110_5413588624783_00.jpeg,"2,79€",Per stuk,"18,60€",/kg
133,Père Olive Pecorino & Gedroogde Tomaten 150 g,https://cdn.carrefour.eu/160_06647058_5413588622840_00.jpeg,"3,19€",Per stuk,"21,27€",/kg
134,Père Olive Gedroogde Tomaten met Basilicum 90 g,https://cdn.carrefour.eu/160_06647059_5413588601197_00.jpeg,"2,49€",Per stuk,"2,77€",/kg
135,Père Olive Griekse Olijven Knoflook & Kruiden 150 g,https://cdn.carrefour.eu/160_06647060_5413588600930_00.jpeg,"3,19€",Per stuk,"21,27€",/kg
136,Père Olive Griekse Olijven met Provençaalse-Kruiden 150 g,https://cdn.carrefour.eu/160_06647061_5413588600978_00.jpeg,"3,19€",Per stuk,"21,27€",/kg
137,Père Olive Griekse Olijven Groene Naturel 150 g,https://cdn.carrefour.eu/160_06647063_5413588601043_00.jpeg,"3,19€",Per stuk,"21,27€",/kg
138,Père Olive Griekse Olijven Uien & Kruiden 150 g,https://cdn.carrefour.eu/160_06647065_5413588603061_00.jpeg,"3,19€",Per stuk,"21,27€",/kg
139,Père Olive Kaas & Basilicum 150 g,https://cdn.carrefour.eu/160_06647068_5413588600954_00.jpeg,"3,19€",Per stuk,"21,27€",/kg
140,Père Olive Citroen & Oregano 150 g,https://cdn.carrefour.eu/160_06647070_5413588601012_00.jpeg,"3,19€",Per stuk,"21,27€",/kg
141,Père Olive Halkidiki Extra Griekse Olijven 150 g,https://cdn.carrefour.eu/160_06647071_5413588601111_00.jpeg,"3,19€",Per stuk,"21,27€",/kg
142,Père Olive Griekse Olijven Knoflook & Kruiden 400 g,https://cdn.carrefour.eu/160_06647072_5413588602002_00.jpeg,"5,69€",Per stuk,"14,23€",/kg
143,Père Olive Nocellara met Vier Pepers 140 g,https://cdn.carrefour.eu/160_06647080_5413588623557_00.jpeg,"3,19€",Per stuk,"22,79€",/kg
144,Zwan Worst TV Natuur 3-Pack 3 x 230 g,https://cdn.carrefour.eu/160_06261662_8710604742849_00.jpeg,"5,03€",Per stuk,"21,87€",/kg
145,Saint Agaûne les Petites Tranches Nature 70 g,https://cdn.carrefour.eu/160_06171503_3450160001831_00.jpeg,"4,39€",Per stuk,"62,71€",/kg
146,Old Amsterdam Voorgesneden Borrelblokjes 170 g,https://cdn.carrefour.eu/160_06347393_52000000245_00.jpeg,"4,55€",Per stuk,"26,76€",/kg
147,Caprice des Dieux 300 g,https://cdn.carrefour.eu/160_05169140_3161712963223_00.jpeg,"4,65€",Per stuk,"15,50€",/kg
148,Leerdammer Mini-Kaasschnitzels Natuur 4 x 40 g,https://cdn.carrefour.eu/160_06538161_3073781138597_00.jpeg,"4,25€",Per stuk,"26,56€",/kg
149,BiFi The Original Roll 3 x 45 g,https://cdn.carrefour.eu/160_06167427_4251097409818_00.jpeg,"3,29€",Per stuk,"24,37€",/kg
150,Carrefour Bio Groene Olijven Ontpit 230 g,https://cdn.carrefour.eu/160_06466467_5400101079151_00.jpeg,"1,59€",Per stuk,"12,23€",/kg
151,Père Olive Ricotta Crémeuse Rode Paprika's & Basilicum 140 g,https://cdn.carrefour.eu/160_06637807_5413588624912_00.jpeg,"3,19€",Per stuk,"22,79€",/kg
152,Père Olive Feta Battue Rode & Gele Paprika's 140 g,https://cdn.carrefour.eu/160_06637988_5413588624936_00.jpeg,"3,19€",Per stuk,"22,79€",/kg
153,Aoste Plus Bistro Time 120 g,https://cdn.carrefour.eu/160_06649859_5411761345418_00.jpeg,"3,55€",Per stuk,"29,58€",/kg
154,Aoste Plus Bistro Patron 150 g,https://cdn.carrefour.eu/160_06649865_5411761345401_00.jpeg,"3,65€",Per stuk,"25,27€",/kg
155,Père Olive Limited Edition Tzatziki met Griekse Yoghurt 175 g,https://cdn.carrefour.eu/160_06656110_5413588624783_00.jpeg,"2,79€",Per stuk,"18,60€",/kg
156,Père Olive Hele Olijven op Griekse Wijze 200 g,https://cdn.carrefour.eu/160_06647064_5413588601036_00.jpeg,"3,19€",Per stuk,"15,95€",/kg
157,Père Olive Griekse Olijven Kalamata 120 g,https://cdn.carrefour.eu/160_06647074_5413588601081_00.jpeg,"3,19€",Per stuk,"26,58€",/kg
158,Père Olive Caviar de Tomates 100 g,https://cdn.carrefour.eu/160_06647084_5413588603160_00.jpeg,"1,99€",Per stuk,"19,90€",/kg
159,Père Olive Caviar d'Aubergine Gegrilde Aubergine & Knoflook 175 g,https://cdn.carrefour.eu/160_06647108_5413588623366_00.jpeg,"2,60€",Per stuk,"14,86€",/kg
160,Pére Olive Hummus Gedroogde Tomaten 175 g,https://cdn.carrefour.eu/160_06647111_5413588622963_00.jpeg,"2,29€",Per stuk,"13,09€",/kg
161,Père Olive Grissini Italiens met Olijfolie 70 g,https://cdn.carrefour.eu/160_06647115_5413588623205_00.jpeg,"1,69€",Per stuk,"24,14€",/kg
162,Père Olive Bio Knoflook & Oregano 150 g,https://cdn.carrefour.eu/160_06647121_5413588617150_00.jpeg,"3,19€",Per stuk,"21,27€",/kg
163,Marcassou Saucisson d'Ardenne IGP met Look 225 g,https://cdn.carrefour.eu/160_06686993_5411761343230_00.jpeg,"4,25€",Per stuk,"18,89€",/kg
164,Nitsiu Yakitori Teriyaki 5 x 22 g,https://cdn.carrefour.eu/160_06793232_5420030619075_00.jpeg,"4,25€",Per stuk,"38,64€",/kg
165,Nitsiu Loempia's met Kip 125 g,https://cdn.carrefour.eu/160_06793234_5420030619099_00.jpeg,"4,25€",Per stuk,"34,00€",/kg
166,Nitsiu Gyoza met Garnalen 5 x 24 g,https://cdn.carrefour.eu/160_06793230_5420030618993_00.jpeg,"4,25€",Per stuk,"35,42€",/kg
167,Nitsiu Loempia's met Groenten 130 g,https://cdn.carrefour.eu/160_06793231_5420030619037_00.jpeg,"4,25€",Per stuk,"32,69€",/kg
