,article_name,article_img,article_base_price,article_SKU,article_big_price,article_big_price_type
0,Iglo Mini Ravioli - Spinazie-roomsaus 400 g,https://cdn.carrefour.eu/160_06803542_5414807007424_00.jpeg,"3,15€",Per stuk,"7,88€",/kg
1,Iglo Macaroni met Ham en Kaas 450 g,https://cdn.carrefour.eu/160_01379912_5410148493308_00.jpeg,"3,05€",Per stuk,"6,78€",/kg
2,Iglo Lasagne Bolognese 450g,https://cdn.carrefour.eu/160_01380465_5410148495302_00.jpeg,"4,29€",Per stuk,"9,53€",/kg
3,Carrefour Gebakken Noedels met Garnalen 900 g,https://cdn.carrefour.eu/160_05288720_3560070673193_00.jpeg,"5,39€",Per stuk,"6,74€",/kg
4,Carrefour Sensation Paella Royal 1 kg,https://cdn.carrefour.eu/160_05294338_3270190026730_00.jpeg,"4,45€",Per stuk,"4,45€",/kg
5,Carrefour Wereld Thais Pannetje met Kip 900 g,https://cdn.carrefour.eu/160_05294360_3560070445820_00.jpeg,"4,99€",Per stuk,"5,54€",/kg
6,Carrefour Sensation Kantonese Rijst 900 g,https://cdn.carrefour.eu/160_05318701_3270190202769_00.jpeg,"4,25€",Per stuk,"4,72€",/kg
7,Carrefour Gebakken Gourmet Rijstpannetje met Kip en Champignons 900 g,https://cdn.carrefour.eu/160_05319049_3270190026716_00.jpeg,"4,59€",Per stuk,"5,10€",/kg
8,Carrefour Classic' Lasagne Bolognese 1 kg,https://cdn.carrefour.eu/160_06678394_3270190020073_00.jpeg,"4,29€",Per stuk,"4,29€",/kg
9,Carrefour Extra Gepaneerde Filets Zalm 360 g,https://cdn.carrefour.eu/160_06753206_3560071437626_00.jpeg,"6,99€",Per stuk,"19,42€",/kg
10,Carrefour Veggie Lasagne Type Bolognese Groenten & Tarwe 600 g,https://cdn.carrefour.eu/160_06440777_3560071240509_00.jpeg,"4,29€",Per stuk,"7,15€",/kg
11,Carrefour Sensation Dim Sum Stoom 12 Stuks 270 g,https://cdn.carrefour.eu/160_06459808_5400101079069_00.jpeg,"5,15€",Per stuk,"20,60€",/kg
12,Carrefour Classic' Kabeljauwfilets 800 g,https://cdn.carrefour.eu/160_06678440_5400101086166_00.jpeg,"9,49€",Per stuk,"11,86€",/kg
13,Iglo Witloofgratin met aardappelpuree 450 g,https://cdn.carrefour.eu/160_01379909_5410148496507_00.jpeg,"5,49€",Per stuk,"12,20€",/kg
14,Iglo Paella Valencia met kipfilets & garnalen 450 g,https://cdn.carrefour.eu/160_01379910_5410148492509_00.jpeg,"5,29€",Per stuk,"11,76€",/kg
15,Iglo Kabeljauwfilet Witte Wijnsaus en Groentjes 450 g,https://cdn.carrefour.eu/160_01380467_5410148493605_00.jpeg,"7,09€",Per stuk,"15,76€",/kg
16,Iglo Rundstong Madeirasaus 450 g,https://cdn.carrefour.eu/160_01381606_5410148499003_00.jpeg,"6,15€",Per stuk,"13,67€",/kg
17,Iglo Gehaktballetjes in Tomatensaus 450 g,https://cdn.carrefour.eu/160_01497502_5410148486003_00.jpeg,"5,09€",Per stuk,"11,31€",/kg
18,Iglo Aardappelgratin Gehakt Spinazie 450 g,https://cdn.carrefour.eu/160_01497506_5410148486102_00.jpeg,"5,29€",Per stuk,"11,76€",/kg
19,Iglo Braadworst met Wortelstamppot 450 g,https://cdn.carrefour.eu/160_01533009_5410148485501_00.jpeg,"5,55€",Per stuk,"12,33€",/kg
20,Simpl Nasi Goreng 750 g,https://cdn.carrefour.eu/160_04028000_5400101218642_00.jpeg,"1,89€",Per stuk,"2,52€",/kg
21,Iglo Spaghetti Bolognese 450 g,https://cdn.carrefour.eu/160_01361190_5410148493407_00.jpeg,"4,15€",Per stuk,"9,22€",/kg
22,Iglo Pasta Tagliatelle di Mare 450 g,https://cdn.carrefour.eu/160_01381607_5410148493704_00.jpeg,"7,15€",Per stuk,"15,89€",/kg
23,Iglo Kipfilets met witloof & aardappelpuree op z'n Belgisch 425 g,https://cdn.carrefour.eu/160_06018247_5414807005994_00.jpeg,"6,69€",Per stuk,"15,74€",/kg
24,Simpl Paella Zeevruchten 1 kg,https://cdn.carrefour.eu/160_05214885_3560070360512_00.jpeg,"3,19€",Per stuk,"3,19€",/kg
25,Iglo Zalmfilet Mosterdsaus en Groentjes 450 g,https://cdn.carrefour.eu/160_05256746_5414807003112_00.jpeg,"7,15€",Per stuk,"15,89€",/kg
26,Iglo Vispannetje Ostendaise 450 g,https://cdn.carrefour.eu/160_05457233_5414807004102_00.jpeg,"7,25€",Per stuk,"16,11€",/kg
27,Iglo Vol-au-Vent 425 g,https://cdn.carrefour.eu/160_05945809_5414807005802_00.jpeg,"6,09€",Per stuk,"14,33€",/kg
28,"Iglo Veggie Love Groentemix, Curry-Kokossaus 400 g",https://cdn.carrefour.eu/160_06683219_5414807007325_00.jpeg,"3,49€",Per stuk,"8,73€",/kg
29,Captain Iglo Visgratin Mediterraanse Groenten 380 g,https://cdn.carrefour.eu/160_06370151_5414807006656_00.jpeg,"4,69€",Per stuk,"12,34€",/kg
30,Captain Iglo Visgratin Tomaat en Mozzarella 380 g,https://cdn.carrefour.eu/160_06370153_5414807006670_00.jpeg,"4,69€",Per stuk,"12,34€",/kg
31,Simply Gratin Macaroni 1 kg,https://cdn.carrefour.eu/160_06481705_5400101079540_00.jpeg,"3,95€",Per stuk,"3,95€",/kg
32,Iglo Green Cuisine Veggie Bowl Fusilli groente pesto 380 g,https://cdn.carrefour.eu/160_06266191_5414807006601_00.jpeg,"4,25€",Per stuk,"11,18€",/kg
33,Iglo Green Cuisine Veggie Bowl Thai Curry 380 g,https://cdn.carrefour.eu/160_06266202_5414807006618_00.jpeg,"4,25€",Per stuk,"11,18€",/kg
34,Iglo Green Cuisine spinazie sticks met room 284g,https://cdn.carrefour.eu/160_06517616_5414807006878_00.jpeg,"2,65€",Per stuk,"9,33€",/kg
35,Iglo Green Cuisine Falafel 450g,https://cdn.carrefour.eu/160_06527120_5414807006960_00.jpeg,"4,25€",Per stuk,"9,44€",/kg
36,Iglo Kipfilet Archiducsaus 425 g,https://cdn.carrefour.eu/160_06018246_5414807005987_00.jpeg,"6,15€",Per stuk,"14,47€",/kg
37,Iglo Waterzooi op zijn Gents 425 g,https://cdn.carrefour.eu/160_05945787_5414807005796_00.jpeg,"6,15€",Per stuk,"14,47€",/kg
38,Iglo Kipfilet Pepersaus Rösti en Prinsessenbonen 425 g,https://cdn.carrefour.eu/160_05936717_5414807005789_00.jpeg,"6,25€",Per stuk,"14,71€",/kg
39,Ben's Original Express Rijst met Groenten 250 g,https://cdn.carrefour.eu/160_06385630_3487400005618_00.jpeg,"2,28€",Per stuk,"9,12€",/kg
40,Captain Iglo Visgratin Groene Groenten met Crumble Topping 380 g,https://cdn.carrefour.eu/160_06508622_5414807006687_00.jpeg,"4,69€",Per stuk,"12,34€",/kg
41,Iglo Kipfilets met witloof & aardappelpuree op z'n Belgisch 425 g,https://cdn.carrefour.eu/160_06018247_5414807005994_00.jpeg,"6,69€",Per stuk,"15,74€",/kg
42,Captain Iglo Visgratin Tomaat & Paprika Pikant 380 g,https://cdn.carrefour.eu/160_06645289_5414807007196_00.jpeg,"4,69€",Per stuk,"12,34€",/kg
43,Iglo Green Cuisine Lasagne Bolognese met Vegetarisch Gehakt 450 g,https://cdn.carrefour.eu/160_06533047_5414807006939_00.jpeg,"4,15€",Per stuk,"9,22€",/kg
44,Captain Iglo Visgratin Broccoli Vleugje Mosterd & Crumble Topping 380g,https://cdn.carrefour.eu/160_06607305_5414807007189_00.jpeg,"4,69€",Per stuk,"12,34€",/kg
45,Iglo Green Cuisine Vegetarische Nuggets 250 g,https://cdn.carrefour.eu/160_06751174_5414807007219_00.jpeg,"3,65€",Per stuk,"14,60€",/kg
46,Iglo Green Cuisine Veggie Bowl Groenten Chili 380 g,https://cdn.carrefour.eu/160_06645295_5414807007288_00.jpeg,"4,19€",Per stuk,"11,03€",/kg
47,Captain Iglo Captain's Classics Zonnebloem & Lijnzaad 220 g,https://cdn.carrefour.eu/160_06768493_5414807007394_00.jpeg,"4,15€",Per stuk,"18,86€",/kg
48,Carrefour Bio Risotto met Spinazie & Kaas 600 g,https://cdn.carrefour.eu/160_06098325_5400101070677_00.jpeg,"3,99€",Per stuk,"6,65€",/kg
