,article_name,article_img,article_base_price,article_SKU,article_big_price,article_big_price_type
0,Carrefour Wellness Time Sfeerkaars 150 g,https://cdn.carrefour.eu/160_05940845_3560071009274_00.jpeg,"3,39€",Per stuk,"3,39€",/stuk
1,Carrefour Luchtverfrisser Gel Lavendel 150 g,https://cdn.carrefour.eu/160_05034142_3560071313456_00.jpeg,"0,49€",Per stuk,"3,27€",/kg
2,Carrefour Red Love Sfeerkaars 150 g,https://cdn.carrefour.eu/160_05940875_3560071009236_00.jpeg,"3,39€",Per stuk,"3,39€",/stuk
3,Carrefour Deo Frigo,https://cdn.carrefour.eu/160_05227734_3560071245603_00.jpeg,"2,09€",Per stuk,"2,09€",/stuk
4,Carrefour Vanille Geurkaars 100 g,https://cdn.carrefour.eu/160_06242391_3560071186036_00.jpeg,"2,39€",Per stuk,"2,39€",/stuk
5,Carrefour Amber & Tonka Geurkaars 100 g,https://cdn.carrefour.eu/160_06242402_3560071186067_00.jpeg,"2,39€",Per stuk,"2,39€",/stuk
6,Carrefour Essential Spray Luchtverfrisser Vanille 300 ml,https://cdn.carrefour.eu/160_06621003_3560071271862_00.jpeg,"0,99€",Per stuk,"3,30€",/l
7,Carrefour Essential Spray Luchtverfrisser Lavandel 300 ml,https://cdn.carrefour.eu/160_06643800_3560071271770_00.jpeg,"1,09€",Per stuk,"3,63€",/l
8,Carrefour Essential Navulling Automatische Spray Kersenbloesem 250 ml,https://cdn.carrefour.eu/160_06646280_3560071272227_00.jpeg,"2,59€",Per stuk,"10,76€",/l
9,Carrefour Essential Navulling Automatische Spray Vanille 250 ml,https://cdn.carrefour.eu/160_06646282_3560071272197_00.jpeg,"2,69€",Per stuk,"10,76€",/l
10,Carrefour Essential Navulling Automatische Spray Lavendel 250 ml,https://cdn.carrefour.eu/160_06646326_3560071272135_00.jpeg,"2,69€",Per stuk,"10,76€",/l
11,Carrefour Essential Ochtenddauw 250 ml,https://cdn.carrefour.eu/160_06665062_3560071272104_00.jpeg,"6,49€",Per stuk,"6,49€",/stuk
12,Carrefour Essential Luchtverfrissergel Vanille,https://cdn.carrefour.eu/160_06675721_3560071401283_00.jpeg,"0,95€",Per stuk,"6,33€",/kg
13,Carrefour Essential Luchtverfrisser Wiek Kersenbloesem 375 ml,https://cdn.carrefour.eu/160_06686878_3560071400392_00.jpeg,"1,05€",Per stuk,"2,80€",/l
14,Carrefour Essential Luchtverfrisser Wiek Ochtenddauw 375 ml,https://cdn.carrefour.eu/160_06686980_3560071400279_00.jpeg,"1,05€",Per stuk,"2,80€",/l
15,Carrefour Essential Luchtverfrisser Wiek Lavandel 375 ml,https://cdn.carrefour.eu/160_06686982_3560071400248_00.jpeg,"1,05€",Per stuk,"2,80€",/l
16,Air Wick Luchtverfrisser Spray Pure Aziatische Kersenbloesem 250 ml,https://cdn.carrefour.eu/160_05451013_3059943021693_00.jpeg,"3,99€",Per stuk,"15,96€",/l
17,Air Wick Luchtverfrisser Spray Pure Paarse Lavendel 250 ml,https://cdn.carrefour.eu/160_05587831_3059943023208_00.jpeg,"3,99€",Per stuk,"15,96€",/l
18,Glade®-Touch & Fresh- Muguet- 10ml,https://cdn.carrefour.eu/160_05174620_5000204817867_00.jpeg,"3,45€",Per stuk,"3,59€",/stuk
19,Glade®-aerosol-Sensual Sandalwood & Jasmine - 300ml,https://cdn.carrefour.eu/160_05508905_5000204771534_00.jpeg,"2,69€",Per stuk,"8,97€",/l
20,Air Wick Actieve Wiek Luchtverfrisser Lavendel en Kamille 375 ml,https://cdn.carrefour.eu/160_00980397_5410036471180_00.jpeg,"2,68€",Per stuk,"7,15€",/l
21,Glade Touch & Fresh Relaxing Zen 10 ml,https://cdn.carrefour.eu/160_05174622_5000204817836_00.jpeg,"3,45€",Per stuk,"3,59€",/stuk
22,Air Wick Actieve Wiek Luchtverfrisser Fresh Water 375 ml,https://cdn.carrefour.eu/160_00980398_5410036473818_00.jpeg,"2,68€",Per stuk,"7,15€",/l
23,Air Wick Deco Sphere Luchtverfrisser Mango & Limoen 75 ml,https://cdn.carrefour.eu/160_01752765_3059946079028_00.jpeg,"6,19€",Per stuk,"6,19€",/stuk
24,Air Wick Navulling Essential Mist Aroma Eucalyptus & Lavendel 20 ml,https://cdn.carrefour.eu/160_05960515_3059943024588_00.jpeg,"5,75€",Per stuk,"287,50€",/l
25,Glade Automatic Spray Pure Clean Linen 269 ml,https://cdn.carrefour.eu/160_06097753_5000204870367_00.jpeg,"4,45€",Per stuk,"16,54€",/l
26,Glade Vanilla & White Orchid 18 ml,https://cdn.carrefour.eu/160_06097770_5000204080513_00.jpeg,"5,25€",Per stuk,"5,45€",/stuk
27,Glade Pink Rose & Meringue 18 ml,https://cdn.carrefour.eu/160_06097773_5000204080575_00.jpeg,"5,25€",Per stuk,"5,45€",/stuk
28,Glade Sense & Spray Sensual Sandalwood & Jasmine 18 ml,https://cdn.carrefour.eu/160_06097845_5000204628319_00.jpeg,"4,49€",Per stuk,"4,65€",/stuk
29,Glade® Automatic Spray- Relaxing Zen -269 ml,https://cdn.carrefour.eu/160_06097847_5000204810936_00.jpeg,"4,45€",Per stuk,"16,54€",/l
30,Glade Automatic Spray Relaxing Zen 269 ml,https://cdn.carrefour.eu/160_06097919_5000204073416_00.jpeg,"7,89€",Per stuk,"30,45€",/l
31,Glade Vanilla & White Orchid 300 ml,https://cdn.carrefour.eu/160_06097952_5000204070224_00.jpeg,"3,15€",Per stuk,"10,83€",/l
32,Air Wick Elektrische Pure Lentedauw 19 ml Navulling,https://cdn.carrefour.eu/160_06063134_3059943025394_00.jpeg,"3,39€",Per stuk,"3,39€",/stuk
33,Air Wick Elektrische Geurverspreider Luchtverfrisser Katoen 19 ml,https://cdn.carrefour.eu/160_06063153_3059943025400_00.jpeg,"3,39€",Per stuk,"3,39€",/stuk
34,Air Wick Luchtverfrisser Spray Pure Aziatische Kersenbloesem 250 ml,https://cdn.carrefour.eu/160_05451013_3059943021693_00.jpeg,"3,99€",Per stuk,"15,96€",/l
35,Air Wick Luchtverfrisser Spray Pure Paarse Lavendel 250 ml,https://cdn.carrefour.eu/160_05587831_3059943023208_00.jpeg,"3,99€",Per stuk,"15,96€",/l
36,Air Wick Geurstokjes Pure Lentedauw 25 ml,https://cdn.carrefour.eu/160_06126296_5410036301326_00.jpeg,"9,59€",Per stuk,"9,59€",/stuk
37,Air Wick Geurstokjes Pure Zachtheid van Katoen 25 ml,https://cdn.carrefour.eu/160_06126311_5410036301319_00.jpeg,"9,59€",Per stuk,"9,59€",/stuk
38,Air Wick Luchtverfrisser Spray Pure Essential Oils Ontspannend 250 ml,https://cdn.carrefour.eu/160_05930563_3059943024427_00.jpeg,"5,85€",Per stuk,"23,40€",/l
39,Air Wick Luchtverfrisser Spray Pure Essential Oils Verfrissend 250 ml,https://cdn.carrefour.eu/160_05930564_3059943024434_00.jpeg,"5,85€",Per stuk,"23,40€",/l
40,Air Wick Geurstokjes Life Scents Zalige Zomer 30 ml,https://cdn.carrefour.eu/160_05529731_8710552363141_00.jpeg,"8,89€",Per stuk,"296,33€",/l
41,Air Wick Elektrische Life Scents Zalige Zomer Navulling 19 ml,https://cdn.carrefour.eu/160_05538573_3059943022805_00.jpeg,"3,85€",Per stuk,"3,85€",/stuk
42,Air Wick Life Scents Zalige Zomer Navulling 2x 19 ml,https://cdn.carrefour.eu/160_05541987_3059943022935_00.jpeg,"6,99€",Per stuk,"6,99€",/stuk
43,Air Wick Luchtverfrisser Spray Pure Zachtheid van Katoen 250 ml,https://cdn.carrefour.eu/160_05669720_3059943023161_00.jpeg,"3,99€",Per stuk,"15,96€",/l
44,Air Wick Luchtverfrisser Spray Pure Lentedauw 250 ml,https://cdn.carrefour.eu/160_05451143_3059943021709_00.jpeg,"3,99€",Per stuk,"15,96€",/l
45,Croc Odor Koelkast Ei 2 st.,https://cdn.carrefour.eu/160_05574216_3362290027509_00.jpeg,"5,99€",Per stuk,"5,99€",/stuk
46,Glade®-aerosol-Muguet- 300ml,https://cdn.carrefour.eu/160_05508906_5000204771862_00.jpeg,"2,69€",Per stuk,"8,97€",/l
47,Air Wick Deco Sphere Luchtverfrisser Mango & Limoen 75 ml,https://cdn.carrefour.eu/160_01752765_3059946079028_00.jpeg,"6,19€",Per stuk,"6,19€",/stuk
48,Air Wick Geurstokjes Pure Lentedauw 25 ml,https://cdn.carrefour.eu/160_06126296_5410036301326_00.jpeg,"9,59€",Per stuk,"9,59€",/stuk
49,Air Wick Geurstokjes Pure Zachtheid van Katoen 25 ml,https://cdn.carrefour.eu/160_06126311_5410036301319_00.jpeg,"9,59€",Per stuk,"9,59€",/stuk
50,Glade®-Duftkerze- I Love You- 224 g,https://cdn.carrefour.eu/160_06231263_5000204106480_00.jpeg,"4,25€",Per stuk,"4,25€",/stuk
51,Glade Romantic Vanilla Blossom 224 g,https://cdn.carrefour.eu/160_06231289_5000204105407_00.jpeg,"4,25€",Per stuk,"4,25€",/stuk
52,Glade Sense & Spray Pure Clean Linen 18 ml,https://cdn.carrefour.eu/160_06097641_5000204598988_00.jpeg,"4,19€",Per stuk,"4,19€",/stuk
53,Glade Sense & Spray Relaxing Zen 18 ml,https://cdn.carrefour.eu/160_06097647_5000204598896_00.jpeg,"4,19€",Per stuk,"4,19€",/stuk
54,Glade Sense & Spray Calm Lavender & Jasmine 18 ml,https://cdn.carrefour.eu/160_06097668_5000204595390_00.jpeg,"4,49€",Per stuk,"4,65€",/stuk
55,Glade Touch & Fresh Relaxing Zen 10 ml,https://cdn.carrefour.eu/160_06097675_5000204076417_00.jpeg,"3,29€",Per stuk,"3,29€",/stuk
56,Glade Touch & Fresh Marine 10 ml,https://cdn.carrefour.eu/160_06097709_5000204075861_00.jpeg,"3,35€",Per stuk,"3,35€",/stuk
57,Glade®-Sense & Spray Sensual Sandalwood & Jasmine -18 ml,https://cdn.carrefour.eu/160_06097711_5000204075205_00.jpeg,"7,35€",Per stuk,"7,35€",/stuk
58,Glade Sea Minerals & Magnolia 300 ml,https://cdn.carrefour.eu/160_06097730_5000204070330_00.jpeg,"3,15€",Per stuk,"10,83€",/l
59,Glade Pink Rose & Meringue 300 ml,https://cdn.carrefour.eu/160_06097732_5000204070361_00.jpeg,"3,15€",Per stuk,"10,83€",/l
60,Glade Sea Minerals & Magnolia 18 ml,https://cdn.carrefour.eu/160_06097735_5000204074642_00.jpeg,"5,25€",Per stuk,"5,45€",/stuk
61,Glade Automatic Spray Calm Lavender & Jasmine 269 ml,https://cdn.carrefour.eu/160_06097737_5000204862034_00.jpeg,"4,45€",Per stuk,"16,54€",/l
62,Febreze Vleugje Bloesem Luchtverfrisser Spray 300 ml,https://cdn.carrefour.eu/160_06319241_8001841478012_00.jpeg,"3,25€",Per stuk,"10,83€",/l
63,"Febreze Luchtverfrisser Auto Startset Vleugje Bloesem, 2 ml",https://cdn.carrefour.eu/160_06319245_4015600366124_00.jpeg,"3,55€",Per stuk,"3,55€",/stuk
64,"Febreze Badkamer & Toilet, Vleugje Bloesem Luchtverfrisser 7.5 ml",https://cdn.carrefour.eu/160_06319246_8001841583242_00.jpeg,"4,35€",Per stuk,"4,35€",/stuk
65,"Febreze Badkamer & Toilet, Katoen Bloesem Luchtverfrisser, 7.5 ml",https://cdn.carrefour.eu/160_06319247_8001841583273_00.jpeg,"4,35€",Per stuk,"4,35€",/stuk
66,Febreze Ochtend Dauw Luchtverfrisser Spray 300 ml,https://cdn.carrefour.eu/160_06319250_8001841478043_00.jpeg,"3,25€",Per stuk,"10,83€",/l
67,"Febreze Badkamer & Toilet, Ochtenddauw 7.5 ml",https://cdn.carrefour.eu/160_06319255_8001841583198_00.jpeg,"4,35€",Per stuk,"4,35€",/stuk
68,Glade Sense & Spray Muguet 18 ml,https://cdn.carrefour.eu/160_06097673_5000204598957_00.jpeg,"4,35€",Per stuk,"4,35€",/stuk
69,Botanica by Air Wick Geurkaars Magnolia uit Himalaya & Vanille 205 g,https://cdn.carrefour.eu/160_06380467_5410036304792_00.jpeg,"7,59€",Per stuk,"7,59€",/stuk
70,Glade®-Gel- Muguet -150g,https://cdn.carrefour.eu/160_06308185_5000204826760_00.jpeg,"1,81€",Per stuk,"12,07€",/kg
71,Botanica by Air Wick Roomspray Caribische Vetiver & Sandelhout 236 ml,https://cdn.carrefour.eu/160_06317330_3059943026841_00.jpeg,"6,19€",Per stuk,"26,23€",/l
72,Botanica by Air Wick Roomspray - Bergamot uit Italië & Granaatappel,https://cdn.carrefour.eu/160_06619393_3665468300894_00.jpeg,"7,25€",Per stuk,"30,85€",/l
73,Air Wick Essential Mist Luchtverfrisser Innerlijke Vreugde - Navulling,https://cdn.carrefour.eu/160_06620123_3665468300924_00.jpeg,"5,59€",Per stuk,"5,59€",/stuk
74,Febreze Elektrische Luchtverfrisser Startset Vleugje Bloesem20ml,https://cdn.carrefour.eu/160_06717635_4084500999770_00.jpeg,"5,85€",Per stuk,"5,85€",/stuk
75,Botanica by Air Wick Roomspray Caribische Vetiver & Sandelhout 236 ml,https://cdn.carrefour.eu/160_06317330_3059943026841_00.jpeg,"6,19€",Per stuk,"26,23€",/l
76,Botanica by Air Wick Geurkaars Magnolia uit Himalaya & Vanille 205 g,https://cdn.carrefour.eu/160_06380467_5410036304792_00.jpeg,"7,59€",Per stuk,"7,59€",/stuk
77,Febreze Elektrische Luchtverfrisser Startset Ochtend Dauw 20ml,https://cdn.carrefour.eu/160_06717636_4015400800705_00.jpeg,"6,45€",Per stuk,"322,50€",/l
78,Air Wick Pure Fresh Automatische Spray Aziatische Kersenbloesem 250 ml,https://cdn.carrefour.eu/160_06718301_8720065003557_00.jpeg,"9,29€",Per stuk,"9,29€",/stuk
79,Air Wick Lotusbloem Navulling Automatische Spray 250 ml,https://cdn.carrefour.eu/160_06718471_3059943021112_00.jpeg,"6,15€",Per stuk,"6,15€",/stuk
80,Air Wick Automatische Spray Ebenhout en Vanille 250 ml,https://cdn.carrefour.eu/160_06718475_3059943025363_00.jpeg,"9,45€",Per stuk,"9,45€",/stuk
81,Air Wick Pure Roze Vlinderbloesem Navulling Automatische Spray 250 ml,https://cdn.carrefour.eu/160_06718478_8720065000877_00.jpeg,"5,25€",Per stuk,"5,25€",/stuk
82,Air Wick Ebbenhout en Vanille Navulling Automatische Spray 250 ml,https://cdn.carrefour.eu/160_06720379_3059943021129_00.jpeg,"6,15€",Per stuk,"6,15€",/stuk
83,Air Wick Pure Patchouli Lavendel Navulling Automatische Spray 250 ml,https://cdn.carrefour.eu/160_06720388_8720065000969_00.jpeg,"6,15€",Per stuk,"6,15€",/stuk
84,Air Wick Automatische Spray Pure Fresh Lentedauw 250 ml,https://cdn.carrefour.eu/160_06718274_8720065003540_00.jpeg,"7,39€",Per stuk,"7,39€",/stuk
85,Air Wick Pure Citroenbloesem Navulling Automatische Spray 250 ml,https://cdn.carrefour.eu/160_06720378_8720065000952_00.jpeg,"6,15€",Per stuk,"6,15€",/stuk
86,Febreze Elektrische Luchtverfrisser Navulling Ochtend Dauw 20ml,https://cdn.carrefour.eu/160_06717624_4015400787174_00.jpeg,"5,35€",Per stuk,"267,50€",/l
87,Febreze 3Volution Elektrisch Navulling Ochtend Dauw 20ml,https://cdn.carrefour.eu/160_06717625_4015400801030_00.jpeg,"5,45€",Per stuk,"272,50€",/l
88,Air Wick Deco Sphere Luchtverfrisser Framboos & Amandelbloesem 75 mL,https://cdn.carrefour.eu/160_06720392_3059946079042_00.jpeg,"5,55€",Per stuk,"5,55€",/stuk
89,Febreze Elektrische Luchtverfrisser Startset Ochtend Dauw20ml,https://cdn.carrefour.eu/160_06717634_4084500999749_00.jpeg,"5,85€",Per stuk,"292,50€",/l
90,Febreze 3Volution Elektrische Luchtverfrisser Navulling Zeebries 20ml,https://cdn.carrefour.eu/160_06843978_8006540519851_00.jpeg,"6,35€",Per stuk,"317,50€",/l
91,Carrefour Eco Planet Geurkaars Monoi Tiare 130 g,https://cdn.carrefour.eu/160_06808492_3560071268473_00.jpeg,"2,99€",Per stuk,"2,99€",/stuk
92,Air Wick Pure Fresh Tropische Mango Navulling 250 ml,https://cdn.carrefour.eu/160_06720381_3059943026094_00.jpeg,"6,15€",Per stuk,"6,15€",/stuk
93,Air Wick Pure Paarse Lavendel du Midi Navulling 250 ml,https://cdn.carrefour.eu/160_06718469_8720065000884_00.jpeg,"5,25€",Per stuk,"5,25€",/stuk
94,Air Wick Pure Fris Linnen en Witte Seringenbloesem 250 ml,https://cdn.carrefour.eu/160_06718472_8720065000860_00.jpeg,"5,25€",Per stuk,"5,25€",/stuk
95,Air Wick Pure Jasmin en Witte Bloemen 250 ml,https://cdn.carrefour.eu/160_06718427_8720065000891_00.jpeg,"5,15€",Per stuk,"5,15€",/stuk
96,Botanica by Air Wick Magnolia uit de Himalaya & Vanille 120 g,https://cdn.carrefour.eu/160_06720390_8720065003625_00.jpeg,"5,19€",Per stuk,"43,25€",/kg
97,Botanica by Air Wick Caribische Vetiver & Sandelhout 120 g,https://cdn.carrefour.eu/160_06720391_8720065003601_00.jpeg,"5,19€",Per stuk,"43,25€",/kg
98,Botanica by Air Wick Oosterse Geranium & Rozen 120 g,https://cdn.carrefour.eu/160_06720389_8720065003618_00.jpeg,"5,19€",Per stuk,"43,25€",/kg
