,article_name,article_img,article_base_price,article_SKU,article_big_price,article_big_price_type
0,Carrefour Classic' Choco's 300 g,https://cdn.carrefour.eu/160_04021607_5400101214415_00.jpeg,"1,65€",Per stuk,"5,50€",/kg
1,Carrefour Pure Chocolade 2 x 200 g,https://cdn.carrefour.eu/160_01525446_5400101160620_00.jpeg,"2,19€",Per stuk,"5,48€",/kg
2,Carrefour Bio Zwarte Chocolade 74% Cacao 100 g,https://cdn.carrefour.eu/160_05747949_3270190127765_00.jpeg,"1,25€",Per stuk,"12,50€",/kg
3,Carrefour Bio Zwarte Chocolade Gekaramelliseerde  Amandel 100 g,https://cdn.carrefour.eu/160_05748040_3560070472918_00.jpeg,"1,75€",Per stuk,"17,50€",/kg
4,Carrefour De Banketbakkers Dessert 52% Cacao 200 g,https://cdn.carrefour.eu/160_04012699_3560071006327_00.jpeg,"1,55€",Per stuk,"7,75€",/kg
5,Carrefour Pralines 250 g,https://cdn.carrefour.eu/160_04564288_5400101250338_00.jpeg,"2,99€",Per stuk,"11,96€",/kg
6,Carrefour Pure Chocolade Fondant 2 x 200 g,https://cdn.carrefour.eu/160_04929956_3560070823857_00.jpeg,"1,49€",Per stuk,"3,73€",/kg
7,Carrefour Pick N' Choc Pinda Melkchocolade 250 g,https://cdn.carrefour.eu/160_05205959_3560070511921_00.jpeg,"1,19€",Per stuk,"4,76€",/kg
8,Carrefour Pop n' Croc Krokante Granen Melkchocolade 175 g,https://cdn.carrefour.eu/160_05197903_3560070504701_00.jpeg,"1,85€",Per stuk,"10,57€",/kg
9,Carrefour Witte Chocolade 2 x 200 g,https://cdn.carrefour.eu/160_04903603_3560070417797_00.jpeg,"2,99€",Per stuk,"7,48€",/kg
10,Carrefour Melkchocolade 2 x 200 g,https://cdn.carrefour.eu/160_01525447_5400101160637_00.jpeg,"2,29€",Per stuk,"5,73€",/kg
11,Carrefour Extra Truffel Cacao 175 g,https://cdn.carrefour.eu/160_04564286_5400101250314_00.jpeg,"1,59€",Per stuk,"9,09€",/kg
12,Carrefour Pure Chocolade met Pralinévulling 200 g,https://cdn.carrefour.eu/160_04927542_3560070428885_00.jpeg,"1,49€",Per stuk,"7,45€",/kg
13,Carrefour Melkchocolade met Pralinévulling 200 g,https://cdn.carrefour.eu/160_04929768_3560070428854_00.jpeg,"1,49€",Per stuk,"7,45€",/kg
14,Carrefour Witte Chocolade met Pralinévulling 200 g,https://cdn.carrefour.eu/160_04929770_3560070428823_00.jpeg,"1,49€",Per stuk,"7,45€",/kg
15,Carrefour Milk n' Nut Melkchocolade Stukjes Hazelnoot 200 g,https://cdn.carrefour.eu/160_05780169_3560070984046_00.jpeg,"2,19€",Per stuk,"10,95€",/kg
16,Carrefour Classic' 170 g,https://cdn.carrefour.eu/160_05509888_5400101038936_00.jpeg,"3,19€",Per stuk,"18,76€",/kg
17,Carrefour Heerlijke Blokjes Zwarte Chocolade Hele Hazelnoten 200 g,https://cdn.carrefour.eu/160_05487980_3560070776177_00.jpeg,"1,85€",Per stuk,"9,25€",/kg
18,Carrefour Heerlijke Blokjes Melkchocolade Hele Hazelnoten 200 g,https://cdn.carrefour.eu/160_05487982_3560070776207_00.jpeg,"1,85€",Per stuk,"9,25€",/kg
19,Carrefour Blokjes Melkchocolade Gekaramelliseerde Amandel & Zout 200 g,https://cdn.carrefour.eu/160_05488085_3560070853175_00.jpeg,"1,85€",Per stuk,"9,25€",/kg
20,Carrefour Extra Mini Chocolade Melk 30 Stuks 300 g,https://cdn.carrefour.eu/160_06315644_5400101076624_00.jpeg,"2,65€",Per stuk,"8,83€",/kg
21,Carrefour Extra Mini Chocolade Puur 30 Stuks 300 g,https://cdn.carrefour.eu/160_06317094_5400101076631_00.jpeg,"2,65€",Per stuk,"8,83€",/kg
22,Carrefour Bio Melkchocolade 100 g,https://cdn.carrefour.eu/160_06751147_3270190128151_00.jpeg,"1,49€",Per stuk,"14,90€",/kg
23,Carrefour Classic' Pure Chocolade 100 g,https://cdn.carrefour.eu/160_05215020_5400101258518_00.jpeg,"1,85€",Per stuk,"18,50€",/kg
24,Carrefour Kids Magische Eieren 3 x 20 g,https://cdn.carrefour.eu/160_05522085_5400101011328_00.jpeg,"1,59€",Per stuk,"26,50€",/kg
25,Milka LEO Chocolade Koeken 12 Repen 400 g,https://cdn.carrefour.eu/160_05596556_7622210464194_00.jpeg,"4,99€",Per stuk,"12,51€",/kg
26,Côte d'Or L'Original Pure Chocolade Tablet 400 g,https://cdn.carrefour.eu/160_05300059_7622210100078_00.jpeg,"4,15€",Per stuk,"10,38€",/kg
27,Côte d'Or Praliné Melk Chocolade Tablet Praliné Dessert 58 200 g,https://cdn.carrefour.eu/160_01449597_7622400010439_00.jpeg,"3,05€",Per stuk,"15,25€",/kg
28,Milka LEO GO Chocolade Koeken 6 Repen 288 g,https://cdn.carrefour.eu/160_05262760_7622210052612_00.jpeg,"4,52€",Per stuk,"15,69€",/kg
29,Côte d'Or L'Original Melk Chocolade Tablet 400 g,https://cdn.carrefour.eu/160_05300046_7622210100061_00.jpeg,"3,50€",Per stuk,"8,75€",/kg
30,Côte d'Or Culinaire Kookchocolade Pure Chocolade Tablet 400 g,https://cdn.carrefour.eu/160_04588587_7622300166984_00.jpeg,"7,09€",Per stuk,"17,73€",/kg
31,Côte d'Or Mignonnettes Melk Chocolade Praliné Double Lait 21 St 210 g,https://cdn.carrefour.eu/160_05178328_7622300733520_00.jpeg,"5,05€",Per stuk,"24,05€",/kg
32,Côte d'Or Chokotoff Pralines Chocolade snoepjes Melk Chocolade 500 g,https://cdn.carrefour.eu/160_05282995_7622210031921_00.jpeg,"5,67€",Per stuk,"11,34€",/kg
33,Milky Way 9 x 21.5 g,https://cdn.carrefour.eu/160_05309652_5000159507363_00.jpeg,"3,38€",Per stuk,"17,51€",/kg
34,Milka LEOgO Mini Chocolade Koeken 182 g,https://cdn.carrefour.eu/160_04857781_7622300348786_00.jpeg,"4,57€",Per stuk,"25,11€",/kg
35,Milka Leo Go! 48 g,https://cdn.carrefour.eu/160_04997333_7622400016769_00.jpeg,"1,09€",Per stuk,"22,71€",/kg
36,Côte d'Or Fin Intense Pure Chocolade Tablet Extra Puur 70% 100 g,https://cdn.carrefour.eu/160_01404132_7622400006753_00.jpeg,"2,35€",Per stuk,"23,50€",/kg
37,Côte d'Or Classic Pure Chocolade Tablet 150 g,https://cdn.carrefour.eu/160_00152488_5410081200933_00.jpeg,"1,83€",Per stuk,"12,20€",/kg
38,Côte d'Or Classic Melk Chocolade Tablet 150 g,https://cdn.carrefour.eu/160_00152495_5410081201008_00.jpeg,"1,83€",Per stuk,"12,20€",/kg
39,Ferrero Rocher 16 Stuks 200 g,https://cdn.carrefour.eu/160_04008171_8000500003787_00.jpeg,"5,76€",Per stuk,"28,80€",/kg
40,Côte d'Or Carrés Pralines Pure Chocolade Hele Hazelnoten 200 g,https://cdn.carrefour.eu/160_04368752_3045140015849_00.jpeg,"4,89€",Per stuk,"24,75€",/kg
41,Esprit de Fête Belgische Pralines 200 g,https://cdn.carrefour.eu/160_05098593_5413676702133_00.jpeg,"4,99€",Per stuk,"24,95€",/kg
42,Guylian The Original Fijne Belgische Chocolaatjes met Hazelnoot Pralinévulling 250 g,https://cdn.carrefour.eu/160_04002818_5410976710011_00.jpeg,"6,75€",Per stuk,"27,00€",/kg
43,Côte d'Or Classic Pure Chocolade Tablet Noir de Noir 150 g,https://cdn.carrefour.eu/160_04002823_5410081201848_00.jpeg,"2,05€",Per stuk,"13,67€",/kg
44,Côte d'Or Carrés Pralines Melk Chocolade Hele Hazelnoten 200 g,https://cdn.carrefour.eu/160_04370248_3045140015832_00.jpeg,"4,89€",Per stuk,"24,75€",/kg
45,Quality Street Tin 480 g,https://cdn.carrefour.eu/160_00696614_5000189327290_00.jpeg,"9,04€",Per stuk,"18,83€",/kg
46,Côte d'Or Mignonnettes Pralines Melk Chocolade 24 Stuks 240 g,https://cdn.carrefour.eu/160_00148386_5410081206201_00.jpeg,"4,25€",Per stuk,"17,71€",/kg
47,Côte d'Or Mignonnette Pralines Melk Chocolade 120 Stuks 1200 g,https://cdn.carrefour.eu/160_01341039_7622200007806_00.jpeg,"16,39€",Per pak,"13,66€",/kg
48,Quality Street Tin 480 g,https://cdn.carrefour.eu/160_00696614_5000189327290_00.jpeg,"9,04€",Per stuk,"18,83€",/kg
49,Côte d'Or Mignonnettes Pralines Melk Chocolade 24 Stuks 240 g,https://cdn.carrefour.eu/160_00148386_5410081206201_00.jpeg,"4,25€",Per stuk,"17,71€",/kg
50,Côte d'Or Mignonnette Pralines Melk Chocolade 120 Stuks 1200 g,https://cdn.carrefour.eu/160_01341039_7622200007806_00.jpeg,"16,39€",Per pak,"13,66€",/kg
51,Côte d'Or Chokotoff Pralines Chocolade snoepjes Pure Chocolade 250 g,https://cdn.carrefour.eu/160_01104959_7622200006793_00.jpeg,"3,09€",Per stuk,"12,36€",/kg
52,Côte d'Or Nougatti Melk Chocolade Reep Nouga 9-Pack 270 g,https://cdn.carrefour.eu/160_01343152_7622200348084_00.jpeg,"3,95€",Per stuk,"14,63€",/kg
53,Lion Chocoladerepen 6 x 42 g,https://cdn.carrefour.eu/160_04017487_7613032630379_00.jpeg,"3,01€",Per stuk,"11,15€",/kg
54,"Minis Snickers, Twix, Mars, Bounty, Milky Way Mixed 71 Stuks 1425 g",https://cdn.carrefour.eu/160_05418187_5000159410410_00.jpeg,"13,93€",Per stuk,"9,78€",/kg
55,Carrefour Bio Dessert-Chocolade 52% Cacao 200 g,https://cdn.carrefour.eu/160_05747886_3560070856596_00.jpeg,"2,35€",Per stuk,"11,75€",/kg
56,Carrefour Bio Zwarte Chocolade Sinaasappelsmaak 100 g,https://cdn.carrefour.eu/160_05748060_3560070472949_00.jpeg,"1,65€",Per stuk,"16,50€",/kg
57,Carrefour Bio Melkchocolade Gekaramelliseerde Stukjes Hazelnoot 100 g,https://cdn.carrefour.eu/160_05748116_3560070472970_00.jpeg,"1,85€",Per stuk,"18,50€",/kg
58,Côte d'Or Chokotoff Pure Chocolade Snoepjes 1 kg,https://cdn.carrefour.eu/160_04005284_5410081210628_00.jpeg,"9,15€",Per stuk,"9,15€",/kg
59,Côte d'Or Mignonnettes Pure Chocolade Noir de Noir 24 Stuks 240 g,https://cdn.carrefour.eu/160_00991158_7622200002290_00.jpeg,"4,25€",Per stuk,"17,71€",/kg
60,Côte D'Or Big Nuts Praliné Melk 2 x 75 g,https://cdn.carrefour.eu/160_04004510_7622300145996_00.jpeg,"3,98€",Per stuk,"26,53€",/kg
61,Twix Chocolade Repen 12 x 50 g,https://cdn.carrefour.eu/160_04465829_5000159366267_00.jpeg,"3,80€",Per stuk,"6,33€",/kg
62,Twix Chocolade Repen 7 x 50 g,https://cdn.carrefour.eu/160_04465845_5000159366243_00.jpeg,"2,25€",Per stuk,"6,43€",/kg
63,Snickers 12 x 50 g,https://cdn.carrefour.eu/160_04465854_5000159384230_00.jpeg,"3,80€",Per stuk,"6,31€",/kg
64,Snickers 7 x 50 g,https://cdn.carrefour.eu/160_04465867_5000159366229_00.jpeg,"2,25€",Per stuk,"6,43€",/kg
65,Céréal Minder Suikers Praliné Melk 100 g,https://cdn.carrefour.eu/160_04031151_5410063000391_00.jpeg,"2,88€",Per stuk,"28,80€",/kg
66,Céréal Minder Suikers Puur 80 g,https://cdn.carrefour.eu/160_04031152_5410063000285_00.jpeg,"2,96€",Per stuk,"37,00€",/kg
67,Céréal Minder Suikers Melk 80 g,https://cdn.carrefour.eu/160_04031153_5410063000308_00.jpeg,"2,96€",Per stuk,"37,00€",/kg
68,Céréal Minder Suikers Hazelnoot 80 g,https://cdn.carrefour.eu/160_04031154_5410063000322_00.jpeg,"2,96€",Per stuk,"37,00€",/kg
69,Côte d'Or Chokotoff Pralines Chocolade snoepjes Pure Chocolade 500 g,https://cdn.carrefour.eu/160_00147662_5410081212011_00.jpeg,"4,59€",Per stuk,"9,18€",/kg
70,KITKAT Chocoladerepen 6 x 41.5 g,https://cdn.carrefour.eu/160_04319291_7613035365896_00.jpeg,"3,15€",Per stuk,"11,67€",/kg
71,Milky Way 9 x 21.5 g,https://cdn.carrefour.eu/160_05309652_5000159507363_00.jpeg,"3,38€",Per stuk,"17,51€",/kg
72,Côte d'Or L'Original Witte Chocolade Tablet 400 g,https://cdn.carrefour.eu/160_05300061_7622201124779_00.jpeg,"4,73€",Per stuk,"11,83€",/kg
73,Côte d'Or Bouchée Pralines Melk Chocolade Praliné 8 Pralines 200 g,https://cdn.carrefour.eu/160_05323297_7622210117762_00.jpeg,"3,19€",Per stuk,"15,95€",/kg
74,merci Finest Selection 250 g,https://cdn.carrefour.eu/160_05323461_4014400917956_00.jpeg,"3,69€",Per stuk,"14,76€",/kg
75,Esprit de Fête Belgische Pralines 200 g,https://cdn.carrefour.eu/160_05098593_5413676702133_00.jpeg,"4,99€",Per stuk,"24,95€",/kg
76,Milka LEOgO Mini Chocolade Koeken 182 g,https://cdn.carrefour.eu/160_04857781_7622300348786_00.jpeg,"4,57€",Per stuk,"25,11€",/kg
77,Milka Leo Go! 48 g,https://cdn.carrefour.eu/160_04997333_7622400016769_00.jpeg,"1,09€",Per stuk,"22,71€",/kg
78,Côte d'Or Culinaire Kookchocolade Pure Chocolade Tablet 400 g,https://cdn.carrefour.eu/160_04588587_7622300166984_00.jpeg,"7,09€",Per stuk,"17,73€",/kg
79,Ethiquable 98% Ecuador Krachtig Aroma 100 g,https://cdn.carrefour.eu/160_05530622_5420051401093_00.jpeg,"3,17€",Per stuk,"31,70€",/kg
80,Côte d'Or Nougatti Melk Chocolade Reep Nouga 6-Pack 180 g,https://cdn.carrefour.eu/160_05548079_7622400988240_00.jpeg,"2,95€",Per stuk,"16,39€",/kg
81,Côte d'Or Mignonnettes Collection Pralines Chocolade 30 Stuks 300 g,https://cdn.carrefour.eu/160_05536127_7622210333179_00.jpeg,"7,89€",Per stuk,"27,37€",/kg
82,Céréal Glutenfree & Lactosefree Chocolade Melk met Hazelnoten 100 g,https://cdn.carrefour.eu/160_05561748_5410063027572_00.jpeg,"2,98€",Per stuk,"29,80€",/kg
83,Céréal Glutenfree & Lactosefree Chocolade Melk 100 g,https://cdn.carrefour.eu/160_05561749_5410063027596_00.jpeg,"2,98€",Per stuk,"29,80€",/kg
84,Côte d'Or Mini Bouchée Pralines Melk Chocolade 13 Stuks 122 g,https://cdn.carrefour.eu/160_05430120_7622210229526_00.jpeg,"2,95€",Per stuk,"24,51€",/kg
85,Twix Chocolade Xtra Repen 2 x 37.5 g,https://cdn.carrefour.eu/160_05450696_5900951028502_00.jpeg,"1,20€",Per stuk,"16,00€",/kg
86,Nutella & Go! 2 Pack,https://cdn.carrefour.eu/160_05618658_8000500045497_00.jpeg,"2,25€",Per stuk,"21,63€",/stuk
87,Céréal Stevia Sweet Puur 85 g,https://cdn.carrefour.eu/160_05229318_5410063019744_00.jpeg,"3,42€",Per stuk,"40,24€",/kg
88,Côte d'Or L'Original Melk 200 g,https://cdn.carrefour.eu/160_05254058_7622210462985_00.jpeg,"2,29€",Per stuk,"11,45€",/kg
89,Côte d'Or Bouchée Pralines Pure Chocolade Praliné 8 Pralines 156 g,https://cdn.carrefour.eu/160_05323296_7622210117830_00.jpeg,"4,35€",Per stuk,"28,97€",/kg
90,Côte d'Or Praliné Pure Chocolade Tablet Truffé 190 g,https://cdn.carrefour.eu/160_04016791_7622300145187_00.jpeg,"3,85€",Per stuk,"20,26€",/kg
91,Côte d'Or Classic Melk Chocolade Tablet Stukjes Hazelnoot 150 g,https://cdn.carrefour.eu/160_00152541_5410081201053_00.jpeg,"2,25€",Per stuk,"15,00€",/kg
92,Côte d'Or Nougatti Mini Melk Chocolade Reep Nouga 180 g,https://cdn.carrefour.eu/160_05743668_7622210653314_00.jpeg,"4,73€",Per stuk,"26,28€",/kg
93,Crunch Melkchocolade krokante repen 100 g,https://cdn.carrefour.eu/160_01666936_3033710001279_00.jpeg,"1,62€",Per stuk,"16,20€",/kg
94,M&M's Chocolate 330 g,https://cdn.carrefour.eu/160_06007091_5900951264672_00.jpeg,"3,94€",Per stuk,"11,94€",/kg
95,ROLO Chocolade Bonbons 4 x 41.6 g,https://cdn.carrefour.eu/160_06009923_7613036137850_00.jpeg,"2,32€",Per stuk,"13,81€",/kg
96,GALAK Witte Chocolade Speculoos Tabletten 125 g,https://cdn.carrefour.eu/160_05725472_8000300353891_00.jpeg,"2,24€",Per stuk,"17,92€",/kg
97,GALAK Witte Chocolade Popri Tablet 125 g,https://cdn.carrefour.eu/160_05725473_8000300353952_00.jpeg,"2,24€",Per stuk,"17,92€",/kg
98,GALAK Witte Chocoladereep 125 g,https://cdn.carrefour.eu/160_05725474_8000300353662_00.jpeg,"2,24€",Per stuk,"17,92€",/kg
99,Milka Melk Chocolade Reep Met Hele Noten 3 Repen 135 g,https://cdn.carrefour.eu/160_06003656_7622210860781_00.jpeg,"2,85€",Per stuk,"21,93€",/kg
100,Jacques Banaan Puur 200 g,https://cdn.carrefour.eu/160_06018987_5410059756226_00.jpeg,"2,53€",Per stuk,"12,65€",/kg
101,Jacques Smaak Vanille Puur 200 g,https://cdn.carrefour.eu/160_06018988_5410059756196_00.jpeg,"2,53€",Per stuk,"12,65€",/kg
102,Jacques Panaché Puur 200 g,https://cdn.carrefour.eu/160_06018989_5410059756202_00.jpeg,"2,53€",Per stuk,"12,65€",/kg
103,Côte d'Or Mignonnettes Melk Chocolade Praliné Double Lait 21 St 210 g,https://cdn.carrefour.eu/160_05178328_7622300733520_00.jpeg,"5,05€",Per stuk,"24,05€",/kg
104,Côte d'Or Chokotoff Pralines Chocolade snoepjes Melk Chocolade 500 g,https://cdn.carrefour.eu/160_05282995_7622210031921_00.jpeg,"5,67€",Per stuk,"11,34€",/kg
105,Milky Way 9 x 21.5 g,https://cdn.carrefour.eu/160_05309652_5000159507363_00.jpeg,"3,38€",Per stuk,"17,51€",/kg
106,Milka LEOgO Mini Chocolade Koeken 182 g,https://cdn.carrefour.eu/160_04857781_7622300348786_00.jpeg,"4,57€",Per stuk,"25,11€",/kg
107,Milka Leo Go! 48 g,https://cdn.carrefour.eu/160_04997333_7622400016769_00.jpeg,"1,09€",Per stuk,"22,71€",/kg
108,Côte d'Or Culinaire Kookchocolade Pure Chocolade Tablet 400 g,https://cdn.carrefour.eu/160_04588587_7622300166984_00.jpeg,"7,09€",Per stuk,"17,73€",/kg
109,Côte d'Or L'Original Extra Pure Chocolade Tablet Noir de Noir 400 g,https://cdn.carrefour.eu/160_05300058_7622210100092_00.jpeg,"4,89€",Per stuk,"12,23€",/kg
110,Côte d'Or L'Original Witte Chocolade Tablet 400 g,https://cdn.carrefour.eu/160_05300061_7622201124779_00.jpeg,"4,73€",Per stuk,"11,83€",/kg
111,Côte d'Or Bouchée Pralines Melk Chocolade Praliné 8 Pralines 200 g,https://cdn.carrefour.eu/160_05323297_7622210117762_00.jpeg,"3,19€",Per stuk,"15,95€",/kg
112,merci Finest Selection 250 g,https://cdn.carrefour.eu/160_05323461_4014400917956_00.jpeg,"3,69€",Per stuk,"14,76€",/kg
113,Céréal Stevia Sweet Puur 85 g,https://cdn.carrefour.eu/160_05229318_5410063019744_00.jpeg,"3,42€",Per stuk,"40,24€",/kg
114,Côte d'Or L'Original Melk 200 g,https://cdn.carrefour.eu/160_05254058_7622210462985_00.jpeg,"2,29€",Per stuk,"11,45€",/kg
115,Côte d'Or Bouchée Pralines Pure Chocolade Praliné 8 Pralines 156 g,https://cdn.carrefour.eu/160_05323296_7622210117830_00.jpeg,"4,35€",Per stuk,"28,97€",/kg
116,Côte d'Or Mignonnettes Variété Pralines Chocolade 32 Stuks 320 g,https://cdn.carrefour.eu/160_05536408_7622210333131_00.jpeg,"6,79€",Per stuk,"22,06€",/kg
117,Céréal Glutenfree & Lactosefree Chocolade Melk met Hazelnoten 100 g,https://cdn.carrefour.eu/160_05561748_5410063027572_00.jpeg,"2,98€",Per stuk,"29,80€",/kg
118,Céréal Glutenfree & Lactosefree Chocolade Melk 100 g,https://cdn.carrefour.eu/160_05561749_5410063027596_00.jpeg,"2,98€",Per stuk,"29,80€",/kg
119,Côte d'Or Mini Bouchée Pralines Melk Chocolade 13 Stuks 122 g,https://cdn.carrefour.eu/160_05430120_7622210229526_00.jpeg,"2,95€",Per stuk,"24,51€",/kg
120,Côte d'Or Witte Chocolade Reep Praliné 4-Pack 184 g,https://cdn.carrefour.eu/160_06042574_7622210926906_00.jpeg,"2,89€",Per stuk,"2,89€",/stuk
121,Côte d'Or Pure Chocolade Reep Pistache 4-Pack,https://cdn.carrefour.eu/160_06042575_7622210926418_00.jpeg,"2,89€",Per stuk,"2,89€",/stuk
122,Côte d'Or Melk Chocolade Reep Hele Hazelnoten 4-Pack,https://cdn.carrefour.eu/160_06042576_7622210926845_00.jpeg,"3,25€",Per stuk,"3,25€",/stuk
123,Côte d'Or Pure Chocolade Reep Hele Hazelnoten 4-Pack,https://cdn.carrefour.eu/160_06042577_7622210932785_00.jpeg,"3,25€",Per stuk,"3,25€",/stuk
124,Tic Tac Mint 2 Stuks 98 g,https://cdn.carrefour.eu/160_06082543_8000500054260_00.jpeg,"2,39€",Per stuk,"24,39€",/kg
125,Milka Melk Chocolade Tablet Nussini 300 g,https://cdn.carrefour.eu/160_06131842_7622210586735_00.jpeg,"2,17€",Per stuk,"7,23€",/kg
126,Côte d'Or Mignonnettes Pralines BIO Pure Chocolade 70% 18 Stuks 180 g,https://cdn.carrefour.eu/160_06131843_7622210974365_00.jpeg,"5,45€",Per stuk,"30,28€",/kg
127,Celebrations Chocolade Box 186 g,https://cdn.carrefour.eu/160_05924638_5000159500258_00.jpeg,"4,15€",Per stuk,"22,31€",/kg
128,Lindt Creation Crème Brûlée Délicieusement Caramélisée 150 g,https://cdn.carrefour.eu/160_04015005_3046920043489_00.jpeg,"3,35€",Per stuk,"22,33€",/kg
129,Côte d'Or Pure Chocolade Tablet Kokos 150 g,https://cdn.carrefour.eu/160_05444860_7622210056078_00.jpeg,"3,19€",Per stuk,"21,27€",/kg
130,Côte d'Or Pure Chocolade Tablet Marzipan 150 g,https://cdn.carrefour.eu/160_05444862_7622210172303_00.jpeg,"3,19€",Per stuk,"21,27€",/kg
131,Milka Mmmax Chocolade Reep Choco-Swing 300 g,https://cdn.carrefour.eu/160_04487340_9012200872739_00.jpeg,"2,17€",Per stuk,"7,23€",/kg
132,Quality Street 265 g,https://cdn.carrefour.eu/160_04561595_5000426112160_00.jpeg,"3,43€",Per stuk,"12,94€",/kg
133,Milka Wit 100 g,https://cdn.carrefour.eu/160_05608577_7622210463708_00.jpeg,"1,85€",Per stuk,"18,50€",/kg
134,Milka Melk 100 g,https://cdn.carrefour.eu/160_05608610_7622210463654_00.jpeg,"1,92€",Per stuk,"19,20€",/kg
135,Côte d'Or Bloc Pure Chocolade Tablet Hele Hazelnoten 180 g,https://cdn.carrefour.eu/160_05710993_7622210996299_00.jpeg,"3,21€",Per stuk,"17,83€",/kg
136,Côte d'Or Bloc Pure Chocolade Tablet Amandelen 180 g,https://cdn.carrefour.eu/160_05710999_7622210996176_00.jpeg,"3,75€",Per stuk,"20,83€",/kg
137,Côte d'Or Bloc Melk Chocolade Tablet Hele Hazelnoten 180 g,https://cdn.carrefour.eu/160_05711000_7622210996268_00.jpeg,"3,21€",Per stuk,"17,83€",/kg
138,Côte d'Or Bloc Melk Chocolade Tabletgekarameliseerde Amandelnoten 180 g,https://cdn.carrefour.eu/160_05711002_7622210995025_00.jpeg,"3,75€",Per stuk,"20,83€",/kg
139,Côte d'Or Bio Noir 70% 90 g,https://cdn.carrefour.eu/160_05966207_7622210724519_00.jpeg,"2,49€",Per stuk,"27,67€",/kg
140,Côte d'Or BIO Chocolade Tablet Pure Chocolade Orange Corsée 90 g,https://cdn.carrefour.eu/160_05970730_7622210724595_00.jpeg,"2,49€",Per stuk,"27,67€",/kg
141,Côte d'Or BIO Chocolade Tablet Pure Chocolade Zeezout 90 g,https://cdn.carrefour.eu/160_05970731_7622210724557_00.jpeg,"2,49€",Per stuk,"27,67€",/kg
142,M&Ms Crispy 374 g,https://cdn.carrefour.eu/160_05946707_5000159480840_00.jpeg,"4,75€",Per stuk,"12,70€",/kg
143,Karamelrepen 6 Stuks 240 g,https://cdn.carrefour.eu/160_05833896_3560070941933_00.jpeg,"1,19€",Per stuk,"4,96€",/kg
144,Milka Choco Brownie 6 Stuks 180 g,https://cdn.carrefour.eu/160_05890953_7622210623799_00.jpeg,"2,25€",Per stuk,"13,00€",/kg
145,Côte d'Or Bio Noir 70% 90 g,https://cdn.carrefour.eu/160_05966207_7622210724519_00.jpeg,"2,49€",Per stuk,"27,67€",/kg
146,Côte d'Or BIO Chocolade Tablet Pure Chocolade Orange Corsée 90 g,https://cdn.carrefour.eu/160_05970730_7622210724595_00.jpeg,"2,49€",Per stuk,"27,67€",/kg
147,Côte d'Or BIO Chocolade Tablet Pure Chocolade Zeezout 90 g,https://cdn.carrefour.eu/160_05970731_7622210724557_00.jpeg,"2,49€",Per stuk,"27,67€",/kg
148,M&Ms Crispy 374 g,https://cdn.carrefour.eu/160_05946707_5000159480840_00.jpeg,"4,75€",Per stuk,"12,70€",/kg
149,Karamelrepen 6 Stuks 240 g,https://cdn.carrefour.eu/160_05833896_3560070941933_00.jpeg,"1,19€",Per stuk,"4,96€",/kg
150,Côte d'Or Praliné Witte Chocolade Tablet Praliné 200 g,https://cdn.carrefour.eu/160_01449596_7622201124809_00.jpeg,"3,29€",Per stuk,"16,45€",/kg
151,Côte d'Or Praliné Melk Chocolade Tablet Praliné Double Noisettes 200 g,https://cdn.carrefour.eu/160_01449599_7622400010446_00.jpeg,"3,29€",Per stuk,"16,45€",/kg
152,Côte d'Or Praliné Pure Chocolade Tablet Praliné 200 g,https://cdn.carrefour.eu/160_01449600_7622400010460_00.jpeg,"3,29€",Per stuk,"16,45€",/kg
153,Côte d'Or Mignonnettes Pralines Pure Chocolade Noir Intense 70% 180 g,https://cdn.carrefour.eu/160_04342536_7622201009625_00.jpeg,"4,15€",Per stuk,"23,06€",/kg
154,Nākd Blueberry Muffin 4 x 35 g,https://cdn.carrefour.eu/160_06188909_5060088707685_00.jpeg,"3,09€",Per stuk,"3,09€",/stuk
155,Lindt Lindor Chocolade Assortiment 200g,https://cdn.carrefour.eu/160_05571726_7610400071703_00.jpeg,"6,64€",Per stuk,"33,20€",/kg
156,Côte d'Or Classic Melk Chocolade Tablet Caramel & Zeezout 150 g,https://cdn.carrefour.eu/160_06179807_7622210673503_00.jpeg,"2,89€",Per stuk,"19,27€",/kg
157,Milka Melk Chocolade Tablet Oreo 100 g,https://cdn.carrefour.eu/160_06193705_7622210656490_00.jpeg,"1,15€",Per stuk,"11,50€",/kg
158,GALAK Witte Chocolade Popri Reep MP 4 x 40 g,https://cdn.carrefour.eu/160_05725411_8000300354553_00.jpeg,"3,49€",Per stuk,"21,81€",/kg
159,Nākd Berry Delight 4 x 35 g,https://cdn.carrefour.eu/160_06029524_5060088705148_00.jpeg,"3,09€",Per stuk,"22,07€",/kg
160,Nākd Cacao Fruit- & Notenrepen 4 x 35 g,https://cdn.carrefour.eu/160_06031367_5060088705087_00.jpeg,"3,09€",Per stuk,"22,07€",/kg
161,Lindt Excellence 70% Cacao Noir Intense 100 g,https://cdn.carrefour.eu/160_04881911_3046920028004_00.jpeg,"2,24€",Per stuk,"22,40€",/kg
162,Milka Mmmax Melk Chocolade Tablet Oreo Koekjes 300 g,https://cdn.carrefour.eu/160_05544158_7622210293381_00.jpeg,"2,17€",Per stuk,"7,23€",/kg
163,GALAK Witte Chocolade Speculoos Tabletten 125 g,https://cdn.carrefour.eu/160_05725472_8000300353891_00.jpeg,"2,24€",Per stuk,"17,92€",/kg
164,GALAK Witte Chocolade Popri Tablet 125 g,https://cdn.carrefour.eu/160_05725473_8000300353952_00.jpeg,"2,24€",Per stuk,"17,92€",/kg
165,GALAK Witte Chocoladereep 125 g,https://cdn.carrefour.eu/160_05725474_8000300353662_00.jpeg,"2,24€",Per stuk,"17,92€",/kg
166,Milka Melk Chocolade Reep Met Hele Noten 3 Repen 135 g,https://cdn.carrefour.eu/160_06003656_7622210860781_00.jpeg,"2,85€",Per stuk,"21,93€",/kg
167,Jacques Banaan Puur 200 g,https://cdn.carrefour.eu/160_06018987_5410059756226_00.jpeg,"2,53€",Per stuk,"12,65€",/kg
168,Jacques Smaak Vanille Puur 200 g,https://cdn.carrefour.eu/160_06018988_5410059756196_00.jpeg,"2,53€",Per stuk,"12,65€",/kg
169,Jacques Panaché Puur 200 g,https://cdn.carrefour.eu/160_06018989_5410059756202_00.jpeg,"2,53€",Per stuk,"12,65€",/kg
170,Côte d'Or Praliné Melk Chocolade Tablet Praliné & Caramel 200 g,https://cdn.carrefour.eu/160_06316273_7622210738752_00.jpeg,"3,39€",Per stuk,"16,95€",/kg
171,Côte d'Or Praliné Pure Chocolade Tablet Truffé 190 g,https://cdn.carrefour.eu/160_06316274_7622210738769_00.jpeg,"3,36€",Per stuk,"17,68€",/kg
172,Tony's Chocolonely Milk Chocolate 180 g,https://cdn.carrefour.eu/160_06424390_8717677335565_00.jpeg,"3,42€",Per stuk,"19,00€",/kg
173,M&M's Chocolate Tablet 165 g,https://cdn.carrefour.eu/160_06448199_5000159516259_00.jpeg,"3,28€",Per stuk,"19,88€",/kg
174,M&M's Crispy Tablet 150 g,https://cdn.carrefour.eu/160_06484539_5000159516273_00.jpeg,"3,28€",Per stuk,"21,87€",/kg
175,M&M's Peanut Tablet 165 g,https://cdn.carrefour.eu/160_06485825_5000159516235_00.jpeg,"3,28€",Per stuk,"19,88€",/kg
176,Nākd Salted Caramel Fruit- & Notenrepen 4 x 35 g,https://cdn.carrefour.eu/160_06461308_5060088707999_00.jpeg,"3,09€",Per stuk,"22,07€",/kg
177,merci Finest Selection Assorted Chocolates 250 g,https://cdn.carrefour.eu/160_06191374_4014400901191_00.jpeg,"3,21€",Per stuk,"12,84€",/kg
178,Côte d'Or Melk Ganache Chocolat 155 g,https://cdn.carrefour.eu/160_06280144_7622210726100_00.jpeg,"3,05€",Per stuk,"19,68€",/kg
