,article_name,article_img,article_base_price,article_SKU,article_big_price,article_big_price_type
0,Axe Aftershave Africa 100 ml,https://cdn.carrefour.eu/160_06478642_8710847936999_00.jpeg,"7,49€",Per stuk,"74,90€",/l
1,Carrefour Perfect 2 Chroom en Platina 10 Vervangmesjes,https://cdn.carrefour.eu/160_04613355_3560070246601_00.jpeg,"1,65€",Per stuk,"0,17€",/stuk
2,Carrefour Soft Anti Roos Zeer Milde Shampoo 500 ml,https://cdn.carrefour.eu/160_05984395_3560071086169_00.jpeg,"1,29€",Per stuk,"2,58€",/l
3,Carrefour Styling Gel Wetlook 150 ml,https://cdn.carrefour.eu/160_05605468_3560070885435_00.jpeg,"1,85€",Per stuk,"12,33€",/l
4,Carrefour Styling Gel Invisible 6 250 ml,https://cdn.carrefour.eu/160_05406860_3560070860395_00.jpeg,"2,55€",Per stuk,"10,20€",/l
5,Carrefour Styling Gel béton 250 ml,https://cdn.carrefour.eu/160_05406888_3560070860364_00.jpeg,"2,55€",Per stuk,"10,20€",/l
6,Carrefour Styling Gel Fixatie Extreme 8 250 ml,https://cdn.carrefour.eu/160_05406896_3560070860333_00.jpeg,"2,55€",Per stuk,"10,20€",/l
7,Carrefour Sensation 4 Wegwerpscheermesjes 3 Stuks,https://cdn.carrefour.eu/160_06514713_3560071227234_00.jpeg,"2,99€",Per stuk,"2,99€",/stuk
8,Carrefour Perfect 5 Navullingen 4 Stuks,https://cdn.carrefour.eu/160_06558129_3560071169794_00.jpeg,"5,29€",Per stuk,"1,32€",/stuk
9,Carrefour Classic 3 Navullingen 4 Stuks,https://cdn.carrefour.eu/160_06514498_3560071235789_00.jpeg,"2,65€",Per stuk,"0,66€",/stuk
10,Carrefour Men Sensitive Scheergel 200 ml,https://cdn.carrefour.eu/160_06729971_3560071267315_00.jpeg,"1,69€",Per stuk,"8,45€",/l
11,Carrefour Men Sensitive Scheerschuim 250 ml,https://cdn.carrefour.eu/160_06708135_3560071267377_00.jpeg,"1,49€",Per stuk,"5,96€",/l
12,Carrefour Men Scheerschuim 250 ml,https://cdn.carrefour.eu/160_06729970_3560071267414_00.jpeg,"1,49€",Per stuk,"5,96€",/l
13,Carrefour Men Scheergel Frisheid 200 ml,https://cdn.carrefour.eu/160_06729973_3560071267834_00.jpeg,"1,69€",Per stuk,"8,45€",/l
14,Carrefour Soft Green Solid Shampoo Dry Hair 75 g,https://cdn.carrefour.eu/160_06751673_3560071423001_00.jpeg,"2,90€",Per stuk,"38,67€",/kg
15,Carrefour Gel 3 en 1 Fresh 300 ml,https://cdn.carrefour.eu/160_05528983_3560070902767_00.jpeg,"1,85€",Per stuk,"6,17€",/l
16,Carrefour Soft Green Solid Shampoo Normal Hair 75 g,https://cdn.carrefour.eu/160_06560607_3560071423025_00.jpeg,"2,90€",Per stuk,"38,67€",/kg
17,Nivea Men Protect & Care Hydraterende Aftershave Balsem 100 ml,https://cdn.carrefour.eu/160_05309090_8715200813009_00.jpeg,"6,79€",Per stuk,"69,50€",/l
18,Nivea Men Protect & Care Verzorgende Scheercrème 100 ml,https://cdn.carrefour.eu/160_04746594_4005808223244_00.jpeg,"3,25€",Per stuk,"32,50€",/l
19,Nivea Men Sensitive Aftershave Balsem 100 ml,https://cdn.carrefour.eu/160_04746629_4005808221875_00.jpeg,"6,79€",Per stuk,"69,50€",/l
20,Rexona Men Cream Deodorant Max Pro Clean Scent 45ml,https://cdn.carrefour.eu/160_04892937_8718114202402_00.jpeg,"8,99€",Per stuk,"199,78€",/l
21,L'Oréal Men Expert Hydra energetic hydraterende gezichtscrème 50 ml,https://cdn.carrefour.eu/160_04317934_3600520297569_00.jpeg,"11,55€",Per stuk,"231,00€",/l
22,Nivea Men Protect & Care Hydraterend Scheerschuim 200 ml,https://cdn.carrefour.eu/160_04749275_4005808222520_00.jpeg,"3,69€",Per stuk,"18,95€",/l
23,Nivea Men Sensitive Scheerschuim 200 ml,https://cdn.carrefour.eu/160_04749294_4005808222704_00.jpeg,"3,69€",Per stuk,"18,95€",/l
24,Brut Aftershave Original 100 ml,https://cdn.carrefour.eu/160_00983516_3014230021237_00.jpeg,"9,85€",Per stuk,"98,50€",/l
25,Elseve Multi-Vitamines Shampoo normaal haar 250 ml,https://cdn.carrefour.eu/160_05172638_3600522100843_00.jpeg,"4,49€",Per stuk,"17,96€",/l
26,Syoss Gel Power Hold 250 ml,https://cdn.carrefour.eu/160_05837532_9000100654074_00.jpeg,"5,75€",Per stuk,"23,00€",/l
27,Taft Ultra wax 75 ml,https://cdn.carrefour.eu/160_05718581_5410091742263_00.jpeg,"4,75€",Per stuk,"63,33€",/l
28,Tabac Original After Shave Lotion 100 ml,https://cdn.carrefour.eu/160_00222394_4011700431205_00.jpg,"17,99€",Per stuk,"179,90€",/l
29,Gillette Contour Plus Scheermesjes Voor Mannen - 10 Navulmesjes,https://cdn.carrefour.eu/160_00742722_3014260207618_00.jpeg,"11,85€",Per stuk,"1,19€",/stuk
30,Denim Original After Shave 100 ml,https://cdn.carrefour.eu/160_00222495_8008970004051_00.jpeg,"9,99€",Per stuk,"99,90€",/l
31,Tabac Original Deodorant Spray 200 ml,https://cdn.carrefour.eu/160_00223614_4011700410903_00.jpg,"10,49€",Per stuk,"52,45€",/l
32,Fa Men Perfect Wave Deodorant Spray 150 ml,https://cdn.carrefour.eu/160_04020830_5410091640750_00.jpeg,"2,46€",Per stuk,"16,40€",/l
33,Mennen Stick Large Contrôle H-24 Musk 50 ml,https://cdn.carrefour.eu/160_00810216_3058320026030_00.jpeg,"5,59€",Per stuk,"111,80€",/l
34,Brut Eau de Toilette Original 100 ml,https://cdn.carrefour.eu/160_01019990_3014230021039_00.jpeg,"17,65€",Per stuk,"176,50€",/l
35,Wilkinson Sword 125 g,https://cdn.carrefour.eu/160_00965104_4027800920501_01.jpeg,"2,94€",Per stuk,"24,50€",/kg
36,Pétrole Hahn Shampoo Kracht Vitaliteit Normaal Haar 250 ml,https://cdn.carrefour.eu/160_04025802_3140100143065_00.jpeg,"4,85€",Per stuk,"19,40€",/l
37,Pétrole Hahn Shampoo Anti-Haaruitval Kracht 250 ml,https://cdn.carrefour.eu/160_04025823_3140100143119_00.jpeg,"4,85€",Per stuk,"19,40€",/l
38,Rexona Men Deodorant Stick Cobalt Dry 50 ml,https://cdn.carrefour.eu/160_01638248_73103714_00.jpeg,"3,45€",Per stuk,"71,00€",/l
39,Brylcreem Gel Original 250 ml,https://cdn.carrefour.eu/160_04996385_5000231039546_00.jpeg,"4,99€",Per stuk,"19,96€",/l
40,Dove Men+ Care Douchegel Extra Fresh 250 ml,https://cdn.carrefour.eu/160_04883736_8717644598849_00.jpeg,"4,69€",Per stuk,"18,76€",/l
41,Nivea Men Active Energy Hydraterende Crème Cafeïne 50 ml,https://cdn.carrefour.eu/160_04749023_4005900786630_00.jpeg,"12,55€",Per stuk,"251,00€",/l
42,Nivea Men Sensitive Hydraterende Crème 75 ml,https://cdn.carrefour.eu/160_04749200_4005808224098_00.jpeg,"8,25€",Per stuk,"110,00€",/l
43,Nivea Men Originals Gezicht Hydraterende Crème 75 ml,https://cdn.carrefour.eu/160_04749234_4005808223411_00.jpeg,"8,25€",Per stuk,"110,00€",/l
44,Nivea Men Hydratant Originals Face Wash Gel Fresh Wake Up 100 ml,https://cdn.carrefour.eu/160_04749236_4005808227822_00.jpeg,"8,75€",Per stuk,"87,50€",/l
45,Nivea Men Creme 150 ml,https://cdn.carrefour.eu/160_05560707_4005900115775_00.jpeg,"3,59€",Per stuk,"23,93€",/l
46,Nivea Men Sensitive Cooling After Shave Balsem 100 ml,https://cdn.carrefour.eu/160_05616322_4005900022691_00.jpeg,"7,45€",Per stuk,"74,50€",/l
47,Rexona Men Spray Deodorant Invisible Black & White Clothes 150 ml,https://cdn.carrefour.eu/160_05817407_8712561534444_00.jpeg,"4,65€",Per stuk,"31,93€",/l
48,Les Cosmétiques Design Paris Science Ultra Repair Shampoo 300 ml,https://cdn.carrefour.eu/160_05229746_3560070627950_00.jpeg,"1,99€",Per stuk,"6,63€",/l
49,Kera Science Professional Ultra Repair Intensive Mask ++ 300 ml,https://cdn.carrefour.eu/160_05229838_3560070628018_00.jpeg,"3,75€",Per stuk,"12,50€",/l
50,Dove Men Deodorant Spray Clean Comfort 75 ml,https://cdn.carrefour.eu/160_05489398_96080689_00.jpeg,"4,29€",Per stuk,"57,20€",/l
51,Syoss SalonPlex Hairspray 48 h Extra Strong Hold 400 ml,https://cdn.carrefour.eu/160_05990561_5410091742188_00.jpeg,"6,15€",Per stuk,"15,38€",/l
52,Taft Sculpting paste jar 75 ml,https://cdn.carrefour.eu/160_05992356_5410091742232_00.jpeg,"4,75€",Per stuk,"63,33€",/l
53,Nivea Men Sport 48h Anti-Transpirant 150 ml,https://cdn.carrefour.eu/160_06010513_4005900457660_00.jpeg,"3,29€",Per stuk,"21,93€",/l
54,Head & Shoulders  Anti-roos Conditioner Argan- & Kokosolie 220 ml,https://cdn.carrefour.eu/160_06030543_8001090677860_00.jpeg,"5,95€",Per stuk,"27,05€",/l
55,Taft Volume Powder 10 g,https://cdn.carrefour.eu/160_06070745_5410091687588_00.jpeg,"7,25€",Per stuk,"725,00€",/kg
56,Dove Men+ Care Roll-On Deodorant Extra Fresh 50 ml,https://cdn.carrefour.eu/160_05434733_96081716_00.jpeg,"4,95€",Per stuk,"99,00€",/l
57,Dove Men Deodorant Stick Clean Comfort 50 ml,https://cdn.carrefour.eu/160_05434739_96081754_00.jpeg,"4,95€",Per stuk,"99,00€",/l
58,Axe Douchegel Dark Temptation 400 ml,https://cdn.carrefour.eu/160_05984009_8710447284094_00.jpeg,"3,69€",Per stuk,"9,23€",/l
59,Denim Eau de Toilette Gold 100 ml,https://cdn.carrefour.eu/160_05472139_8008970038278_00.jpeg,"15,25€",Per stuk,"152,50€",/l
60,Nivea Men Deep Comfort After Shave Lotion 100 ml,https://cdn.carrefour.eu/160_06020797_4005900498380_00.jpeg,"8,89€",Per stuk,"88,90€",/l
61,Nivea Men Active Age Anti-Rimpel Verzorging DNAge 50 ml,https://cdn.carrefour.eu/160_05311449_4005808840113_00.jpeg,"14,75€",Per stuk,"295,00€",/l
62,Rexona Men Spray Deodorant Cobalt Dry 150 ml,https://cdn.carrefour.eu/160_05362747_4000388669000_00.jpeg,"2,84€",Per stuk,"18,93€",/l
63,L'Oréal Studio Line Remix 5 Styling Paste 150 ml,https://cdn.carrefour.eu/160_05391143_3600522471165_00.jpeg,"5,15€",Per stuk,"34,33€",/l
64,L'Oréal Studio Line Invisi Fix 8 24H clear & clean gel 150 ml,https://cdn.carrefour.eu/160_05391170_3600522471134_00.jpeg,"4,45€",Per stuk,"29,67€",/l
65,L'Oréal Studio Line Invisi Fix 6 24H clear & clean gel 150 ml,https://cdn.carrefour.eu/160_05391171_3600522471127_00.jpeg,"4,45€",Per stuk,"29,67€",/l
66,Pétrole Hahn Lotion Tonic Kracht 5 Bescherming 300 ml,https://cdn.carrefour.eu/160_05476759_3140100323061_00.jpeg,"6,39€",Per stuk,"21,30€",/l
67,Pétrole Hahn Lotion Tonic Kracht 5 Vitaliteit Normaal Haar 300 ml,https://cdn.carrefour.eu/160_05476760_3140100323054_00.jpeg,"6,39€",Per stuk,"21,30€",/l
68,Urtekram Men Hair & Body Wash Aloe Vera Baobab 150 ml,https://cdn.carrefour.eu/160_05972471_5765228836613_00.jpeg,"5,65€",Per stuk,"37,67€",/l
69,Veet for Men Gevoelige Crème 200ml,https://cdn.carrefour.eu/160_06003070_3059944026000_00.jpeg,"10,79€",Per stuk,"53,95€",/l
70,Nivea Men Dry Impact 48h Anti-Transpirant 150 ml,https://cdn.carrefour.eu/160_06010506_4005900457271_00.jpeg,"2,91€",Per stuk,"19,40€",/l
71,Veet for Men Douche Crème gevoelig 150ml,https://cdn.carrefour.eu/160_06012334_3059944025928_00.jpeg,"11,75€",Per stuk,"78,33€",/l
72,Nivea Men Sensitive Scheerschuim 200 ml,https://cdn.carrefour.eu/160_04749294_4005808222704_00.jpeg,"3,69€",Per stuk,"18,95€",/l
73,Nivea Men Protect & Care Hydraterende Scheercrème 100 ml,https://cdn.carrefour.eu/160_04749295_4005808223039_00.jpeg,"3,05€",Per stuk,"15,25€",/l
74,Nivea Men Sensitive Scheergel 200 ml,https://cdn.carrefour.eu/160_04749322_4005808222919_00.jpeg,"4,15€",Per stuk,"20,75€",/l
75,Schwarzkopf Gliss Kur Every Day Oil Elixir 75 ml,https://cdn.carrefour.eu/160_05155106_5410091690687_00.jpeg,"7,89€",Per stuk,"105,20€",/l
76,Nivea Men Active Age Anti-Rimpel Verzorging DNAge 50 ml,https://cdn.carrefour.eu/160_05311449_4005808840113_00.jpeg,"14,75€",Per stuk,"295,00€",/l
77,Rexona Men Spray Deodorant Cobalt Dry 150 ml,https://cdn.carrefour.eu/160_05362747_4000388669000_00.jpeg,"2,84€",Per stuk,"18,93€",/l
78,L'Oréal Studio Line Remix 5 Styling Paste 150 ml,https://cdn.carrefour.eu/160_05391143_3600522471165_00.jpeg,"5,15€",Per stuk,"34,33€",/l
79,L'Oréal Studio Line Invisi Fix 8 24H clear & clean gel 150 ml,https://cdn.carrefour.eu/160_05391170_3600522471134_00.jpeg,"4,45€",Per stuk,"29,67€",/l
80,L'Oréal Studio Line Invisi Fix 6 24H clear & clean gel 150 ml,https://cdn.carrefour.eu/160_05391171_3600522471127_00.jpeg,"4,45€",Per stuk,"29,67€",/l
81,Pétrole Hahn Lotion Tonic Kracht 5 Bescherming 300 ml,https://cdn.carrefour.eu/160_05476759_3140100323061_00.jpeg,"6,39€",Per stuk,"21,30€",/l
82,Pétrole Hahn Lotion Tonic Kracht 5 Vitaliteit Normaal Haar 300 ml,https://cdn.carrefour.eu/160_05476760_3140100323054_00.jpeg,"6,39€",Per stuk,"21,30€",/l
83,Urtekram Shampoo Rasul Volume 250 ml,https://cdn.carrefour.eu/160_05800055_5765228837160_00.jpeg,"7,95€",Per stuk,"31,80€",/l
84,Urtekram Shampoo Rosemary Fine Hair 250 ml,https://cdn.carrefour.eu/160_05800095_5765228837153_00.jpeg,"7,95€",Per stuk,"31,80€",/l
85,Urtekram Shampoo Tea Tree Irritated Scalp 250 ml,https://cdn.carrefour.eu/160_05800196_5765228837146_00.jpeg,"7,95€",Per stuk,"31,80€",/l
86,Syoss Paste Power Hold 150 ml,https://cdn.carrefour.eu/160_05837533_5410091733148_00.jpeg,"7,15€",Per stuk,"47,67€",/l
87,Williams Scheergel Gevoelige Huid 200 ml,https://cdn.carrefour.eu/160_05587914_3181730117965_00.jpeg,"4,65€",Per stuk,"23,25€",/l
88,Nivea Men Sensitive Cooling Scheerschuim 200 ml,https://cdn.carrefour.eu/160_05616718_4005900163288_00.jpeg,"3,79€",Per stuk,"18,95€",/l
89,Gillette SensorExcel Scheermesjes Voor Mannen - 10 Navulmesjes,https://cdn.carrefour.eu/160_05669180_7702018417759_00.jpeg,"15,99€",Per stuk,"1,60€",/stuk
90,Les Cosmétiques Design Paris Science Super Liss Shampoo 300 ml,https://cdn.carrefour.eu/160_05229743_3560070628193_00.jpeg,"1,99€",Per stuk,"6,63€",/l
91,Kéra Science Super Liss Intensive Mask 300 ml,https://cdn.carrefour.eu/160_05229745_3560070628254_00.jpeg,"3,75€",Per stuk,"12,50€",/l
92,Les Cosmétiques Design Paris Science Ultra Repair Shampoo 300 ml,https://cdn.carrefour.eu/160_05229746_3560070627950_00.jpeg,"1,99€",Per stuk,"6,63€",/l
93,Kera Science Professional Ultra Repair Intensive Mask ++ 300 ml,https://cdn.carrefour.eu/160_05229838_3560070628018_00.jpeg,"3,75€",Per stuk,"12,50€",/l
94,Dove Men Deodorant Spray Clean Comfort 75 ml,https://cdn.carrefour.eu/160_05489398_96080689_00.jpeg,"4,29€",Per stuk,"57,20€",/l
95,Axe Bodyspray Compressed Spray Deodorant Dark Temptation 100 ml,https://cdn.carrefour.eu/160_05488960_96098608_00.jpeg,"3,99€",Per stuk,"39,90€",/l
96,Exclusive Gentlemen Douchegel Kruiden-Peper 250 ml,https://cdn.carrefour.eu/160_05548074_3560071194253_00.jpeg,"1,75€",Per stuk,"7,00€",/l
97,Sanex Men Active Control 48h Anti Transpirant Deodorant Roller 50 ml,https://cdn.carrefour.eu/160_05665381_8718951087385_00.jpeg,"4,15€",Per stuk,"83,00€",/l
98,Sanex Men Natur Protect 24H Respect & Control Deodorant Roller 50 ml,https://cdn.carrefour.eu/160_05665383_8718951087415_00.jpeg,"4,15€",Per stuk,"83,00€",/l
99,Dove Men Deodorant Spray Clean Comfort 150 ml,https://cdn.carrefour.eu/160_05429535_8712561254595_00.jpeg,"4,19€",Per stuk,"28,60€",/l
100,Dove Men+ Care Spray Deodorant Extra Fresh 150 ml,https://cdn.carrefour.eu/160_05429536_8712561255530_00.jpeg,"2,72€",Per stuk,"18,67€",/l
101,Dove Men+Care Anti-Perspirant Sensitive Shield 150 ml,https://cdn.carrefour.eu/160_05429545_8712561255806_00.jpeg,"4,45€",Per stuk,"29,67€",/l
102,Dove Men+Care Spray Deodorant Invisible Dry 150 ml,https://cdn.carrefour.eu/160_05429552_8712561255585_00.jpeg,"2,79€",Per stuk,"18,60€",/l
103,Dove Men Deodorant Roller Clean Comfort 50 ml,https://cdn.carrefour.eu/160_05434680_96081693_00.jpeg,"4,95€",Per stuk,"99,00€",/l
104,Nivea Men Sensitive Cooling Scheergel 200 ml,https://cdn.carrefour.eu/160_05475111_4005900080400_00.jpeg,"3,19€",Per stuk,"15,95€",/l
105,Axe Compressed Spray Deodorant Black 100 ml,https://cdn.carrefour.eu/160_05525551_96100554_00.jpeg,"2,55€",Per stuk,"25,50€",/l
106,Got2b Gentleman Molding paste 100 ml,https://cdn.carrefour.eu/160_05542796_5410091718732_00.jpeg,"9,69€",Per stuk,"96,90€",/l
107,Tabac Original After Shave Lotion 100 ml,https://cdn.carrefour.eu/160_05620150_4011700431021_01.jpeg,"27,15€",Per stuk,"271,50€",/l
108,Dove Men+ Care Douchegel Cool Fresh 250 ml,https://cdn.carrefour.eu/160_05668954_8710908317361_00.jpeg,"3,65€",Per stuk,"14,60€",/l
109,Sanex Men Natur Protect Respect & Control 24h Deodorant Spray 200 ml,https://cdn.carrefour.eu/160_05678126_8718951087460_00.jpeg,"3,45€",Per stuk,"17,25€",/l
110,Sanex Men Sensitive Deodorant Spray 200 ml,https://cdn.carrefour.eu/160_05678141_8718951087439_00.jpeg,"3,45€",Per stuk,"17,25€",/l
111,Sanex Men Extra Control Deodorant Spray 200 ml,https://cdn.carrefour.eu/160_05678146_8718951087422_00.jpeg,"3,45€",Per stuk,"17,25€",/l
112,Les Cosmétiques Design Paris Science Shampoo Stralende Kleur 300 ml,https://cdn.carrefour.eu/160_05229847_3560070627684_00.jpeg,"1,99€",Per stuk,"6,63€",/l
113,L'Oréal Paris Studio Line Out of Bed Fibre-Cream 150 ml,https://cdn.carrefour.eu/160_05391139_3600522471158_00.jpeg,"5,15€",Per stuk,"34,33€",/l
114,Mennen Stick Large Green 50 ml,https://cdn.carrefour.eu/160_05464170_3058320026016_00.jpeg,"5,59€",Per stuk,"111,80€",/l
115,Nivea Men Deep Comfort After Shave Lotion 100 ml,https://cdn.carrefour.eu/160_06020797_4005900498380_00.jpeg,"8,89€",Per stuk,"88,90€",/l
116,Axe Douchegel Dark Temptation 400 ml,https://cdn.carrefour.eu/160_05984009_8710447284094_00.jpeg,"3,69€",Per stuk,"9,23€",/l
117,Denim Eau de Toilette Gold 100 ml,https://cdn.carrefour.eu/160_05472139_8008970038278_00.jpeg,"15,25€",Per stuk,"152,50€",/l
118,Nivea Men Cool Kick 48H Anti-Transpirant 50 ml,https://cdn.carrefour.eu/160_06010502_42345206_00.jpeg,"4,25€",Per stuk,"85,00€",/l
119,Gillette SkinGuard Sensitive Scheergel Voor Mannen 200 ml,https://cdn.carrefour.eu/160_06140542_7702018493760_00.jpeg,"5,65€",Per stuk,"28,25€",/l
120,Axe Bodyspray Compressed Spray Deodorant Dark Temptation 100 ml,https://cdn.carrefour.eu/160_05488960_96098608_00.jpeg,"3,99€",Per stuk,"39,90€",/l
121,Exclusive Gentlemen Douchegel Kruiden-Peper 250 ml,https://cdn.carrefour.eu/160_05548074_3560071194253_00.jpeg,"1,75€",Per stuk,"7,00€",/l
122,Sanex Men Active Control 48h Anti Transpirant Deodorant Roller 50 ml,https://cdn.carrefour.eu/160_05665381_8718951087385_00.jpeg,"4,15€",Per stuk,"83,00€",/l
123,Sanex Men Natur Protect 24H Respect & Control Deodorant Roller 50 ml,https://cdn.carrefour.eu/160_05665383_8718951087415_00.jpeg,"4,15€",Per stuk,"83,00€",/l
124,Dove Men Deodorant Spray Clean Comfort 150 ml,https://cdn.carrefour.eu/160_05429535_8712561254595_00.jpeg,"4,19€",Per stuk,"28,60€",/l
125,Dove Men+ Care Spray Deodorant Extra Fresh 150 ml,https://cdn.carrefour.eu/160_05429536_8712561255530_00.jpeg,"2,72€",Per stuk,"18,67€",/l
126,Dove Men+Care Anti-Perspirant Sensitive Shield 150 ml,https://cdn.carrefour.eu/160_05429545_8712561255806_00.jpeg,"4,45€",Per stuk,"29,67€",/l
127,Dove Men+Care Spray Deodorant Invisible Dry 150 ml,https://cdn.carrefour.eu/160_05429552_8712561255585_00.jpeg,"2,79€",Per stuk,"18,60€",/l
128,Dove Men Deodorant Roller Clean Comfort 50 ml,https://cdn.carrefour.eu/160_05434680_96081693_00.jpeg,"4,95€",Per stuk,"99,00€",/l
129,Nivea Men Sensitive Cooling Scheergel 200 ml,https://cdn.carrefour.eu/160_05475111_4005900080400_00.jpeg,"3,19€",Per stuk,"15,95€",/l
130,Wilkinson Sword 125 g,https://cdn.carrefour.eu/160_00965104_4027800920501_01.jpeg,"2,94€",Per stuk,"24,50€",/kg
131,Pétrole Hahn Shampoo Kracht Vitaliteit Normaal Haar 250 ml,https://cdn.carrefour.eu/160_04025802_3140100143065_00.jpeg,"4,85€",Per stuk,"19,40€",/l
132,Pétrole Hahn Shampoo Anti-Haaruitval Kracht 250 ml,https://cdn.carrefour.eu/160_04025823_3140100143119_00.jpeg,"4,85€",Per stuk,"19,40€",/l
133,Rexona Men Deodorant Stick Cobalt Dry 50 ml,https://cdn.carrefour.eu/160_01638248_73103714_00.jpeg,"3,45€",Per stuk,"71,00€",/l
134,Gillette BlueII Plus Wegwerpmesjes Voor Mannen x10,https://cdn.carrefour.eu/160_06168451_7702018466917_00.jpeg,"6,79€",Per stuk,"6,79€",/stuk
135,Nivea Men Cool Kick 48h Anti-Transpirant 150 ml,https://cdn.carrefour.eu/160_06010441_4005900457509_00.jpeg,"3,29€",Per stuk,"21,93€",/kg
136,Nivea Men Anti-Transpirant Fresh Active 48h 50 ml,https://cdn.carrefour.eu/160_06018310_42345183_00.jpeg,"2,38€",Per stuk,"47,60€",/l
137,Schwarzkopf Gliss Kur Liquid Silk Anti-Klit Spray 200 ml,https://cdn.carrefour.eu/160_06085941_5410091659639_00.jpeg,"7,99€",Per stuk,"39,95€",/l
138,King C. Gillette Draadloze Baardtrimmerkit Voor Heren,https://cdn.carrefour.eu/160_06510778_7702018545049_00.jpeg,"36,15€",Per stuk,"36,15€",/stuk
139,"King C. Gillette Double Edge Safety Razor mesjes, 10 Navulmesjes",https://cdn.carrefour.eu/160_06510707_7702018545018_00.jpeg,"5,25€",Per stuk,"0,53€",/stuk
140,Nivea Men Strong Power Shampoo 250 ml,https://cdn.carrefour.eu/160_06337168_4005900718501_00.jpeg,"3,65€",Per stuk,"15,16€",/l
141,Pantene Pro-V Glad & Zijdezacht Miracle Serum Conditioner 200ml,https://cdn.carrefour.eu/160_06423881_8001841628783_00.jpeg,"4,99€",Per stuk,"24,95€",/l
142,Pantene Pro-V Volume & Body Miracle Serum Voedende Conditioner 200ml,https://cdn.carrefour.eu/160_06423889_8001841628813_00.jpeg,"4,99€",Per stuk,"24,95€",/l
143,"Pantene Pro-V Repair & Protect Shampoo, Voor Beschadigd Haar, 250ml",https://cdn.carrefour.eu/160_06423890_8001841725673_00.jpeg,"4,19€",Per stuk,"16,76€",/l
144,Pantene Repair &Protect Miracle Serum Conditioner Collageen 200ml,https://cdn.carrefour.eu/160_06423891_8001841628752_00.jpeg,"4,99€",Per stuk,"24,95€",/l
145,Pantene Pro-V Classic Clean 3-in-1 Shampoo - 225ml,https://cdn.carrefour.eu/160_06426566_8001841725796_00.jpeg,"4,85€",Per stuk,"21,56€",/kg
146,Pantene Pro-V Glad & Zijdezacht 3-in-1 225ML,https://cdn.carrefour.eu/160_06427554_8001841725765_00.jpeg,"5,09€",Per stuk,"22,62€",/l
147,Fructis - Hairfood Banana - Masker - 390ml,https://cdn.carrefour.eu/160_06007390_3600542129275_00.jpeg,"6,35€",Per stuk,"16,28€",/l
148,WILKINSON SWORD Hydro3 Scheermesjes 4 st,https://cdn.carrefour.eu/160_05762318_4027800102006_00.jpeg,"12,49€",Per stuk,"12,49€",/stuk
149,"Braun Series3 3000BT Elektrisch Scheerapparaat, Scheermes Zwart/Grijs",https://cdn.carrefour.eu/160_05837541_4210201151500_00.jpeg,"89,99€",Per stuk,"89,99€",/stuk
150,Nivea Men Sensitive Protect 48h Anti-Transpirant 150 ml,https://cdn.carrefour.eu/160_06010512_4005900457561_00.jpeg,"3,09€",Per stuk,"20,60€",/l
151,Nivea Men Protect & Care 48h Anti-Transpirant 150 ml,https://cdn.carrefour.eu/160_06010515_4005900457707_00.jpeg,"3,95€",Per stuk,"26,33€",/l
152,Nivea Men Black & White Invisible Original 48h Anti-Transpirant 50 ml,https://cdn.carrefour.eu/160_06018317_42345145_00.jpeg,"2,55€",Per stuk,"53,00€",/l
153,Wilkinson Sword Quattro Titanium Sensitive met Aloë 7 Stuks,https://cdn.carrefour.eu/160_05865377_4027800899838_00.jpeg,"13,15€",Per stuk,"1,88€",/stuk
154,Wilkinson Sword Extra 3 Sensitive 8 Stuks,https://cdn.carrefour.eu/160_06030473_4027800004904_00.jpeg,"11,05€",Per stuk,"11,05€",/stuk
155,Rexona Men Spray Deodorant Invisible Black & White Clothes 150 ml,https://cdn.carrefour.eu/160_05817407_8712561534444_00.jpeg,"4,65€",Per stuk,"31,93€",/l
156,Dove Men+ Care Spray Deodorant Cool Fresh 150 ml,https://cdn.carrefour.eu/160_05825648_8710908325687_00.jpeg,"5,19€",Per stuk,"34,60€",/l
157,Urtekram Shampoo Rasul Volume 250 ml,https://cdn.carrefour.eu/160_05800055_5765228837160_00.jpeg,"7,95€",Per stuk,"31,80€",/l
158,Urtekram Shampoo Rosemary Fine Hair 250 ml,https://cdn.carrefour.eu/160_05800095_5765228837153_00.jpeg,"7,95€",Per stuk,"31,80€",/l
159,Urtekram Shampoo Tea Tree Irritated Scalp 250 ml,https://cdn.carrefour.eu/160_05800196_5765228837146_00.jpeg,"7,95€",Per stuk,"31,80€",/l
160,Fa Sport Deodorant Verstuiver 75 ml,https://cdn.carrefour.eu/160_05708601_5410091730109_00.jpeg,"3,69€",Per stuk,"49,20€",/l
161,Fa Men Extreme Cool Deodorant spray - 150 ml,https://cdn.carrefour.eu/160_05601696_5410091675752_00.jpeg,"2,46€",Per stuk,"16,40€",/l
162,Taft Remoldable cream paste jar 150 ml,https://cdn.carrefour.eu/160_05755845_5410091730529_00.jpeg,"5,29€",Per stuk,"35,27€",/l
163,Nectar of Beauty Omhullend Masker met Avocado en Galam 300 ml,https://cdn.carrefour.eu/160_05781120_3560070969319_00.jpeg,"3,39€",Per stuk,"11,30€",/l
164,Nivea Men Hydratant Originals Face Wash Gel Fresh Wake Up 100 ml,https://cdn.carrefour.eu/160_04749236_4005808227822_00.jpeg,"8,75€",Per stuk,"87,50€",/l
165,Dove Men+ Care Douchegel Extra Fresh 250 ml,https://cdn.carrefour.eu/160_04883736_8717644598849_00.jpeg,"4,69€",Per stuk,"18,76€",/l
166,Axe Pot Wax Urban 130 ml,https://cdn.carrefour.eu/160_05662767_96082508_00.jpeg,"6,35€",Per stuk,"48,85€",/l
167,Williams Scheerschuim Gevoelige Huid 200 ml,https://cdn.carrefour.eu/160_05816417_3181730117767_00.jpeg,"4,49€",Per stuk,"23,25€",/l
168,Pantene Pro-V Glad & Zijdezacht 3-in-1 225ML,https://cdn.carrefour.eu/160_06427554_8001841725765_00.jpeg,"5,09€",Per stuk,"22,62€",/l
169,Sanex Men Gevoelige Huid Douchegel 250 ml,https://cdn.carrefour.eu/160_05664432_8718951059504_00.jpeg,"3,99€",Per stuk,"15,96€",/l
170,Taft Remoldable cream paste jar 150 ml,https://cdn.carrefour.eu/160_05755845_5410091730529_00.jpeg,"5,29€",Per stuk,"35,27€",/l
171,Nectar of Beauty Omhullend Masker met Avocado en Galam 300 ml,https://cdn.carrefour.eu/160_05781120_3560070969319_00.jpeg,"3,39€",Per stuk,"11,30€",/l
172,Williams Scheerschuim Gevoelige Huid 200 ml,https://cdn.carrefour.eu/160_05816417_3181730117767_00.jpeg,"4,49€",Per stuk,"23,25€",/l
173,Fructis - Strength & Shine 2en1 - Shampoo - Normaal Haar- 250ml,https://cdn.carrefour.eu/160_05849287_3600541978072_00.jpeg,"4,09€",Per stuk,"16,36€",/l
174,Head & Shoulders Classic Conditioner Voor Haar En Hoofdhuid 220ml,https://cdn.carrefour.eu/160_06227643_8001841136929_00.jpeg,"5,29€",Per stuk,"24,05€",/l
175,Axe Douchegel Ice Chill 250 ml,https://cdn.carrefour.eu/160_06135201_8717163648681_00.jpeg,"4,45€",Per stuk,"17,80€",/l
176,Nivea Express Mild Shampoo & Conditioner Aloe Vera pH Balance 400 ml,https://cdn.carrefour.eu/160_06454818_9005800223261_00.jpeg,"4,79€",Per stuk,"11,98€",/l
